Title	Link	Creator	Transcript	Status
Anesthesiologist murders a colleague	https://www.youtube.com/watch?v=9yni_1zFn4g	Doctor Myro	one of the most shocking murders of 2022 is by a doctor Ronaldo Ortiz an anesthesiologist out of Dallas if this is surveillance footage of him tempering with IV bags outside of the operating room into which he allegedly injected poisonous medications one of his colleagues who used one of these bags to rehydrate herself suffered cardiac arrest and died it was noticed that after he was depositing these bags otherwise healthy patients would have cardiac complications that were unexpected this led to cardiac emergencies in 11 patients in the death of a colleague	Success
Anesthesiologist murders a colleague	https://www.youtube.com/watch?v=9yni_1zFn4g	Doctor Myro	one of the most shocking murders of 2022 is by a doctor Ronaldo Ortiz an anesthesiologist out of Dallas if this is surveillance footage of him tempering with IV bags outside of the operating room into which he allegedly injected poisonous medications one of his colleagues who used one of these bags to rehydrate herself suffered cardiac arrest and died it was noticed that after he was depositing these bags otherwise healthy patients would have cardiac complications that were unexpected this led to cardiac emergencies in 11 patients in the death of a colleague	Success
Doctor Reacts: octopus on her face?!	https://www.youtube.com/watch?v=gRLpP0a_6QU	Doctor Myro	easily the best medical advice I give you if you you find a creature and you expert in that creature do not touch it do not pet it do not come close to it and do not take selfies with it	Success
WhatÂs wrong with his leg?	https://www.youtube.com/watch?v=I7ixSN5RZuM	Doctor Myro	oh this is so sad to see this is lymphadema it is when the lymphatic system is broken and Ena to drain fluid from an extremity it can be inherited a result of surgery or from a bug bite	Success
Is this treatment safe?!	https://www.youtube.com/watch?v=poiM4dDpVyU	Doctor Myro	so after this video you decided you wanted to go and see a chiropractor and chiropractors claim a lot of things that they help with but here this is straight from the Harvard Medical School website 2018 study 750 active military recruits and after 12 sessions those that got Chiropractic Care showed less pain intensity higher satisfaction and less pain medicine now I wouldn people get strokes and they get paralyzed after oh my God now low back pain yeah there whoever you go see make sure they licensed because this guy in this video not a chiropractor	Success
THIS is what fertilization looks like	https://www.youtube.com/watch?v=ecC6vHIe-70	Doctor Myro	intracytoplasmic sperm injection that what that is this is the egg this pipet provides a gentle suction to stabilize it in place a micro pipet is then inserted inside of the egg and a single sperm is injected inside [Music] you typically done if the sperm quality or quantity is insufficient wow amazing	Success
Doctor Reacts: choking on an orange?!	https://www.youtube.com/watch?v=pVponJT3DIw	Doctor Myro	looks like he hole all right somebody who deals with Airways I am very concerned oh out	Success
Why are you paralyzed for intubation?	https://www.youtube.com/watch?v=2-Lw6sdXd7g	Doctor Myro	this is actually a fantastic question why do doctors paralyze you for the intubation and just to remind you intubations when we place a breathing tube to help you breathe it pretty much for all kinds of general anesthesia and just to calm any fears we actually give you the anesthesia first you fall asleep and then we paralyze you so you that would that be good so in order to place the breathing tube we need to have all the muscles over here relaxed now we can do that by just giving you a ton of anesthesia but what happens is anesthesia has side effects and these side effects actually reduce your blood pressure reduce your heart function amongst many other things so in order to avoid these side effects we only give you enough anesthesia for you to fall asleep and then we use the paralytic medications to actually relax all these muscles to facilitate the intubation	Success
Becoming a Savant After Brain Surgery - Doctor Reacts #doctors #shorts	https://www.youtube.com/watch?v=U8gEwwgRYyM	Doctor Myro	so this is acquired savant syndrome it been described after stroke injury and surgery and the medical community has no idea why it happens	Success
Doctor Reacts: ankle shaman?!	https://www.youtube.com/watch?v=Cg3ITLYYMuI	Doctor Myro	POV you spray your ankle in the middle of the Amazon and a shaman tries to heal you by hitting you with a thousand Thorns ouch this actually does work it gate theory of pain let your knee you have pain what thing that you do you rub it aggressively you add a lot of sensation and all that Sensation from the rubbing or from the Thorns actually travels along fast nerve fibers and gu to your spinal cord before the pain signal encloses the gate cuz there much bandwidth less pain signals means you feel less pain and by the way this is exactly how spinal cord stimulators work we put those in your back to do exactly this	Success
Doctor Reacts: extreme cyst treatment	https://www.youtube.com/watch?v=1c5iIlufibM	Doctor Myro	oh come on an Axe really so that is a gangan cyst it is a cyst filled with fluid you can rupture it you can burst it like this but it right back you should get surgery instead	Success
Our doctor fits for the week!	https://www.youtube.com/watch?v=43ZXJBc3Zmg	Doctor Myro		"Error: Could not retrieve transcript: 
Could not retrieve a transcript for the video https://www.youtube.com/watch?v=43ZXJBc3Zmg! This is most likely caused by:

Subtitles are disabled for this video

If you are sure that the described cause is not responsible for this error and that a transcript should be retrievable, please create an issue at https://github.com/jdepoix/youtube-transcript-api/issues. Please add which version of youtube_transcript_api you are using and provide the information needed to replicate the error. Also make sure that there are no open issues which already describe your problem!"
This is what an Achilles tear looks like	https://www.youtube.com/watch?v=DguveIkNsF0	Doctor Myro	this is the most common way to tear your Achilles tendon watch this o explosive movements put a lot of pressure on the tendon that not going to be able to walk on your tippy toes probably will need surgery rehab can be up to 12 months long and it	Success
This babyÂs head is breathing?!	https://www.youtube.com/watch?v=HUsSu7DNzBk	Doctor Myro	can someone please tell me why this baby not breathing this is the heart pumping because guess what there up until 2 years old a baby can have a frontel an open sof spot with no bone and it can tell us a lot of information when it the baby bulging that can mean there pressure inside of the head like from an infection so again only a couple of membranes covering the brain in that soft spot so dropping your baby on the head not recommended	Success
Doctor Explains: zapping his heart	https://www.youtube.com/watch?v=lTEUiBTlMW0	Doctor Myro	this man procedure called cardiio version and it right clear holy yeah that one hurt mhm	Success
When your card declines at the hospitalÂ	https://www.youtube.com/watch?v=C4oe9okGkYM	Doctor Myro	that to do that the insurance industry is already ahead of us doing it before we even get there	Success
Doctor Reacts: oddly satisfying nasal rinse	https://www.youtube.com/watch?v=6wkdqmVsQec	Doctor Myro	you nasal rinses great wash out the allergens keep me close and moist wow how there just make sure you use sterile saline	Success
Doctor Reacts: popping a dislocated arm	https://www.youtube.com/watch?v=FEJ0F_7eO40	Doctor Myro	watch my dislocated arm get pop back in she has an anterior shoulder dislocation and this is madsense technique to relocate it watch the guy on the left he on the right is going to pull the shoulder away from her fatiguing the muscles while externally rotating the shoulder and then pop once it back instant relief she and probably some physical therapy for the next couple weeks	Success
This skin treatment is oddly satisfying!	https://www.youtube.com/watch?v=WjmwMqp4gC8	Doctor Myro	[Music] wow this is CO2 laser resurfacing essentially the laser heats up and vaporizes the epidermis which is the top layer of the skin that falls off and it also heats up the dermis a deeper layer which then stimulates more collagen production the skin that comes back is smoother and softer this is done usually under anesthesia	Success
How does the babyÂs skin look like that?	https://www.youtube.com/watch?v=VQUYfg_WM_0	Doctor Myro	how is it so dark when you [Music] dark yeah how how I don it but skin tone is an average of the two parents right wrong not that simple complexion is a result of mixing of at least seven different genes and some are dominant meaning they will overpower the recessive ones and also besides genetics how they here just minutes apart from the same parents with nearly the same genetic makeup yet their skin complexions very different	Success
Can you complete this hearing challenge?	https://www.youtube.com/watch?v=4uoU2kkIcIM	Doctor Myro	are your ears older than you take this test to find out when you stop hearing the noise stop the video that is the age of your ears the frequency with which you hear changes with age around here gets interesting you still in	Success
Infections you can get from a kiss ?? - #doctor #medical	https://www.youtube.com/watch?v=4n8HgeKBzIU	Doctor Myro		"Error: Could not retrieve transcript: 
Could not retrieve a transcript for the video https://www.youtube.com/watch?v=4n8HgeKBzIU! This is most likely caused by:

Subtitles are disabled for this video

If you are sure that the described cause is not responsible for this error and that a transcript should be retrievable, please create an issue at https://github.com/jdepoix/youtube-transcript-api/issues. Please add which version of youtube_transcript_api you are using and provide the information needed to replicate the error. Also make sure that there are no open issues which already describe your problem!"
How she lives without breathing!	https://www.youtube.com/watch?v=vOM9SBMs6wY	Doctor Myro	she is walking but she doesn breathe at all see those hoses coming out of her neck they contain blood and they go to the eemo machine which is right next to her ECMO provides oxygen and removes carbon dioxide so it can entirely replace the function of the lungs in her the replacement is partial as you see she oxygen this is a temporary treatment until a long transplant is available she year after lications of Co you trooper	Success
Anesthesiologists according to AI	https://www.youtube.com/watch?v=PVJBZMa_QdI	Doctor Myro	anesthesiologist according to AI yeah more anesthesiology ton of monitors okay all right okay extremely anesthesia let see oh come on across for puzzle on coffee most anesthesiology oh come on this is not come on 12 years of school and this is what you think	Success
Doctor Reacts: eyeball tatto?!	https://www.youtube.com/watch?v=TZ9D0l6vNkE	Doctor Myro	oh not the Eye Tattoo they ink into the Scara which is the white part of the eye this part of the eye is only a millimeter thick so if you puncture through that inject on the other side you will go blind do not recommend this	Success
Why a pregnancy test could be bad for MEN	https://www.youtube.com/watch?v=mtYZT_FJL8w	Doctor Myro	as a joke one man took a pregnancy test and it tested positive unfortunately that means he probably has cancer pregnancy test react to a hormone called beta HCG which is also produced by testicular cancer	Success
THIS could save your friendÂs life	https://www.youtube.com/watch?v=5GP7moTGJ80	Doctor Myro	your friend is out here them to a safe area put the legs together bend the knees step on their feet use it as the block grab their arms pull over yourself practice makes perfect	Success
Doctors on YouTube raking in $100,000+ in big pharma money	https://www.youtube.com/watch?v=e0PVtLrTxM4	Doctor Myro	there are doctors right here on this app talking to you taking hundreds of thousands of dollars from Big Pharma and that know who that you are receiving this website allows you to look up anyone any medical provider and see what payments they gotten and from whom and no spoilers here but you will be surprised	Success
Can you sneeze with your eyes open?	https://www.youtube.com/watch?v=99UOvYujuz8	Doctor Myro	your eyes close when you sneeze it reflex which you can fight but just remember like all online Trends there are consequences that might leave you looking like this	Success
Doctor Reacts: hand amputation?!	https://www.youtube.com/watch?v=V6ixZwW8k9k	Doctor Myro	moments before his hand amputation so bro basically just created a tourniquet stopping all blood flow to his hand and now it we try to keep tourits on for less than 2 hours to prevent any limb loss but in military situations they actually have kept on the tourus for more than 48 hours without any permanent damage to the limb	Success
Doctor Reacts: touching boiling oil?!	https://www.youtube.com/watch?v=oTuTRsdJJgY	Doctor Myro	obviously don reason why it works is he actually has water on his hands when in contact with the boiling oil the water instantly vaporizes creating a barrier of vapor between his hand and the oil this is called the light and frost effect and it when you put water in a h stove like this it looks like it it is floating on its own vapor and here is another human do not do at home example wow and that that many things that are hotter than that wow isn	Success
Doctor Reacts: preparing him for surgery	https://www.youtube.com/watch?v=ncv0lqhD4zA	Doctor Myro	[Music] standing this little boy is so brave this is anesthesia going directly into his Central circulation via a port you have to make sure there these can be lethal in children especially with heart abnormalities within seconds he will be asleep control there he goes you	Success
Doctor Reacts: eating tarantulas?!	https://www.youtube.com/watch?v=p4-poGO30Gw	Doctor Myro	in certain countries tarantulas are a delicacy but eating them raw possesses a number of health risks like ingesting toxic chemicals and exoskeletons they difficult to digest eating them cooked though is generally safe I	Success
Doctor Reacts: thrifting is dangerous?!	https://www.youtube.com/watch?v=it0Mz1o7wXI	Doctor Myro	everyone always says go to the Goodwill bins you cheap they don get hand foot and mouth disease like I did 2 weeks ago from digging around in the bins for 4 hours I didn adults could get that oh you absolutely can this disease is caused by caku virus which causes blistering in the hands feet and mouth and the Kaki virus is incredibly contagious there is no treatment you just have to let it resolve on its own	Success
How to breathe without breathing!	https://www.youtube.com/watch?v=epLL_MDv21o	Doctor Myro	when you can you this is an intubation procedure it starts by placing a luros scope into the mouth to retract the jaw at this point you to get the breathing tube in okay uh-oh okay well come on come on more this is giving me a lot of anxiety here okay okay okay so when the breathing tube is placed the lingos cope gets removed and then we can breathe for the patient through the breathing tube this is done typically when the patient cannot breathe by themselves either under anesthesia or for various medical conditions	Success
Doctor Reacts: poking his brain?!	https://www.youtube.com/watch?v=wIW1QsRUqvM	Doctor Myro	oh no no no you are literally touching his brain right now you see if you have a brain bleed or a tumor inside of your head we take the skull off and we do that to relieve the pressure inside of the head otherwise the brain will die when the patient is better we put the bone back on to prevent them from poking it like that	Success
THESE are everyoneÂs final regrets	https://www.youtube.com/watch?v=m4l2nYfYCvM	Doctor Myro	what would you change if you could be 30 again that is the question I ask my older patients typically those in the 80s or 9s my social experiment of sorts and I asked this when we to the operating room instead of small talk and I heard a lot of answers like I wish I took more risk or I wish I quit that job earlier I wish I didn what people thought of me earlier I wish I chased that love instead of letting her get away I wish I spent more time with my parents before they were gone my kids I wish I went on more vacations but one thing that nobody says I wish I worked more nobody says that	Success
Awake Fiberoptic Intubation for Airway Tumor	https://www.youtube.com/watch?v=dHFgw3-b7ss	Doctor Myro	[Music] this one is definitely not for the faint of heart the camera here is in the mouth that right there is the uvula and over here is the back of the tongue we advancing into the mouth and the reason why you see bubbling in the back is because the patient is still awake and breathing they operation speaking of that right there is not supposed to be there that is a big giant cancer that is obstructing their Airway which is why they have to place the breathing tube while the patient is still awake so now we gotta get around it [Music] wow tight squeeze that right there coming into the view is or the vocal cords they will advance the camera through the vocal cords and once they tube over the camera and then the patient can go off to sleep and the operation can start wow	Success
How you breathe during surgery	https://www.youtube.com/watch?v=fOmo15W6IA0	Doctor Myro	a breathing tube is usually placed in the mouth but not always and in this case it scope is still placed into the mouth so we can see where we tube is then Advanced into the nose until we see it on the screen go through the vocal cords a little bit of struggle here some rotation that can cause a sore throat afterwards and the breathing tube will sit there for the duration of the surgery	Success
Why strawberries are dirtier than you think	https://www.youtube.com/watch?v=j4hetP8ZvIQ	Doctor Myro	strawberry nice according to Scientific American Americans eat up to two pounds of maggots flies and other bugs every single year but that problem with strawberries because you might say it strawberries are actually number one on the dirty dozen list this is a list of all the produce that has the most pesticides in them strawberries are number one so then what do you do about the pesticides because those aren great for you and turns out that the best way to remove these pesticides after 93% of them is via ultrasonic cleaning but it have to buy it the next best thing that available to everybody take four cups of water 1 teaspoon of baking soda mix the two add in those berries in there let it soak for 5 10 minutes take them out look how dirty that water is obviously rinse them and that 90% of pesticides	Success
Weirdest swing IÂve ever seenÂ #doctor #shorts	https://www.youtube.com/watch?v=OFhGHsE5S4Q	Doctor Myro	thank you [Music] cervical traction is a treatment for neck pain that involves gentle traction on the neck to elongate the spine and create more space in between the vertebra and this right there is definitely not how you do that	Success
Doctor Reacts: finger gloves?	https://www.youtube.com/watch?v=4YB6w1uf6PY	Doctor Myro	what do you think about this invention for the germaphobe in you never touch sticky hand sanitizer again for pin pads dirty elevator buttons immun to compromise patients Maybe	Success
Doctors Explain: how to save a life (With @FootDocDana)	https://www.youtube.com/watch?v=coIPkpL3Fik	Doctor Myro	you got to know this your friend is bleeding out you might know to use a tourniquet so what might think to do use a belt yeah put on the Belt except that doesn this out so the first part she on a belt and as you can see it quite tight enough mhm it she starts twisting the tourniquet that Rod only then does it stop bleeding a so instead of just about try this take a t-shirt tie it around the extremity in a knot put a object through the knot and twist it did right there	Success
Taylor Swift Under Anesthesia - Anesthesiologist Reacts #funny	https://www.youtube.com/watch?v=jzWIGs0rfnM	Doctor Myro	your mom may or may not have videotaped you after surgery another interesting on the seizure reaction coming out and she gave us the video I don wait this is there we go world premier you gotta check this out someone I wanted stop you can okay but what do we do with this now but it doesn she asleep my mind is alive and that after 12 hours [Music] [Applause] [Music]	Success
Doctor Reacts: toe for a thumb?!	https://www.youtube.com/watch?v=L_z154zGOLY	Doctor Myro	something wrong with the thumb here this is a toe thumb it variant affecting up to 2% of the population and there with it	Success
Doctor Reacts: passing out from deadlifting?	https://www.youtube.com/watch?v=b0akx2xIZwA	Doctor Myro	holding your breath straining really hard stops the blood from going into the heart and thus into the brain now is anybody going to come and save him and are they doing the right thing if you have a seizure you want to turn the person to the side so they don in their own secretions but this guy is not seizing ghee very simply does not have any blood in his brain so what you want to do is raise the legs up so he drains the blood back into the heart and into the brain and then he	Success
Is this a sign of iron deficiency?	https://www.youtube.com/watch?v=dkfK-EqWUUM	Doctor Myro	my wedding ring does this to me every other month what is that so iron deficiency can make you pale cold brittle nails hair loss it can even make you crave eating dirt or ice that the residue around the finger unfortunately has nothing to do with iron deficiency so that might be a rather uncomfortable conversation with your husband Andor his Jeweler	Success
Doctor Reacts: tattoo in the operating room	https://www.youtube.com/watch?v=b6WOyG_Ah7s	Doctor Myro	[Music] all right let operating room and we tattoo interesting place to get tattoo but all right walking in checking the equipment all the anesthesia things need to be ready sending some releases because there are risks to Anesthesia go pling that tattoo monitors are going on here that Rhythm looks wonky I would check the placement of those stickers we go getting some oxygen oh that lot of oxygen to get for sedation especially if you to Nal can later anyway moving on here we are getting a tattoo and I I I tattoo under anesthesia this seems excessive to say the least but you know tattoo seems like it is a very painful area to get a tattoo which over the ribs very sensitive but I say the least you got oldia stopping there in the o	Success
SheÂs giving herself anesthesia?!	https://www.youtube.com/watch?v=xNzFOLpJTBA	Doctor Myro	[Music] this patient came in requesting to do her own anesthesia obviously anesthesiologists didn a good idea but here we are [Music]	Success
What happens when you donÂt shower ??	https://www.youtube.com/watch?v=IM-n9BwFDVM	Doctor Myro	this is what happens when you don shower for 5 years this patient got depressed they stopped going outside and stop showering and now their skin and keratin deposits on top of their skin that have to be surgically removed	Success
Smokers lungs looks like this (with @FootDocDana) #doctor	https://www.youtube.com/watch?v=7AzOWNhhI-Y	Doctor Myro	these are healthy lungs and these are lungs of a smoker think twice before you smoke	Success
WhatÂs wrong with his eye?!	https://www.youtube.com/watch?v=YVuVm9e-lyg	Doctor Myro	so you got punched in the face and now you have Rice Krispies in your eye it a result of an orbital fracture where the air from the sinuses goes into your orbital cavity this can also happen with forceful sneezing the builtup pressure during the sneeze can even rupture eye blood vessel or rupture our brain aneurysm so when you sneeze just let it go do not hold the pressure in	Success
How surgeons change a battery!	https://www.youtube.com/watch?v=dyUky3Sn5nU	Doctor Myro	[Music] using the saw too much in surgery the batter is out this is how we change it steril back in business	Success
Doctor Reacts: hand amputation?!	https://www.youtube.com/watch?v=IJw-Lpb5a08	Doctor Myro	moments before his hand amputation so bro basically just created a tourniquet stopping all blood flow to his hand and now it we try to keep tourits on for less than 2 hours to prevent any limb loss but in military situations they actually have kept on the tourus for more than 48 hours without any permanent damage to the limb	Success
Did the gym give him hypertension?!	https://www.youtube.com/watch?v=oaKIqoPLNY8	Doctor Myro	going to the gym for 17 years straight only to get your LS back to show you have pre hypertension and dangerously high levels of creatinin your creatinine levels are high because you supplements or you bodybuilder or your kidneys are failing I think one is the most likely I stick with that one nothing to worry about but hypertension high blood pressure 50% of us adults have hypertension and they don huge problem because high blood pressure causes heart attacks strokes and increases the risk of death and diet and exercise lowers the risks of all those things and decreases the risk of getting hypertension but now you have hypertension why who knows genetics Bad Luck sucks honestly but medications that lower your blood pressure also reduce those very same things they reduce risk of heart attacks strokes and deaths so continue to exercise for sure but get checked out	Success
Pigg-O-Stat - This device is still in use since 1960s	https://www.youtube.com/watch?v=CM4MMtICKwM	Doctor Myro	I want to go home I don don this device is called the pigo stat it been used since 1960s to reduce movement of kids during x-rays this actually reduces the amount of radiation that they get fewer retakes less radiation	Success
