Title	Link	Creator	Transcript	Status
Doctor Explains: dissolvable stitches	https://www.youtube.com/watch?v=SBxm_2YHBnI	Doctor Myro	have you heard of a dissolvable stitch well this is what we we technique here each bite is going through the dermal layer not the epidermis but the deeper dermis which is a tougher layer you can do this one at a time but here we continuous technique which means each bite forms essentially a human zipper when you pull in it it just Zips it up and the end is the most important part you have to tie a knot that doesn loose cuz otherwise the whole thing comes undone but the knot can just hang out above the skin cuz it infection so you end up burying it underneath the skin like so	Success
THIS is how you should react when your baby falls	https://www.youtube.com/watch?v=HrChyRfy1Ss	Doctor Myro	Proof that how you react matters. Whoops. What did you do? Ah, so cute. So, does it matter? You see, kids take cues from you to figure out the world. Is it scary? Save. No big deal. Obviously, you want to keep them safe, but you also want to give them confidence to explore again. If you do that, they learn how to recover emotionally. That huge.	Success
Dramatic Reaction to Propofol Anesthesia #shorts	https://www.youtube.com/watch?v=4wGQAEUWs8U	Doctor Myro	going to sleep with propofol let I that seconds	Success
They say anesthesia brings out your truest personalityÂ	https://www.youtube.com/watch?v=fFLMyZvsNtc	Doctor Myro	if they say anastesia brings out your truest personality Disneyland yeah we can we can uh we can talk about going to Disneyland yeah I don though that or two though when probably in the summer time that so far away it you want to go noos is it the truest money you don that	Success
Doctor Reacts: extreme throat ??	https://www.youtube.com/watch?v=Mc2DEGFM7sE	Doctor Myro	sir this is not a toy this is a l mask Airway it ambulance or for surgery under anesthesia always an unconscious patience wow	Success
My account got reported?!	https://www.youtube.com/watch?v=K8br-SkMKP0	Doctor Myro		"Error: Could not retrieve transcript: 
Could not retrieve a transcript for the video https://www.youtube.com/watch?v=K8br-SkMKP0! This is most likely caused by:

Subtitles are disabled for this video

If you are sure that the described cause is not responsible for this error and that a transcript should be retrievable, please create an issue at https://github.com/jdepoix/youtube-transcript-api/issues. Please add which version of youtube_transcript_api you are using and provide the information needed to replicate the error. Also make sure that there are no open issues which already describe your problem!"
Why shopping carts could make you sick!	https://www.youtube.com/watch?v=Rliz2G59ccw	Doctor Myro	puts baby in the shopping cart for the first time and gets a horrible case of handful of mouth disease so that viral infection it you get them from public spaces like Goodwill bins or shopping carts so the way to avoid this is wipe things down cover your kids and maybe even be that crazy person who wears gloves in the store	Success
Why Q tips are NOT for cleaning ears	https://www.youtube.com/watch?v=-z7kO43lJZs	Doctor Myro	and this is why you should never clean your ears when you use a Q-tip you actually do the opposite you end up pushing ear wax farther inside of the ear canal where it can form an earwax plug and yeah sometimes people actually have to go to the hospital to get these removed wow satisfying to watch though huh wow	Success
Flesh Eating Bacteria in an Oyster?	https://www.youtube.com/watch?v=qKyleOefAVA	Doctor Myro	this is why it here and I don but you oysters amongst many other things raw oysters can contain vibrio have you heard of vibrio yeah you have it called flesh eating bacteria and that exactly what it can do it can fleshy your appendages require amputations it can take you to the ICU and one in five actually die despite Optimal Care there that can clip you at 20 rate and this is one of them	Success
Cardiac Anesthesiologist makes $700k?	https://www.youtube.com/watch?v=qlDSpClm4u8	Doctor Myro	so I advice time well if you found like 200 sometimes it like 700. what makes the difference between such a work how is your work like balance I kids they missed anything of any importance with any of them as they were growing up I one of the people that really cares about that how has your experience been in your field I very lucky how do you get into this so after college went to medical school and then did four years of residency in anesthesia I wasn to do what kind of doctor I wanted to be and then people told me hey a lot of people going into this because it a nice work-life balance depending on how you want to play it so if you like in a really big group I big group that allows me and other people in the group to have more flexibility whereas if you solo practitioner it do that what are the pros and cons of your job in general the pros are I get a lot of job satisfaction taking care of people and what I do	Success
Why sleep deprivation is DANGEROUS	https://www.youtube.com/watch?v=_pUgMZP4fXI	Doctor Myro	If you think you can survive on four to 5 hours of sleep per night, think again because you will have an early death. Studies have repeatedly shown that the optimal amount of sleep is 7 to 9 hours, preferably at least seven. Sleeping more than 9 hours might also be bad, but sleeping less than 6 might be one of the worst things you can do for yourself. So many studies have shown all across the board increased cardiovascular disease, strokes, heart attacks, obesity, cancer, early	Success
Narcan be likeÂ	https://www.youtube.com/watch?v=jUSulvGlkzo	Doctor Myro	overdose is now the number one cause of death less than 40 Narcan is the solution it works in about 2 minutes bam what [Music] what up hey let	Success
WhatÂs on her eye?!	https://www.youtube.com/watch?v=YqGmX3288sg	Doctor Myro		"Error: Unexpected error: 
Could not retrieve a transcript for the video https://www.youtube.com/watch?v=YqGmX3288sg! This is most likely caused by:

YouTube is blocking requests from your IP. This usually is due to one of the following reasons:
- You have done too many requests and your IP has been blocked by YouTube
- You are doing requests from an IP belonging to a cloud provider (like AWS, Google Cloud Platform, Azure, etc.). Unfortunately, most IPs from cloud providers are blocked by YouTube.

There are two things you can do to work around this:
1. Use proxies to hide your IP address, as explained in the \"Working around IP bans\" section of the README (https://github.com/jdepoix/youtube-transcript-api?tab=readme-ov-file#working-around-ip-bans-requestblocked-or-ipblocked-exception).
2. (NOT RECOMMENDED) If you authenticate your requests using cookies, you will be able to continue doing requests for a while. However, YouTube will eventually permanently ban the account that you have used to authenticate with! So only do this if you don't mind your account being banned!

If you are sure that the described cause is not responsible for this error and that a transcript should be retrievable, please create an issue at https://github.com/jdepoix/youtube-transcript-api/issues. Please add which version of youtube_transcript_api you are using and provide the information needed to replicate the error. Also make sure that there are no open issues which already describe your problem!"
Doctor Explains: the medication that stops your heart ??	https://www.youtube.com/watch?v=Q9x4D7G_sPo	Doctor Myro	this medication stops your heart it called adenosine and we use it when the heart is beating out of control in an arhythmia called SBT and it flatlines the heart the heart is now stopped and it button and then you have to wait and the heart I to come back and then it comes back and you hope the rhythm is normal	Success
This dog is hungrier than it looks ??	https://www.youtube.com/watch?v=vtU-5U-mm64	Doctor Myro	oh so cute and innocent looking you know what he checking to see if you if you to eat you and according to a 2015 study a quarter of the dogs will start eating you in the first 24 hours after you pass even when dog food is available	Success
Doctor Reacts to WILD abilities	https://www.youtube.com/watch?v=vn9ftjsSTpk	Doctor Myro	all right let me in today all right you can that you can either he probably has cleff pellet which is something you can be born with oh don thing you can it all right that that [Music] okay oh oh super flexible maybe he downloads or he	Success
Why you should NEVER ignore a UTI	https://www.youtube.com/watch?v=eb4052A0Bac	Doctor Myro	don untreated it landed her in the hospital because of sepsis and over 200,000 women die of sepsis each year this can happen because your UTI bacteria can actually follow up into your kidney causing pile nefritis or infection of the kidney can then spread into the bloodstream that called sepsis and so this can cause you to lose your kidney or your life	Success
WhatÂs coming out of his nose?!	https://www.youtube.com/watch?v=k3gU4ibvAXw	Doctor Myro	[Music] It Year oh he [Music] upset considering there are no good medications that are approved for kids under four for upper respiratory infections nasal rinses are a natural alternative to improve symptoms and might even short URI duration it can work great for allergies too washing out those allergens 10 out of 10 mom great work but and this is important nasal rinses can actually be deadly and that is if you use tap water which can contain the Glaria fer and amoeba that basically eats your brain causing Amic and sephtis so if you this use sterile saline or boiled water	Success
YouÂll want to wash your hands after this video (With @FootDocDana)	https://www.youtube.com/watch?v=_oC-zR7y0z4	Doctor Myro	this hand looks clean to the naked eye but is it let look at all that stuff that is nasty this is probably just some dirt particles a little tiny stray here here but it there can be over 3 000 different types of germs on this hand so what you got to do you gotta wash your hands hand hygiene is super important it can help reduce up to 50 of preventable infection yeah	Success
Doctor Reacts: seizure in public?	https://www.youtube.com/watch?v=Lop8JjoztC4	Doctor Myro	[Music] if somebody onto the ground pat their head with something soft and turn them onto the [Music] side	Success
Why I couldnÂt work in the ER #doctors #shorts and thank you to all that could!!!	https://www.youtube.com/watch?v=itBYENSIIQE	Doctor Myro	oh	Success
Doctor Reacts: lint rolling a sunburn?!	https://www.youtube.com/watch?v=Dab7N81L7cU	Doctor Myro	Li roller on sunburn oh my goodness so these flakes is dead skin the UV radiation from the Sun basically breaks up the DNA in the skin the cells die so these are the flakes are dead but they life healthy tissue that and by tearing them you tear and you kill the healthy cells and that can lead to more pain scarring infection	Success
Doctor Explains: colonoscopy	https://www.youtube.com/watch?v=pGl-G-xN3_Q	Doctor Myro	a colonoscopy or a camera up your blank is a number one way of preventing colon cancer it for anybody over age of 45 we look for any abnormalities in your colon such as polyps or growths that can be removed before they become this obstructing cancer	Success
Ozempic and Viagra?! - what do they have in common?	https://www.youtube.com/watch?v=38_04_Mjv3A	Doctor Myro	ozampic and Viagra what do they have in common I doctor and I in Rogaine into the mix as well you know the medicine used to treat hair loss so Rogaine was developed in 1960s to treat high blood pressure but in research studies they noticed that all the Bold guys weren side effect they were growing hair and Viagra followed a very similar path it was also used to treat high blood pressure and in clinical trials they noticed that the men were awfully happy huh and the wives were even happier something was up and now it treat erectile dysfunction and ozempic followed exactly the same path it was a diabetic drug being studied for diabetes and they noticed that people were losing a ton of weight it was a desirable side effect	Success
Doctor Reacts: amazing medical technology!	https://www.youtube.com/watch?v=5TDCaij8a0k	Doctor Myro	when I say technology is both a blessing and a curse this is the blessing [Music] part wow that for him takes a lot of dedication and hard work [Music] but that right there it	Success
Doctor Reacts: spinal removal	https://www.youtube.com/watch?v=7Vg2l7EDBSo	Doctor Myro	this is a removal of temporary leads for a spinal cord stimulator system now this device sends electrical impulses directly into the spine and is used to control pain now unfortunately it doesn implanting the whole system underneath your skin we implant the electrodes only and use an external system to test to see if it works and if it does then we implant a device and if it doesn take them out	Success
Doctor Reacts: EpiPen fail	https://www.youtube.com/watch?v=Ib6q-Em1wdY	Doctor Myro	the girl on the right is having a severe allergic reaction let friend can save her life with an EpiPen that one did not fire let again it that one went into her own finger and now she has to go to the hospital too because the epinephrine in the EpiPen when given to somebody who an allergic reaction can be extremely dangerous it increase your blood pressure it can lead to stroke heart arhythmia remember with the EpiPen the needle is in the orange and so blue to the sky orange to the thigh otherwise you patients instead of one	Success
Why mosquitoes HATE body hair	https://www.youtube.com/watch?v=O-iA3B6bs0U	Doctor Myro	why do humans have body hair insulation sensation protection look at this mosquito and by the way only female mosquitoes bite the male ones just collect sap for flowers now do you think this female has any chance whatsoever	Success
Doctor Reacts: popping a cyst	https://www.youtube.com/watch?v=xHYWMISYkcg	Doctor Myro		"Error: Unexpected error: 
Could not retrieve a transcript for the video https://www.youtube.com/watch?v=xHYWMISYkcg! This is most likely caused by:

YouTube is blocking requests from your IP. This usually is due to one of the following reasons:
- You have done too many requests and your IP has been blocked by YouTube
- You are doing requests from an IP belonging to a cloud provider (like AWS, Google Cloud Platform, Azure, etc.). Unfortunately, most IPs from cloud providers are blocked by YouTube.

There are two things you can do to work around this:
1. Use proxies to hide your IP address, as explained in the \"Working around IP bans\" section of the README (https://github.com/jdepoix/youtube-transcript-api?tab=readme-ov-file#working-around-ip-bans-requestblocked-or-ipblocked-exception).
2. (NOT RECOMMENDED) If you authenticate your requests using cookies, you will be able to continue doing requests for a while. However, YouTube will eventually permanently ban the account that you have used to authenticate with! So only do this if you don't mind your account being banned!

If you are sure that the described cause is not responsible for this error and that a transcript should be retrievable, please create an issue at https://github.com/jdepoix/youtube-transcript-api/issues. Please add which version of youtube_transcript_api you are using and provide the information needed to replicate the error. Also make sure that there are no open issues which already describe your problem!"
Doctor Reacts: allergic to shellfish?!	https://www.youtube.com/watch?v=TeODXZCJRsI	Doctor Myro	EpiPen 15 years of being deathly allergic you cck it with your mouth don [Music] yeah so anaphylactic reaction is when your throat starts to close you can breathe and an EpiPen will save your life you have to stab it in your thigh right and that way but also it wears off is it all you so you might need more than one don mess with this I mean forget the $800 time three down the drain that life maybe what they is that they went through a desensitization protocol yeah there is a way to make their allergies better and the way that works is you progressively increase the amount of allergen you get in your system but this is done under a supervision of a doctor sometimes in the hospital	Success
Chocolate Lowers the Risk of High Blood Pressure and Stroke?!	https://www.youtube.com/watch?v=PNP8OkXQ5Wc	Doctor Myro	[Music] oh my poor lady please have that chocolate this study of 19,000 patients shows that those with the highest chocolate intakes actually had the lowest risk of high blood pressure they had less heart attacks less Strokes it good news all around when was the last time lettuce could do that huh mm-m I don	Success
Doctor Reacts: birthing demonstration	https://www.youtube.com/watch?v=IcZel5xUOJ0	Doctor Myro		"Error: Unexpected error: 
Could not retrieve a transcript for the video https://www.youtube.com/watch?v=IcZel5xUOJ0! This is most likely caused by:

YouTube is blocking requests from your IP. This usually is due to one of the following reasons:
- You have done too many requests and your IP has been blocked by YouTube
- You are doing requests from an IP belonging to a cloud provider (like AWS, Google Cloud Platform, Azure, etc.). Unfortunately, most IPs from cloud providers are blocked by YouTube.

There are two things you can do to work around this:
1. Use proxies to hide your IP address, as explained in the \"Working around IP bans\" section of the README (https://github.com/jdepoix/youtube-transcript-api?tab=readme-ov-file#working-around-ip-bans-requestblocked-or-ipblocked-exception).
2. (NOT RECOMMENDED) If you authenticate your requests using cookies, you will be able to continue doing requests for a while. However, YouTube will eventually permanently ban the account that you have used to authenticate with! So only do this if you don't mind your account being banned!

If you are sure that the described cause is not responsible for this error and that a transcript should be retrievable, please create an issue at https://github.com/jdepoix/youtube-transcript-api/issues. Please add which version of youtube_transcript_api you are using and provide the information needed to replicate the error. Also make sure that there are no open issues which already describe your problem!"
Doctor Reacts: this replaces a heart?!	https://www.youtube.com/watch?v=NIixdM2dHsE	Doctor Myro	[Music] wow this is Berlin heart it pneumatically pumps blood for your heart when your heart is too weak that means with alternating air pressure these valves close and open and pump blood for you it function is so low you cannot survive without it it with lots of potential complications and it but when one is not possible it is definitive therapy	Success
Why surgery is more intense than you think	https://www.youtube.com/watch?v=xracE6HSLi0	Doctor Myro	fun fact anesthesia doesn numb you or like help with the pain it just puts you to sleep so your body is still feeling pain so that true under deep anesthesia your brain is off and if we were to put EEG sensors on your brain we would see flat activity meaning no activity like a dead person there your body will react to surgery it might even move during surgery this is why we often have to give you a paralytic medication but even if paralyzed your body will produce epinephrine cortisol and other stress hormones that will cause your blood pressure to go Skyhigh and stress your heart now this is something your anesthesiologist or anesthesist can control through different medications but surgery is stressful on the heart so if you have heart problems you have to let your doctor know and if you might have heart problems you want to investigate those well before surgery you do not want to have a heart attack and surgery that happens	Success
Iodine deficiency can cause this - Doctor Reacts	https://www.youtube.com/watch?v=ExI9Yxc2088	Doctor Myro	that in his neck is a goiter and it most likely due to iodine deficiency thyroid gland needs iodine to produce its hormones when there is no iodine it will enlarge so it can capture every bit of iodine that it can	Success
Undercooked meat can give you THIS?!	https://www.youtube.com/watch?v=4EPa3HHe6Ss	Doctor Myro	Are you still eating your steak kind of rare? This is a scar from an infection called taxoplasmosis. It is thought that 40% of the US is currently infected and you get this from eating undercooked meat. Thankfully, eye complications are rare.	Success
This is how hand transplants work	https://www.youtube.com/watch?v=5EsuFlMg9Q8	Doctor Myro	hand transplant how do we do it first we connect the two bones the radius and the UT with plates and screws then we connect your blood vessels your arteries and veins using microvascular technique after the blood is flowing through your arm we individually repair the muscles and tendons one by one this surgery is incredibly complex and can last up to 24 hours and don reattach all of the nerves and even though we reattach the nerves the nerve function can take months to years to come back a lot of physical therapy is expected after the operation but some movement in the fingers is possible immediately after surgery wow amazing	Success
Doctor Reacts: weeding out medical students	https://www.youtube.com/watch?v=SJ48KkxvTYU	Doctor Myro	traumatizing premedical students this is the real weed out course for [Music] Premed I actually had a couple of my classmates back in anatomy class pass out and I remember at the time we we left at them one is now a leading opgyn the other student that we laughed at is now a cardio IC surgeon transplanting human hearts so when you have this reaction to blood and gore and whatever just remember it makes you human we want humans in medicine	Success
You wonÂt believe what she said ??	https://www.youtube.com/watch?v=h-GnhMR5Ino	Doctor Myro	I just super dadded my pants so she just coming out of anesthesia which takes about 24 hours to wear off what shood I sh my pants I think gross you don on	Success
Why does food get stuck in your chest?	https://www.youtube.com/watch?v=_kf9WbOZgd4	Doctor Myro	do you feel like food is getting stuck in your chest well it might be this is a condition called acalasia and not that many people know about it it happens when this fter at the end of your food pipe your esophagus doesn allowing the food to enter your stomach food just hangs out in the esophagus so if you have that sensation combined with heartburn that doesn medications time to see a doctor	Success
Hilarious anesthesia reaction	https://www.youtube.com/watch?v=T1XXHUoSkpM	Doctor Myro	This is an awesome anesthesia reaction. Then three, do I have three eyes? Hey, doctor. Jordan. Doctor. Jordan, stop yelling. Calm down. Jordan, calm down. Hey, doctor. My mom trying to tell me to calm down. Jordan. Doctor, you have two eyes. Do I have three eyes? You have two. Cuz I see three things. Doctor, you have two eyes. Do I have three eyes? Two eyes. What? You believe her? No, she I don you. Who am I supposed to believe then? I remember everything. You remember everything? That I thought that the CIA I was running for the CIA and the CIA is going to try to try to stop me from taking over the whole world. Gian Barcelon.	Success
Why EpiPens are so expensive	https://www.youtube.com/watch?v=XQv7glXhs-s	Doctor Myro	AP iens expire every year this is what $200 looks like and worth every single penny actually epip pens are $700 now that crazy for a couple different reasons first this is an epinephrine vial from my anesthesia cart and it costs $2 same medication as the EpiPen and then they make epipens expire every single year so that forces you to go and buy another one meanwhile here says actually epipens are good for 2 and 1/2 years after the expiration	Success
Doctor Reacts: heart transplant survivor	https://www.youtube.com/watch?v=l-0HCQrhwnA	Doctor Myro	a heart transplant is reserved for the sickest patients he just had one and that not everybody will make it but this is him 2 weeks later leaving the hospital what a miracle [Music] get I love that nice	Success
WhatÂs in her eye?!	https://www.youtube.com/watch?v=SNnEdJQDmu4	Doctor Myro	So that injecting. It activates fibroblast and increases formation of collagen and elastin. And it sure looks crazy, but caroxy therapy is gaining a lot of attention in dermatology. and is generally considered	Success
NEVER do this in the car!	https://www.youtube.com/watch?v=2WbHi5zBs9g	Doctor Myro	and this is why you should never put your feet on the dashboard look at the right femur it from the acetabulum and protrudes through the thigh muscle the left femur is completely broken in half look the airbags deploy through the dashboard at 200 100 mph imagine getting the knee to the face at that speed and the woman in the X-ray actually made it miraculously	Success
Why you should NEVER use a massage gun on your neck!	https://www.youtube.com/watch?v=qQc2et1YdUs	Doctor Myro	and I just got out of the doctor office and my doctor was like don dare ever use a massage gun on your neck you can use on your shoulder you can use it on your back other body parts but never use it on on your neck she said that she had a patient recently who was using it on her neck she would have a lot of pain from carrying her baby and you kateed here you but what it can do if you use it on your neck is it can actually stop the blood flow from going to your brain and her patient was having Strokes I honestly don because it is absolutely 100% true look at all the blood vessels in your neck around this area	Success
