Title;Link;Creator
Doctor Explains: dissolvable stitches;https://www.youtube.com/watch?v=SBxm_2YHBnI;Doctor Myro
THIS is how you should react when your baby falls;https://www.youtube.com/watch?v=HrChyRfy1Ss;Doctor Myro
Dramatic Reaction to Propofol Anesthesia #shorts;https://www.youtube.com/watch?v=4wGQAEUWs8U;Doctor Myro
They say anesthesia brings out your truest personality;https://www.youtube.com/watch?v=fFLMyZvsNtc;Doctor Myro
Doctor Reacts: extreme throat ??;https://www.youtube.com/watch?v=Mc2DEGFM7sE;Doctor Myro
My account got reported?!;https://www.youtube.com/watch?v=K8br-SkMKP0;Doctor Myro
Why shopping carts could make you sick!;https://www.youtube.com/watch?v=Rliz2G59ccw;Doctor Myro
Why Q tips are NOT for cleaning ears;https://www.youtube.com/watch?v=-z7kO43lJZs;Doctor Myro
Flesh Eating Bacteria in an Oyster?;https://www.youtube.com/watch?v=qKyleOefAVA;Doctor Myro
Cardiac Anesthesiologist makes $700k?;https://www.youtube.com/watch?v=qlDSpClm4u8;Doctor Myro
Why sleep deprivation is DANGEROUS;https://www.youtube.com/watch?v=_pUgMZP4fXI;Doctor Myro
Narcan be like;https://www.youtube.com/watch?v=jUSulvGlkzo;Doctor Myro
Whats on her eye?!;https://www.youtube.com/watch?v=YqGmX3288sg;Doctor Myro
Doctor Explains: the medication that stops your heart ??;https://www.youtube.com/watch?v=Q9x4D7G_sPo;Doctor Myro
This dog is hungrier than it looks ??;https://www.youtube.com/watch?v=vtU-5U-mm64;Doctor Myro
Doctor Reacts to WILD abilities;https://www.youtube.com/watch?v=vn9ftjsSTpk;Doctor Myro
Why you should NEVER ignore a UTI;https://www.youtube.com/watch?v=eb4052A0Bac;Doctor Myro
Whats coming out of his nose?!;https://www.youtube.com/watch?v=k3gU4ibvAXw;Doctor Myro
Youll want to wash your hands after this video (With @FootDocDana);https://www.youtube.com/watch?v=_oC-zR7y0z4;Doctor Myro
Doctor Reacts: seizure in public?;https://www.youtube.com/watch?v=Lop8JjoztC4;Doctor Myro
Why I couldnt work in the ER #doctors #shorts and thank you to all that could!!!;https://www.youtube.com/watch?v=itBYENSIIQE;Doctor Myro
Doctor Reacts: lint rolling a sunburn?!;https://www.youtube.com/watch?v=Dab7N81L7cU;Doctor Myro
Doctor Explains: colonoscopy;https://www.youtube.com/watch?v=pGl-G-xN3_Q;Doctor Myro
Ozempic and Viagra?! - what do they have in common?;https://www.youtube.com/watch?v=38_04_Mjv3A;Doctor Myro
Doctor Reacts: amazing medical technology!;https://www.youtube.com/watch?v=5TDCaij8a0k;Doctor Myro
Doctor Reacts: spinal removal;https://www.youtube.com/watch?v=7Vg2l7EDBSo;Doctor Myro
Doctor Reacts: EpiPen fail;https://www.youtube.com/watch?v=Ib6q-Em1wdY;Doctor Myro
Why mosquitoes HATE body hair;https://www.youtube.com/watch?v=O-iA3B6bs0U;Doctor Myro
Doctor Reacts: popping a cyst;https://www.youtube.com/watch?v=xHYWMISYkcg;Doctor Myro
Doctor Reacts: allergic to shellfish?!;https://www.youtube.com/watch?v=TeODXZCJRsI;Doctor Myro
Chocolate Lowers the Risk of High Blood Pressure and Stroke?!;https://www.youtube.com/watch?v=PNP8OkXQ5Wc;Doctor Myro
Doctor Reacts: birthing demonstration;https://www.youtube.com/watch?v=IcZel5xUOJ0;Doctor Myro
Doctor Reacts: this replaces a heart?!;https://www.youtube.com/watch?v=NIixdM2dHsE;Doctor Myro
Why surgery is more intense than you think;https://www.youtube.com/watch?v=xracE6HSLi0;Doctor Myro
Iodine deficiency can cause this - Doctor Reacts;https://www.youtube.com/watch?v=ExI9Yxc2088;Doctor Myro
Undercooked meat can give you THIS?!;https://www.youtube.com/watch?v=4EPa3HHe6Ss;Doctor Myro
This is how hand transplants work;https://www.youtube.com/watch?v=5EsuFlMg9Q8;Doctor Myro
Doctor Reacts: weeding out medical students;https://www.youtube.com/watch?v=SJ48KkxvTYU;Doctor Myro
You wont believe what she said ??;https://www.youtube.com/watch?v=h-GnhMR5Ino;Doctor Myro
Why does food get stuck in your chest?;https://www.youtube.com/watch?v=_kf9WbOZgd4;Doctor Myro
Hilarious anesthesia reaction;https://www.youtube.com/watch?v=T1XXHUoSkpM;Doctor Myro
Why EpiPens are so expensive;https://www.youtube.com/watch?v=XQv7glXhs-s;Doctor Myro
Doctor Reacts: heart transplant survivor;https://www.youtube.com/watch?v=l-0HCQrhwnA;Doctor Myro
Whats in her eye?!;https://www.youtube.com/watch?v=SNnEdJQDmu4;Doctor Myro
NEVER do this in the car!;https://www.youtube.com/watch?v=2WbHi5zBs9g;Doctor Myro
Why you should NEVER use a massage gun on your neck!;https://www.youtube.com/watch?v=qQc2et1YdUs;Doctor Myro
Why anesthesia is a bigger deal than you think!;https://www.youtube.com/watch?v=K5WtGxCB-hU;Doctor Myro
That last hospital door before vacation #doctor #shorts;https://www.youtube.com/watch?v=ZR0o4UVRQuk;Doctor Myro
Hydrogen peroxide for wounds?;https://www.youtube.com/watch?v=DuVM3kvl46M;Doctor Myro
He helped her walk at 104 years old!!;https://www.youtube.com/watch?v=2ubmWLQxpMg;Doctor Myro
How do C-Sections REALLY work?;https://www.youtube.com/watch?v=TYdhFTVp6BA;Doctor Myro
Top 3 most stressed Doctors - by an Anesthesiologist;https://www.youtube.com/watch?v=dq0RR6ZMd10;Doctor Myro
399 year old woman?!;https://www.youtube.com/watch?v=z08MgS-P46U;Doctor Myro
Doctor Reacts: CRAZY tongue ability;https://www.youtube.com/watch?v=FQRQq7xwtP8;Doctor Myro
How laser eye surgery REALLY works;https://www.youtube.com/watch?v=H9MJe3-RR4w;Doctor Myro
How to chop onions without crying!;https://www.youtube.com/watch?v=qMLJS-GOdtQ;Doctor Myro
When you fall asleep first at the sleepover;https://www.youtube.com/watch?v=PRaqrXUvBmc;Doctor Myro
Ovulation increases testosterone?!;https://www.youtube.com/watch?v=jwmYHwlhLEs;Doctor Myro
What REALLY happens in a CT scan;https://www.youtube.com/watch?v=OZ4CtschmB4;Doctor Myro
We Doctors care about you, even with our own expense;https://www.youtube.com/watch?v=YGgrNnjWGZU;Doctor Myro
Youll never bite your nails again after seeing this!;https://www.youtube.com/watch?v=9DVaj78_C2E;Doctor Myro
Doctor Reacts: EXTREME cyst treatment;https://www.youtube.com/watch?v=KbquMqPupnc;Doctor Myro
When the needle goes in but doesnt come out ??;https://www.youtube.com/watch?v=GTv7TFw99Eo;Doctor Myro
Are enemas good for your health? Doctor Explains;https://www.youtube.com/watch?v=I0jNPVp1SDY;Doctor Myro
Doctor Reacts: unexpected child birth;https://www.youtube.com/watch?v=kMJ1UMmAQZI;Doctor Myro
Youll NEVER want this to happen;https://www.youtube.com/watch?v=80-P_SnBtEU;Doctor Myro
Seen a tire bubble before? It can unalive you;https://www.youtube.com/watch?v=AGty9qKLnbQ;Doctor Myro
Doctor Explains: how to insert a catheter;https://www.youtube.com/watch?v=j1Bbsn0QDAc;Doctor Myro
Should you REALLY be inhaling helium?;https://www.youtube.com/watch?v=xeiv7Il7k8s;Doctor Myro
What if you lie to your doctor? - Doctor Reacts to skit ??;https://www.youtube.com/watch?v=Kj1-9b4x0WQ;Doctor Myro
Do NOT treat wounds like this!;https://www.youtube.com/watch?v=ZJsHiKI3R9Q;Doctor Myro
Doctor Reacts: a life saving demonstration;https://www.youtube.com/watch?v=bQ7pWT1526E;Doctor Myro
Doctor Reacts: toe amputation?!;https://www.youtube.com/watch?v=KS28TKAwEtg;Doctor Myro
Does looking at the sun make you sneeze?!;https://www.youtube.com/watch?v=ezGt93CtvrQ;Doctor Myro
They said the craziest things under anesthesia!;https://www.youtube.com/watch?v=0Zesm3NNs2s;Doctor Myro
Will Artificial Intelligence take over for Doctors?;https://www.youtube.com/watch?v=G6n-EqXNVj8;Doctor Myro
Doctor Reacts: grapes in her nose?!;https://www.youtube.com/watch?v=4DpDDrMpM3k;Doctor Myro
Doctor Reacts: forced MRI;https://www.youtube.com/watch?v=wQHA8UQ8CaQ;Doctor Myro
She had the WORST day in the gym;https://www.youtube.com/watch?v=cpq-n5UmBSM;Doctor Myro
Doctors React: expired EpiPen (with @FootDocDana);https://www.youtube.com/watch?v=94wnFMyQ_XE;Doctor Myro
Anesthesiologist Reacts: awake for surgery?;https://www.youtube.com/watch?v=QqiyWgNkG2U;Doctor Myro
Doctor reacts to man still on anesthesia #funny #doctors #shorts #nurses;https://www.youtube.com/watch?v=GYWUimwcS2k;Doctor Myro
Doctor Reacts: whats in her mouth?!;https://www.youtube.com/watch?v=MrQaeUvk6dY;Doctor Myro
Doctor Reacts: ??in surgery?;https://www.youtube.com/watch?v=-UvGokvJq64;Doctor Myro
Is that what it looks like?!;https://www.youtube.com/watch?v=ItQ2Zeorqe8;Doctor Myro
He broke his Arm but still can play Banjo;https://www.youtube.com/watch?v=xCa4OAqI0_k;Doctor Myro
Doctor Reacts: popping a pimple;https://www.youtube.com/watch?v=eWD_ZZjNJTU;Doctor Myro
How a spine herniates;https://www.youtube.com/watch?v=tfRGFworBGY;Doctor Myro
Medical demonstration gone wrong;https://www.youtube.com/watch?v=oBE9bhOb0Uw;Doctor Myro
Doctor Reacts: cutest idea ever!;https://www.youtube.com/watch?v=Nz86R_vJQH8;Doctor Myro
Doctor Reacts: resuscitation fail;https://www.youtube.com/watch?v=hqoWpqlXSS0;Doctor Myro
How long do frozen foods last?;https://www.youtube.com/watch?v=um-jClG2RiY;Doctor Myro
What happens if you touch someone with HIV;https://www.youtube.com/watch?v=fAIzPAHowNU;Doctor Myro
Why fish pedicures are EXTREMELY dangerous;https://www.youtube.com/watch?v=cr_8W-cS6Fw;Doctor Myro
Why this is a BRUTAL job;https://www.youtube.com/watch?v=xacRF0l3yo4;Doctor Myro
Why fentanyl is SO dangerous;https://www.youtube.com/watch?v=7p6Ic5OIvVQ;Doctor Myro
Are you drinking enough water?;https://www.youtube.com/watch?v=yUgmE7qxJ7Q;Doctor Myro
Why do your legs fall asleep?;https://www.youtube.com/watch?v=Fi0nZRNgqHQ;Doctor Myro
Life Saving Procedure #shorts;https://www.youtube.com/watch?v=xtT8_VMdFlc;Doctor Myro
Why you should NEVER get this spa treatment;https://www.youtube.com/watch?v=v8-yIhFRHgQ;Doctor Myro
Doctor Reacts: advanced medical prosthetics;https://www.youtube.com/watch?v=JS-rHUgVauk;Doctor Myro
Whats in her mouth?!;https://www.youtube.com/watch?v=hF6_eppoPJQ;Doctor Myro
This household cleaner is DANGER!;https://www.youtube.com/watch?v=i0Bkpgn89jE;Doctor Myro
What smoking does to your lungs ??;https://www.youtube.com/watch?v=GqJMMXiw1Ew;Doctor Myro
Doctor Reacts: babys worst nightmare?;https://www.youtube.com/watch?v=pfhoRMq-Dq8;Doctor Myro
Doctor Reacts: toe on their hands?!;https://www.youtube.com/watch?v=EtLiWTtwqEk;Doctor Myro
Doctor explains how to increase height;https://www.youtube.com/watch?v=CiZgldz6V08;Doctor Myro
Kidney stones up close!;https://www.youtube.com/watch?v=mjaS4a3ED50;Doctor Myro
Doctor Reacts: whats on her arm?!;https://www.youtube.com/watch?v=buryGCzVQac;Doctor Myro
Med school could NOT have prepared me for this;https://www.youtube.com/watch?v=SjN4b-zYaZM;Doctor Myro
GRWM: contagious disease edition;https://www.youtube.com/watch?v=btjUA2yOd0A;Doctor Myro
Why anesthesia makes you ??;https://www.youtube.com/watch?v=8QyyppNHR-w;Doctor Myro
He removed THAT from his ear?!;https://www.youtube.com/watch?v=NZsXUOQ48Ws;Doctor Myro
Doctor Reacts: how to instantly kill germs;https://www.youtube.com/watch?v=mu7ydOxjwtU;Doctor Myro
Doctor Reacts: whats on her eye?!;https://www.youtube.com/watch?v=ngUiimosrww;Doctor Myro
Why RAMEN could land you in the ER ??;https://www.youtube.com/watch?v=g52Ktn3nkV8;Doctor Myro
BBQ in the Operating Room #doctor #shorts;https://www.youtube.com/watch?v=WNO7t127LLc;Doctor Myro
Doctor Explains: awake intubation;https://www.youtube.com/watch?v=lluTXGajT-M;Doctor Myro
Why virtual reality could change healthcare;https://www.youtube.com/watch?v=_kwudteiY8k;Doctor Myro
He volunteered to be Intubated while AWAKE!!!;https://www.youtube.com/watch?v=xqroA8RKWOA;Doctor Myro
Monkey Drinking Powerade? Doctor Reacts #doctor #shorts;https://www.youtube.com/watch?v=uvYZlg1dY_Y;Doctor Myro
This is your sign to go to the hospital;https://www.youtube.com/watch?v=AcAcrTAKwnQ;Doctor Myro
Hes touching his brain?!;https://www.youtube.com/watch?v=w5MU1GQXLu4;Doctor Myro
Doctor Reacts: leeches as medicine?!;https://www.youtube.com/watch?v=nSe2-Am5A30;Doctor Myro
Doctor diagnosed her as HOTT ??????;https://www.youtube.com/watch?v=wqwHlBtAYe0;Doctor Myro
NEVER eat this kind of watermelon!;https://www.youtube.com/watch?v=jzXJ6VSSxLI;Doctor Myro
Doctor Reacts to a cake life hack;https://www.youtube.com/watch?v=YhAurB2gP54;Doctor Myro
What happened to their foot?!;https://www.youtube.com/watch?v=jGddJZtpSCc;Doctor Myro
Drill out the Clot in the Artery? #doctor #shorts;https://www.youtube.com/watch?v=_LnmYOi5TZM;Doctor Myro
Doctor Reacts: EpiPen demonstration;https://www.youtube.com/watch?v=lE8a3Lek-3g;Doctor Myro
Doctor Reacts: helmet test;https://www.youtube.com/watch?v=ogvmVhGBAwU;Doctor Myro
Try THIS to save money at the hospital!;https://www.youtube.com/watch?v=r5fx2_xajQc;Doctor Myro
Patient didn't shower for years - Doctor Reacts ??;https://www.youtube.com/watch?v=cHmRRn6FLWU;Doctor Myro
How babies get anesthesia for surgery;https://www.youtube.com/watch?v=K35gk3zxKuY;Doctor Myro
Why Q tips are NOT for cleaning ears;https://www.youtube.com/watch?v=_xrkexojB5c;Doctor Myro
Why noodles sent her to the hospital ??;https://www.youtube.com/watch?v=9L5UPgJSPoo;Doctor Myro
Doctor reacts to rabid squirrel removal;https://www.youtube.com/watch?v=C8rE1Q4fPcs;Doctor Myro
Why you shouldnt flex TOO hard ??;https://www.youtube.com/watch?v=mGj1yyqphYg;Doctor Myro
THIS is what gonorrhea looks like;https://www.youtube.com/watch?v=c5FUqTo9NsI;Doctor Myro
Doctor Reacts: inserting a breathing tube;https://www.youtube.com/watch?v=JKrlL2exhlg;Doctor Myro
What happens in a CT scan?;https://www.youtube.com/watch?v=VukdkLAYS94;Doctor Myro
Separating Conjoined Twins #doctor #shorts;https://www.youtube.com/watch?v=Y4RjiLTCjuI;Doctor Myro
Doctor Reacts: extreme toenail removal;https://www.youtube.com/watch?v=hnshfN1B2ug;Doctor Myro
How doctors remove blood clots;https://www.youtube.com/watch?v=X6ulhgPQGH8;Doctor Myro
How does heartburn REALLY work?;https://www.youtube.com/watch?v=KgGEvlDH5po;Doctor Myro
How THIS can change your eye color!;https://www.youtube.com/watch?v=Hbgb0sy9cLU;Doctor Myro
Doctor Explains: knee replacement surgery;https://www.youtube.com/watch?v=7iJhD_9q_us;Doctor Myro
Doctor Reacts: hes touching his brain?!;https://www.youtube.com/watch?v=2Ro9f1nNa3c;Doctor Myro
THIS item could send you to the ER ??;https://www.youtube.com/watch?v=jenTOheT1Rc;Doctor Myro
Why this could cost you your toe ??;https://www.youtube.com/watch?v=_pwwz059jDc;Doctor Myro
Hearing test: how old are your ears?;https://www.youtube.com/watch?v=rU_8SQM_kGg;Doctor Myro
When your Doctor sucks at Communication - Medical Drama ??;https://www.youtube.com/watch?v=3or_eSv9gx0;Doctor Myro
Youre big boned? - Doctor Reacts;https://www.youtube.com/watch?v=GFqClaSFMuw;Doctor Myro
Doctor Reacts: nail gun to the head?;https://www.youtube.com/watch?v=rHsQEqvgj7c;Doctor Myro
This is what crushing a hand looks like;https://www.youtube.com/watch?v=j9Z-j6WaHsg;Doctor Myro
How doctors prepare you for surgery;https://www.youtube.com/watch?v=zKXzvKFsFsA;Doctor Myro
Doctor Reacts: is stretching actually dangerous?;https://www.youtube.com/watch?v=uONJBp_kAbU;Doctor Myro
Doctor Explains: robot CPR;https://www.youtube.com/watch?v=RDo2x3muBuo;Doctor Myro
Knowing THIS could save your finger!;https://www.youtube.com/watch?v=zKituoJlZrY;Doctor Myro
Why this is a COSTLY loss;https://www.youtube.com/watch?v=KwXIqJ2ElNA;Doctor Myro
You wont believe what he found in his burger;https://www.youtube.com/watch?v=A3b-DvoRyB8;Doctor Myro
Doctor Reacts: fish therapy?;https://www.youtube.com/watch?v=GFJMU4nxLSQ;Doctor Myro
Why THIS is a difficult situation;https://www.youtube.com/watch?v=Gefibs0KlMM;Doctor Myro
Doctor Reacts: the human nunchuck?!;https://www.youtube.com/watch?v=1sldHuU-uyI;Doctor Myro
Doctor Reacts: born with 3 fingers;https://www.youtube.com/watch?v=JwJNSGhJBEs;Doctor Myro
Doctor Reacts: popping their hand?!;https://www.youtube.com/watch?v=T93h0xWj4tc;Doctor Myro
Doctor Reacts: iron shins;https://www.youtube.com/watch?v=QF_LHCmCQ4s;Doctor Myro
Doctor Reacts: whats in their eye?!;https://www.youtube.com/watch?v=1sTZoQVd1mQ;Doctor Myro
This is what cardiac arrest looks like;https://www.youtube.com/watch?v=CR5fKB8EpQY;Doctor Myro
This is what Healthcare Providers will look like in Future;https://www.youtube.com/watch?v=izUktMXanzY;Doctor Myro
How she walks without breathing!;https://www.youtube.com/watch?v=dCdVjTyiPvw;Doctor Myro
Why inhaling helium can be DANGEROUS;https://www.youtube.com/watch?v=6x1L1aVCD7Y;Doctor Myro
What happens when your hand falls asleep;https://www.youtube.com/watch?v=fyRz8RuQEFo;Doctor Myro
Whats happening to her skin?;https://www.youtube.com/watch?v=VBDonpxQd_A;Doctor Myro
Doctor Explains: side effects of pregnancy;https://www.youtube.com/watch?v=154kAiI7RAU;Doctor Myro
Why you should NEVER do this;https://www.youtube.com/watch?v=3RGhlDJ6QRk;Doctor Myro
Doctor Reacts: ankle shaman?;https://www.youtube.com/watch?v=0CjjLZDXTPY;Doctor Myro
Why anesthesia ended their relationship ??;https://www.youtube.com/watch?v=DGrRhcexH9I;Doctor Myro
Anesthesiologist Explains: C section;https://www.youtube.com/watch?v=UrmYJAM8870;Doctor Myro
What are they doing to that eye?!;https://www.youtube.com/watch?v=vjo0O_QDS_c;Doctor Myro
Doctor Reacts: squirming meat?! ??;https://www.youtube.com/watch?v=BqFSEJD2Naw;Doctor Myro
Doctor reacts to massive veins #doctor #shorts;https://www.youtube.com/watch?v=p5hbr2fXov4;Doctor Myro
Doctor Explains: low calorie rice hack!;https://www.youtube.com/watch?v=X48IKUWeCio;Doctor Myro
3 things NOT to do: from an anesthesiologist;https://www.youtube.com/watch?v=fOhPvjsVOMo;Doctor Myro
Doctor explains: resetting the heart!;https://www.youtube.com/watch?v=iWOCV-A-EKo;Doctor Myro
Whats he putting in his throat?!;https://www.youtube.com/watch?v=6ylsLQP3EE4;Doctor Myro
Doctor Reacts: leg amputation;https://www.youtube.com/watch?v=OND_UOHjbuc;Doctor Myro
Would you get this surgery to grow taller?;https://www.youtube.com/watch?v=IxH3SoscqYE;Doctor Myro
STOP treating wounds like this!!!;https://www.youtube.com/watch?v=Ci2-ozRPehA;Doctor Myro
How do cast saws work?;https://www.youtube.com/watch?v=e-xQeRD7mP8;Doctor Myro
Medical demonstration gone WRONG;https://www.youtube.com/watch?v=phdxmmxKw9I;Doctor Myro
Doctor Reacts: intentionally getting Covid?!;https://www.youtube.com/watch?v=SASUr6KfSIM;Doctor Myro
Knowing this could save your finger!;https://www.youtube.com/watch?v=OnlKBRAMqr4;Doctor Myro
Doctor Reacts: axe foot treatment?;https://www.youtube.com/watch?v=Yw8LV1QCgzQ;Doctor Myro
Doctor Reacts: robot cpr?!;https://www.youtube.com/watch?v=6KJk-yUUrM0;Doctor Myro
Doctor Reacts: earthquake bed?;https://www.youtube.com/watch?v=hysCdevqlm4;Doctor Myro
Why anesthesia = life support;https://www.youtube.com/watch?v=vOOFj-Fyr-k;Doctor Myro
Doctor Reacts: virginity testing machine?!;https://www.youtube.com/watch?v=Un0oI3wmP4g;Doctor Myro
Why NO ONE saw this coming;https://www.youtube.com/watch?v=UzJr-NE0Z3U;Doctor Myro
When a toe comes off with the sock?!;https://www.youtube.com/watch?v=-YzU9TqsBQ0;Doctor Myro
Ive been reported.;https://www.youtube.com/watch?v=ODOlXqdvvoY;Doctor Myro
Doctor Reacts: origami surgery?;https://www.youtube.com/watch?v=fGzIrFIJBhk;Doctor Myro
How the top 1% do hospitals;https://www.youtube.com/watch?v=39ZF_fXC8uQ;Doctor Myro
Amazing swallowing skills with @FootDocDana #doctors #shorts;https://www.youtube.com/watch?v=h-yxLPu40y8;Doctor Myro
Why THIS is a bad sign;https://www.youtube.com/watch?v=kWWKhwW1OSM;Doctor Myro
Doctor Reacts: leaking knee?!;https://www.youtube.com/watch?v=G-zyzh3_ZPU;Doctor Myro
Her ex had a fake Lamborghini?! @FootDocDana;https://www.youtube.com/watch?v=B61dG6DqU9k;Doctor Myro
NEVER do this at the beach!;https://www.youtube.com/watch?v=cYC_rpJ2ZXk;Doctor Myro
This heros final march ??;https://www.youtube.com/watch?v=K7Mgd8isxEk;Doctor Myro
Doctor Reacts: born with 6 fingers?!;https://www.youtube.com/watch?v=CCr_NI0apkM;Doctor Myro
No IV? We drill into the bone instead;https://www.youtube.com/watch?v=HpLAxfk58ZA;Doctor Myro
He injected oil into the muscles - Doctor Reacts;https://www.youtube.com/watch?v=io_0twKf0Cs;Doctor Myro
Doctors React to amazing conditions! (With @FootDocDana);https://www.youtube.com/watch?v=xpWOYOF0jUE;Doctor Myro
Why doctors NEED to listen to their patients;https://www.youtube.com/watch?v=qOdADB8aIyw;Doctor Myro
You need THIS to heal from surgery;https://www.youtube.com/watch?v=5VSbcOQLy4Y;Doctor Myro
Doctor Reacts: whats wrong with her hand?!;https://www.youtube.com/watch?v=mzh5RLTcumc;Doctor Myro
Stroke from a Chiropractor Visit? #doctors #shorts;https://www.youtube.com/watch?v=v8cGdyS9dtM;Doctor Myro
How tattoos turn into ??;https://www.youtube.com/watch?v=k2DO6Q1t3zk;Doctor Myro
Why you SHOULDNT make your bed in the morning;https://www.youtube.com/watch?v=HDG9S6fzy2U;Doctor Myro
Do this to save your finger!;https://www.youtube.com/watch?v=0GNwX8UOy4I;Doctor Myro
Doctor Reacts: tampon beef?!;https://www.youtube.com/watch?v=Wg_e-wnLCME;Doctor Myro
Doctor Reacts: crunchy knee pop;https://www.youtube.com/watch?v=2iybRsr6hSM;Doctor Myro
Doctor Explains: preparing for surgery;https://www.youtube.com/watch?v=pbW-dFEoWLs;Doctor Myro
POV: you get your tonsils removed;https://www.youtube.com/watch?v=LT3V-6m81o8;Doctor Myro
THIS is the best cleaning hack!;https://www.youtube.com/watch?v=DGaGi7biMAw;Doctor Myro
This condition is heartbreaking;https://www.youtube.com/watch?v=fkVMxDxnrCo;Doctor Myro
Doctor Reacts: leg amputation;https://www.youtube.com/watch?v=LTGMg-gtKP4;Doctor Myro
Doctor Reacts: eyeliner removal;https://www.youtube.com/watch?v=rACUubotaH4;Doctor Myro
They did surgery on a banana;https://www.youtube.com/watch?v=o9HD_hRUrzc;Doctor Myro
Doctor Reacts: extreme headache treatment ??;https://www.youtube.com/watch?v=lpssEDr6URg;Doctor Myro
Diagnosis: broken heart ??;https://www.youtube.com/watch?v=OLpdP1m5wL4;Doctor Myro
Doctor Reacts: foot cupping;https://www.youtube.com/watch?v=WMH4oSeFtpw;Doctor Myro
Why going to the gym could make you SICK;https://www.youtube.com/watch?v=k9YnRS_jclQ;Doctor Myro
This is your sign to go to the hospital;https://www.youtube.com/watch?v=GaC4IbKsmKk;Doctor Myro
Doctor Reacts: harvesting your hamstrings?!;https://www.youtube.com/watch?v=Eyr3iZ0Csy4;Doctor Myro
Doctor Reacts: ear spiders?!;https://www.youtube.com/watch?v=Zxrtk2M5l_s;Doctor Myro
Why you should NEVER wear jewelry in surgery;https://www.youtube.com/watch?v=CDfZSQqlhuM;Doctor Myro
Could THIS cure sore throats?!;https://www.youtube.com/watch?v=wqyVSiIDcrw;Doctor Myro
This is why I'm scared of chiropractors ??;https://www.youtube.com/watch?v=-l66ZDE1lCI;Doctor Myro
When your card declines at the hospital;https://www.youtube.com/watch?v=LhN91qjygYs;Doctor Myro
This life hack can cure a migraine!;https://www.youtube.com/watch?v=Dw-ZwM45NXA;Doctor Myro
Doctor got his YouTube University Degree #shorts;https://www.youtube.com/watch?v=EgZ616fT6CE;Doctor Myro
What are they doing to this baby?!;https://www.youtube.com/watch?v=9SypzsmPyn8;Doctor Myro
How caffeine REALLY affects the brain;https://www.youtube.com/watch?v=3NNqQqpRWPo;Doctor Myro
Guess the body part! (With @FootDocDana);https://www.youtube.com/watch?v=5MQHLpNTAfI;Doctor Myro
Why you should NEVER eat before surgery;https://www.youtube.com/watch?v=0JOX-wpmCXY;Doctor Myro
Why do babies love being patted?;https://www.youtube.com/watch?v=eX98DDJfzVk;Doctor Myro
Doctor Reacts: hes intubating himself?!;https://www.youtube.com/watch?v=X2KvXrOS8yg;Doctor Myro
Can eye color affect your driving?!;https://www.youtube.com/watch?v=CGGBWBOZGCs;Doctor Myro
She puts WHAT on her face?!;https://www.youtube.com/watch?v=7K39uB8t9K4;Doctor Myro
Doctor Reacts: whats in his hand?!;https://www.youtube.com/watch?v=eG0SLFXfSjI;Doctor Myro
Oddly satisfying pill assembly;https://www.youtube.com/watch?v=eG08Z0SY_KE;Doctor Myro
Hospital elevator accident with patient inside #shorts;https://www.youtube.com/watch?v=SRxtkWHrfEU;Doctor Myro
This might be why your baby is sick!;https://www.youtube.com/watch?v=wl1li1dv5Hs;Doctor Myro
Why she has an infinite drink glitch!;https://www.youtube.com/watch?v=IP_2ap7MsT4;Doctor Myro
This your sign to trim your toenails;https://www.youtube.com/watch?v=R2S7cZ9XCeY;Doctor Myro
Doctor Reacts: children in the hospital;https://www.youtube.com/watch?v=fJswvyvXoHQ;Doctor Myro
Why soda cans are dirtier than you think ??;https://www.youtube.com/watch?v=ap3KYMk6frU;Doctor Myro
How doctors remove hemorrhoids;https://www.youtube.com/watch?v=H7PHung-9Ag;Doctor Myro
Doctor Reacts: heartwarming story!;https://www.youtube.com/watch?v=PvqsqLad2Y0;Doctor Myro
Medical students be like;https://www.youtube.com/watch?v=u8Det0pJKiU;Doctor Myro
Doctor Reacts: lethal doses;https://www.youtube.com/watch?v=B6ZD0wfDiX0;Doctor Myro
She put WHAT on her face?!;https://www.youtube.com/watch?v=L1JnwoUSduM;Doctor Myro
Whats wrong with this hand?!;https://www.youtube.com/watch?v=MuszzidXW3M;Doctor Myro
Flesh eating bacteria - CDC issues warning;https://www.youtube.com/watch?v=3dLYrKbqwg8;Doctor Myro
Your stairs are more dangerous than you think;https://www.youtube.com/watch?v=4YGMS_DhgJs;Doctor Myro
Why you SHOULDNT be making your bed;https://www.youtube.com/watch?v=WbPap8IS7n0;Doctor Myro
This story is heartbreaking;https://www.youtube.com/watch?v=5rJwf5dW4pc;Doctor Myro
Doctor Reacts: singing under anesthesia?;https://www.youtube.com/watch?v=iVXT0-kxW6Y;Doctor Myro
Why this is even crazier than it looks!;https://www.youtube.com/watch?v=-26VxKAMbIA;Doctor Myro
Youd never believe this urine fact!;https://www.youtube.com/watch?v=5WlxFoMvZz8;Doctor Myro
His heart is not beating ??;https://www.youtube.com/watch?v=uz7NSDOj0_U;Doctor Myro
This just might save your life!;https://www.youtube.com/watch?v=qmgmIXU8Lbk;Doctor Myro
Doctor Reacts: breath holding spell;https://www.youtube.com/watch?v=UJS68Q13Agg;Doctor Myro
Why MRI machines are more dangerous than they look ??;https://www.youtube.com/watch?v=i1cQRRMkcMs;Doctor Myro
Are IUDs effective?;https://www.youtube.com/watch?v=wc46fXPH2A8;Doctor Myro
Doctor Reacts: falling down the stairs;https://www.youtube.com/watch?v=FUSezOS0sBY;Doctor Myro
