Title;Link;Creator
Thompson test for Achilles tendon rupture - Doctor Explained;https://www.youtube.com/watch?v=GyGckGRK0QA;Doctor Myro
Doctor Reacts: eating live fish?!;https://www.youtube.com/watch?v=TOlEjNt-Wp0;Doctor Myro
Doctor Reacts: popping a pimple;https://www.youtube.com/watch?v=rBgpZvB6IXQ;Doctor Myro
Doctor Reacts: diseases at goodwill?!;https://www.youtube.com/watch?v=cViFAbbnWko;Doctor Myro
Why this is NOT what it looks like ??;https://www.youtube.com/watch?v=H_lsX9IrF3E;Doctor Myro
Doctor Explains: smelling salts;https://www.youtube.com/watch?v=jxeU5-TR9dc;Doctor Myro
Doctor Reacts: kombucha is dangerous?;https://www.youtube.com/watch?v=lm8rAU-j-BI;Doctor Myro
How to SAFELY remove a fish hook;https://www.youtube.com/watch?v=vvsFdS9P4Lo;Doctor Myro
Doctor Reacts: insane abilities!;https://www.youtube.com/watch?v=CZ3x6qjU6Qc;Doctor Myro
She gave anesthesia to herself?!;https://www.youtube.com/watch?v=YVkB_QuxhVA;Doctor Myro
The GUARANTEED way to increase height;https://www.youtube.com/watch?v=irC2Jddl66c;Doctor Myro
Doctor Reacts: allergic to gluten?;https://www.youtube.com/watch?v=YSkcjaBLJbk;Doctor Myro
This might be why your ?? hurts!;https://www.youtube.com/watch?v=ZWzntNOLikE;Doctor Myro
Your dog is more dangerous than you think;https://www.youtube.com/watch?v=mY2k2_ADokI;Doctor Myro
An uncomfortable demonstration;https://www.youtube.com/watch?v=PVM73nUw144;Doctor Myro
My account got reported?!;https://www.youtube.com/watch?v=MumgFBd4LOQ;Doctor Myro
Whats in his ear?!;https://www.youtube.com/watch?v=7tvmsYshJzU;Doctor Myro
How CT scans REALLY work;https://www.youtube.com/watch?v=1ZOEiRS2NyA;Doctor Myro
One of the hardest things to do as a doctor;https://www.youtube.com/watch?v=2bab0kUfdiM;Doctor Myro
What REALLY happens in a CT scan;https://www.youtube.com/watch?v=_mwOKqzK6sc;Doctor Myro
Doctor Reacts: medical ASMR;https://www.youtube.com/watch?v=6Fujywh5YCs;Doctor Myro
Doctor Reacts: emergency C-section;https://www.youtube.com/watch?v=cPbWF3-rD60;Doctor Myro
You need to know this life hack for contacts!;https://www.youtube.com/watch?v=W9Az4ezsh9c;Doctor Myro
Doctor Reacts: singing through surgery?!;https://www.youtube.com/watch?v=17BaVtu_ydU;Doctor Myro
Doctor Reacts: going under anesthesia;https://www.youtube.com/watch?v=Q5MghExNXyA;Doctor Myro
Youre not a gamer unless youve done this?! ??;https://www.youtube.com/watch?v=A0BSLT2AOIg;Doctor Myro
Why some kids HATE anesthesia;https://www.youtube.com/watch?v=GE8xhgykTTU;Doctor Myro
Most stressful surgery - Explained by Anesthesiologist;https://www.youtube.com/watch?v=5JTLBJo4QYw;Doctor Myro
Why this technology is amazing!;https://www.youtube.com/watch?v=OX7YssIuKOA;Doctor Myro
Doctor Reacts: worst job ever?!;https://www.youtube.com/watch?v=x_fqnnG1v6Q;Doctor Myro
What acutane does to babies;https://www.youtube.com/watch?v=O5lL36eIfyQ;Doctor Myro
How this man saved millions of lives!;https://www.youtube.com/watch?v=uJzPtYadVSc;Doctor Myro
Why fish pedicures are EXTREMELY dangerous;https://www.youtube.com/watch?v=bZtzu9GlT7g;Doctor Myro
This is how EpiPens REALLY work (with @FootDocDana);https://www.youtube.com/watch?v=7KcaQ-RarU8;Doctor Myro
The best first aid antiseptic? @bldgactive7565;https://www.youtube.com/watch?v=d34WjprbGbs;Doctor Myro
She did her own anesthesia?!;https://www.youtube.com/watch?v=4Ds9hRkxSn0;Doctor Myro
Why this kid is an inspiration!;https://www.youtube.com/watch?v=5SbbAw0-lH4;Doctor Myro
What are they doing to this boy?;https://www.youtube.com/watch?v=MGAv-7LULzU;Doctor Myro
What to do if you dislocate your knee;https://www.youtube.com/watch?v=iu4zXuIA-VI;Doctor Myro
Why THIS is contaminating your home!;https://www.youtube.com/watch?v=6ooGEtGtaP0;Doctor Myro
Doctor Reacts: extreme chiropractic adjustment;https://www.youtube.com/watch?v=6xf69V5s87k;Doctor Myro
Doctor Reacts: she has two elbows?!;https://www.youtube.com/watch?v=SOzMhNjtuB0;Doctor Myro
The RIGHT way to swallow pills;https://www.youtube.com/watch?v=4O8jM06F-qI;Doctor Myro
Doctor Reacts: extreme foot warts;https://www.youtube.com/watch?v=0dpK1v93nGo;Doctor Myro
This invention helped him cook again!;https://www.youtube.com/watch?v=1Ojp_fyefiY;Doctor Myro
What is THAT?!;https://www.youtube.com/watch?v=XskTwN4qD3I;Doctor Myro
What an IUD removal looks like;https://www.youtube.com/watch?v=ZNMGuZzdzZs;Doctor Myro
Doctor Reacts: extreme allergic reaction;https://www.youtube.com/watch?v=6kSZ8kjizmQ;Doctor Myro
Doctor Reacts: born with extra fingers?!;https://www.youtube.com/watch?v=L2YqqPYH1aY;Doctor Myro
The surprising factor that increases cancer survival;https://www.youtube.com/watch?v=qj5VD04VjVk;Doctor Myro
Could this cure iron deficiency?!;https://www.youtube.com/watch?v=K8ec_Y52P38;Doctor Myro
Worlds most expensive treadmill;https://www.youtube.com/watch?v=5qulkCIV00M;Doctor Myro
Doctor Reacts: nurse giving birth?!;https://www.youtube.com/watch?v=t02upsaFeek;Doctor Myro
Doctor Reacts: transparent eyelids?!;https://www.youtube.com/watch?v=OQH7BB9zpJw;Doctor Myro
She ate packing peanuts ?? #doctor;https://www.youtube.com/watch?v=xyhFKac4l6o;Doctor Myro
Her reaction to anesthesia was INSANE!;https://www.youtube.com/watch?v=mwiNr4GuJtM;Doctor Myro
They did surgery on a corn kernel ??;https://www.youtube.com/watch?v=3Kj6vOQ9ZXk;Doctor Myro
Why you NEED to take your jewelry off (during surgery);https://www.youtube.com/watch?v=L-EXNxAgoJI;Doctor Myro
Why anesthesia made her forget EVERYTHING!;https://www.youtube.com/watch?v=HG7Nn7P4P40;Doctor Myro
You should NEVER do this when pregnant;https://www.youtube.com/watch?v=4RR2aHzeYp0;Doctor Myro
Doctor Reacts: foot condom?!;https://www.youtube.com/watch?v=Rfr9qt6F5Fk;Doctor Myro
Doctor Reacts: tampon beef?!;https://www.youtube.com/watch?v=0m3_fRWHiWY;Doctor Myro
Not wearing a seatbelt? Think again;https://www.youtube.com/watch?v=GasWlUW0F6k;Doctor Myro
How babies live with cystic fibrosis;https://www.youtube.com/watch?v=gmGKp-_CGK8;Doctor Myro
Doctor Reacts: anesthesia gave her a crush;https://www.youtube.com/watch?v=cOkWRB-MUas;Doctor Myro
Why you should NEVER crack your neck!;https://www.youtube.com/watch?v=3oRMdUcnyTo;Doctor Myro
Doctor Reacts: seizure on the subway?;https://www.youtube.com/watch?v=Xw-VmzzDzD8;Doctor Myro
Can you do this with your eyes?!;https://www.youtube.com/watch?v=-Ww0t-hf1IE;Doctor Myro
Doctor Reacts: sandpaper skin?!;https://www.youtube.com/watch?v=aYhk01u20Nc;Doctor Myro
Doctor Reacts: HUGE ??;https://www.youtube.com/watch?v=EBDzd8EaOwQ;Doctor Myro
What happens when you hold in a fart too long;https://www.youtube.com/watch?v=QT5OLrwkcs0;Doctor Myro
Why this is DANGEROUS!;https://www.youtube.com/watch?v=jJTR7QEqmBg;Doctor Myro
This invention for Parkinsons is incredible!;https://www.youtube.com/watch?v=niGsNyxGrMw;Doctor Myro
Whats wrong with his fingers?!;https://www.youtube.com/watch?v=0qeHlPP6Aws;Doctor Myro
Doctor Reacts: gluteus injection;https://www.youtube.com/watch?v=2LHsfefJJGk;Doctor Myro
Try this stain removing life hack!;https://www.youtube.com/watch?v=ROa0DDnayhg;Doctor Myro
This was the top photo of 1987;https://www.youtube.com/watch?v=JnyX3oduuY0;Doctor Myro
Doctor Reacts: earthquake bed?!;https://www.youtube.com/watch?v=JodZL-5fWR0;Doctor Myro
Why THIS could cure your iron deficiency;https://www.youtube.com/watch?v=5u3sCseHssw;Doctor Myro
Is AI disrupting the medical field?;https://www.youtube.com/watch?v=sbo_qf5xR2I;Doctor Myro
Disneyland is good for kidney stones?!;https://www.youtube.com/watch?v=zEmtrogSv8M;Doctor Myro
Doctor Reacts: removing 23 contact lenses?!;https://www.youtube.com/watch?v=cXriT8Rf1FE;Doctor Myro
Doctor Reacts: living with HIV;https://www.youtube.com/watch?v=-N1JhzK0DO8;Doctor Myro
Doctor Reacts: fear of swallowing?!;https://www.youtube.com/watch?v=xKIX_8Lf0aM;Doctor Myro
What happens when you burn your eyes;https://www.youtube.com/watch?v=HHoLu-efhwo;Doctor Myro
Why false eyelashes are unhygenic;https://www.youtube.com/watch?v=g8xqK9PoBuw;Doctor Myro
Doctor Reacts: extreme frostbite;https://www.youtube.com/watch?v=O8VZDMMO2ik;Doctor Myro
Doctor Reacts: microchipping patients?!;https://www.youtube.com/watch?v=3LkRSXUPFWE;Doctor Myro
Whats stuck up her nose?!! ??;https://www.youtube.com/watch?v=rgXaR403Dcs;Doctor Myro
Why this surgeon is the real MVP!;https://www.youtube.com/watch?v=VY6MrKd8iY8;Doctor Myro
Do THIS to save your finger!;https://www.youtube.com/watch?v=N5feOu31wYo;Doctor Myro
Whats happening to this baby?!;https://www.youtube.com/watch?v=q7j-02cuGDs;Doctor Myro
Why NNN is worse than you think;https://www.youtube.com/watch?v=lbd1Luf_Bdw;Doctor Myro
How vocal cords REALLY work;https://www.youtube.com/watch?v=Y7wxG4GQfc4;Doctor Myro
How Stranger Things saved his life!;https://www.youtube.com/watch?v=ZTdXD0aCbZ8;Doctor Myro
Doctors React: rare foot condition;https://www.youtube.com/watch?v=6dj0OyHcWj0;Doctor Myro
This surgery can make you taller!;https://www.youtube.com/watch?v=ZN-y7GrrO_Q;Doctor Myro
This is what happens under anesthesia;https://www.youtube.com/watch?v=GPINCL6xAIQ;Doctor Myro
Why you don't want to get shot ??;https://www.youtube.com/watch?v=leH7zsv8Bm0;Doctor Myro
Can McDonalds cure a migraine?!;https://www.youtube.com/watch?v=JmvFrMrLejM;Doctor Myro
Million dollar lights?!;https://www.youtube.com/watch?v=f1IcuXIs34g;Doctor Myro
Doctor Reacts: Tourettes haircut;https://www.youtube.com/watch?v=2nVPkpWYWkw;Doctor Myro
Can this cure sore throats?!;https://www.youtube.com/watch?v=P75sJht_xBM;Doctor Myro
Doctor Reacts: shes having a seizure?!;https://www.youtube.com/watch?v=4NahMuACh_A;Doctor Myro
Doctor Reacts: lint rolling sunburn?;https://www.youtube.com/watch?v=WFAKmliQhII;Doctor Myro
Why this is EXTREMELY dangerous!;https://www.youtube.com/watch?v=51VaDtJHO0Q;Doctor Myro
He got a craving for WHAT?!;https://www.youtube.com/watch?v=hmsq6ai1NDg;Doctor Myro
Doctor Reacts: extreme tapeworm;https://www.youtube.com/watch?v=XDRoRxHjLkc;Doctor Myro
Doctor Reacts: dangerous miscommunication ??;https://www.youtube.com/watch?v=2ohPEdcOdHs;Doctor Myro
Doctors Explain: how to grow taller! (With @FootDocDana);https://www.youtube.com/watch?v=znhBd4d7WnE;Doctor Myro
Wedding day LIFE-CHANGING injury - Doctor Reacts;https://www.youtube.com/watch?v=FwjFec6BZbg;Doctor Myro
How doctors fix a shattered leg;https://www.youtube.com/watch?v=qn7Hf2f3js8;Doctor Myro
Why a broken heart can be DEADLY (with @FootDocDana);https://www.youtube.com/watch?v=j0-CQbHSJkk;Doctor Myro
She did WHAT in her pants?! ??;https://www.youtube.com/watch?v=QmNId-SL37E;Doctor Myro
Doctor Reacts: miracle supplement;https://www.youtube.com/watch?v=UDCpagHOROg;Doctor Myro
EMT's first day - Hilarious - Doctor Reacts;https://www.youtube.com/watch?v=r8r-G4jXSPQ;Doctor Myro
Doctor Reacts: bible bump;https://www.youtube.com/watch?v=lg8L0g3mBVA;Doctor Myro
Doctor Reacts: extreme allergic reaction;https://www.youtube.com/watch?v=WM2xPOAzeq4;Doctor Myro
Whats in his eye?!;https://www.youtube.com/watch?v=an2ivh3l7hE;Doctor Myro
Why bleach is one of the STRONGEST cleaners you can get;https://www.youtube.com/watch?v=UqRjW84Ltqw;Doctor Myro
She came for a colonoscopy WITH THAT?!! - Doctor Reacts #doctor #shorts;https://www.youtube.com/watch?v=D_TS9sBHnL0;Doctor Myro
Baby Organ Donor - Thank you Lukas #doctor #shorts;https://www.youtube.com/watch?v=Vjd0_z6r6dM;Doctor Myro
Doctor Reacts: whats on her skin?!;https://www.youtube.com/watch?v=2tWvpZOJU7k;Doctor Myro
THIS is why your legs fall asleep;https://www.youtube.com/watch?v=bQtpPS93r9Y;Doctor Myro
Why this surgeon is the real MVP!;https://www.youtube.com/watch?v=IxsipIp3wfs;Doctor Myro
POV: getting your tonsils removed;https://www.youtube.com/watch?v=wZSoDHCK9BA;Doctor Myro
Doctor Reacts: a satisfying by treatment;https://www.youtube.com/watch?v=2xxU6nXV0A4;Doctor Myro
Could you qualify for a free nosejob?!;https://www.youtube.com/watch?v=o1nkU--AreM;Doctor Myro
Doctor Reacts: unexpected birth ??;https://www.youtube.com/watch?v=w1RcBamq-XY;Doctor Myro
Doctor Reacts: drilling a skull?!;https://www.youtube.com/watch?v=OcYYS3KErkc;Doctor Myro
Doctor Reacts: $1,000,000 treatment;https://www.youtube.com/watch?v=YgRLCMv-wC8;Doctor Myro
He survived a double lung transplant!;https://www.youtube.com/watch?v=lVaDUNRK13Q;Doctor Myro
Why shopping carts are dirtier than you think ??;https://www.youtube.com/watch?v=XWOYNx9TQqQ;Doctor Myro
Her reaction to anesthesia is HILARIOUS;https://www.youtube.com/watch?v=pwGGLpzecNk;Doctor Myro
Doctor Reacts: night shifts at the hospital;https://www.youtube.com/watch?v=jnjL44So4u8;Doctor Myro
Why you should never sleep with your mouth open ??;https://www.youtube.com/watch?v=di76x43I1ss;Doctor Myro
His adorable reaction to anesthesia!;https://www.youtube.com/watch?v=zq4CUA--frE;Doctor Myro
Doctor Reacts: caught red-handed ??;https://www.youtube.com/watch?v=OT-QvpK_JP8;Doctor Myro
Snake crawled into her mouth? - Doctor Reacts;https://www.youtube.com/watch?v=yhOsIOyS8V4;Doctor Myro
Anesthesia ended their relationship?!;https://www.youtube.com/watch?v=egwUwshqPDE;Doctor Myro
Doctor Reacts to laser skin treatment;https://www.youtube.com/watch?v=kUfg5reYEMQ;Doctor Myro
Do doctors drive in style? @FootDocDana;https://www.youtube.com/watch?v=p7dgvpIsOIc;Doctor Myro
Doctor Reacts: extreme pedicure;https://www.youtube.com/watch?v=Y623S40yzjY;Doctor Myro
Doctor Reacts: removing eyeliner;https://www.youtube.com/watch?v=NGJHb1IPWno;Doctor Myro
Chiropractor #doctor #shorts;https://www.youtube.com/watch?v=A89092sF3JQ;Doctor Myro
This procedure helps you give birth;https://www.youtube.com/watch?v=Rki9bFLXS44;Doctor Myro
What are they doing to that eye?!;https://www.youtube.com/watch?v=UkH6kVgw9zQ;Doctor Myro
THIS is why hand washing is so important;https://www.youtube.com/watch?v=2aXawbNZiGE;Doctor Myro
She did WHAT after her colonoscopy?!;https://www.youtube.com/watch?v=ZeeYNhSmHVo;Doctor Myro
How does hydrogen peroxide work?;https://www.youtube.com/watch?v=YFmp1yIMSR8;Doctor Myro
Can your job FORCE you to work OVERTIME? Actually... #doctor #shorts;https://www.youtube.com/watch?v=mKFwDuODLos;Doctor Myro
Did you know eyes can do this?;https://www.youtube.com/watch?v=5Mwleab6QaA;Doctor Myro
Doctor Reacts: born with an extra finger;https://www.youtube.com/watch?v=jRGWUV7s6cI;Doctor Myro
Doctor Reacts: seizure on the subway?!;https://www.youtube.com/watch?v=uzYaA2252Ls;Doctor Myro
Should you use q tips to clean your ears?;https://www.youtube.com/watch?v=IN-2Xw-V_G0;Doctor Myro
Doctor Reacts: bone beard?!;https://www.youtube.com/watch?v=RwfJoDTgs1s;Doctor Myro
Doctor Reacts: fire therapy?!;https://www.youtube.com/watch?v=98NvStb6bsE;Doctor Myro
Would you get this surgery to grow taller?;https://www.youtube.com/watch?v=7rUb6oo0FZo;Doctor Myro
Could your razor give you tetanus?!;https://www.youtube.com/watch?v=Jq2QO0mJd8g;Doctor Myro
Did you know this sleep life hack?;https://www.youtube.com/watch?v=OSxdPDkSYww;Doctor Myro
Doctor Reacts: worst day ever;https://www.youtube.com/watch?v=ukLU-DwFabY;Doctor Myro
Doctor Reacts: fighting off anesthesia;https://www.youtube.com/watch?v=V8_s2EdCyEk;Doctor Myro
She unplugged her baby for a sandwich?!;https://www.youtube.com/watch?v=_8aDT2S1cXo;Doctor Myro
Doctor Reacts: robot CPR;https://www.youtube.com/watch?v=LnITSO6DW_4;Doctor Myro
Shes putting cancer in her hair?!;https://www.youtube.com/watch?v=-8Y1rY_AXIw;Doctor Myro
Doctor Reacts: sunbathing your ?? parts;https://www.youtube.com/watch?v=KWR5PJENvY8;Doctor Myro
Doctor Reacts: her head is steaming?!;https://www.youtube.com/watch?v=i6LmyhAwzmY;Doctor Myro
Doctor explains: how to replace a hip;https://www.youtube.com/watch?v=rjEoN3W41Bc;Doctor Myro
How we breathe for you under anesthesia;https://www.youtube.com/watch?v=9PccvE7dzKU;Doctor Myro
Why these are more dangerous than they look;https://www.youtube.com/watch?v=6Wcnh8mcaG8;Doctor Myro
Doctors React: expired EpiPen (with @FootDocDana);https://www.youtube.com/watch?v=yrzR27m7LNE;Doctor Myro
This is a silent killer ??;https://www.youtube.com/watch?v=zGfHeZTt980;Doctor Myro
Insane dance moves and his vertebral arteries #shorts;https://www.youtube.com/watch?v=7I8TlJfyt9E;Doctor Myro
Doctor Reacts: whats in his eye?!;https://www.youtube.com/watch?v=NagaAPryrlI;Doctor Myro
How does this procedure really work?;https://www.youtube.com/watch?v=v7I8ei7eZGM;Doctor Myro
They did surgery on a pepper?;https://www.youtube.com/watch?v=rnNbsYSeZlM;Doctor Myro
Could THIS be in your oysters?! ??;https://www.youtube.com/watch?v=hIa0ylXHEh8;Doctor Myro
How warts REALLY work;https://www.youtube.com/watch?v=dqszZ8wfVqU;Doctor Myro
Why tattoos last FOREVER;https://www.youtube.com/watch?v=EgkUam-ZtSU;Doctor Myro
Seen a tire bubble before? It can unalive you;https://www.youtube.com/watch?v=ahd9dUFtJL0;Doctor Myro
Why sleep is more important than you think;https://www.youtube.com/watch?v=mE_EUElnFoo;Doctor Myro
Are high heels bad for you?;https://www.youtube.com/watch?v=LJiiWHbUeI4;Doctor Myro
Halo drilled into her skull? Yup;https://www.youtube.com/watch?v=ponaacGQ-fU;Doctor Myro
Doctor explains why this saw cant hurt you;https://www.youtube.com/watch?v=62eR12DHmXI;Doctor Myro
Doctor Explains: pencil tattoo?;https://www.youtube.com/watch?v=Og4WSCaKfpk;Doctor Myro
Anesthesia for a brain dead patient?!;https://www.youtube.com/watch?v=xwfWHucEXRQ;Doctor Myro
Doctor Reacts: colonoscopy FAIL;https://www.youtube.com/watch?v=d-Djm9Ek5vc;Doctor Myro
Doctor Reacts: nail gun to the head?!;https://www.youtube.com/watch?v=_IFozHjDNHM;Doctor Myro
Doctor Reacts to Nipple Clamps;https://www.youtube.com/watch?v=U4n0EoYc8nQ;Doctor Myro
Doctor Reacts: kombucha is dangerous?;https://www.youtube.com/watch?v=7pYvf4hFTyI;Doctor Myro
Doctor Reacts: transparent eyelids?;https://www.youtube.com/watch?v=IHzCAgUtIfo;Doctor Myro
Is this skin life hack legit?;https://www.youtube.com/watch?v=vjuf_1pHuU0;Doctor Myro
ASMR comes with DIABETES #doctor #asmr;https://www.youtube.com/watch?v=ZR2APySBZqU;Doctor Myro
Why these batteries are DANGEROUS!;https://www.youtube.com/watch?v=xIrTvxBkMl4;Doctor Myro
Doctor Reacts: drilling a skull;https://www.youtube.com/watch?v=JdHbMLCgRUI;Doctor Myro
Why this fish could be LETHAL ??;https://www.youtube.com/watch?v=3Y17sebtZ8M;Doctor Myro
Why this dog deserves an Oscar ??;https://www.youtube.com/watch?v=lNrdoHz29aI;Doctor Myro
Chocolate Lowers Risk of High Blood Pressure and Stroke?!;https://www.youtube.com/watch?v=rz9Nigq0vOc;Doctor Myro
Doctor Reacts: EXTREME shoulder crack;https://www.youtube.com/watch?v=HvtR0FjM6i4;Doctor Myro
THIS is how you breathe during surgery;https://www.youtube.com/watch?v=Q_ZOJoyv4lI;Doctor Myro
Anesthesia is NOT like sleep. Here's why;https://www.youtube.com/watch?v=XGX4fH0ELqU;Doctor Myro
Heart attack at 20 yo?!!! #doctor;https://www.youtube.com/watch?v=b4sTmXQyrjA;Doctor Myro
Could you survive this blow?!;https://www.youtube.com/watch?v=laykcTkuMeI;Doctor Myro
Why organ donation transforms lives!;https://www.youtube.com/watch?v=ZjRPz9Al8mw;Doctor Myro
What are they doing to this baby?!;https://www.youtube.com/watch?v=Y1iMA3m5jwU;Doctor Myro
Why HONEY could save a life!;https://www.youtube.com/watch?v=fo86wA2O0dU;Doctor Myro
Doctor Reacts: emergency CPR;https://www.youtube.com/watch?v=yqCEkssUZ3g;Doctor Myro
Doctor Reacts to extreme injection!;https://www.youtube.com/watch?v=DLH3TG1jGNw;Doctor Myro
Whats on his leg?;https://www.youtube.com/watch?v=NY71hogNgS0;Doctor Myro
Why you should NEVER massage gun your neck!;https://www.youtube.com/watch?v=8Fa1ld5sGHA;Doctor Myro
Doctor Reacts: they gave him fentanyl?!;https://www.youtube.com/watch?v=QyPzOSbbIN8;Doctor Myro
He was NOT prepared to hear that ??;https://www.youtube.com/watch?v=N02DHnbC9zk;Doctor Myro
What are they doing to this baby?;https://www.youtube.com/watch?v=VJ99lll-3mw;Doctor Myro
Doctor Explains: Do neurons regenerate?;https://www.youtube.com/watch?v=AOd_csflaHU;Doctor Myro
What are they pulling out of her spine?!;https://www.youtube.com/watch?v=_79Xjrj0zAc;Doctor Myro
Seizure in a metro #doctor reacts #shorts;https://www.youtube.com/watch?v=oIt3CkDopa8;Doctor Myro
Anesthesiologists in the OR;https://www.youtube.com/watch?v=ptLAFqnzrZ0;Doctor Myro
Why THIS could cure nausea!;https://www.youtube.com/watch?v=dZjEPtVMtd4;Doctor Myro
Doctor Reacts: whats in their eye?!;https://www.youtube.com/watch?v=pP0snnvgiT8;Doctor Myro
Do strokes prevent wrinkles?!;https://www.youtube.com/watch?v=5vULIRGFfM0;Doctor Myro
Doctor Reacts: MRI disaster!;https://www.youtube.com/watch?v=S1kdRgbg7jk;Doctor Myro
This is the best treatment for scars!;https://www.youtube.com/watch?v=mlNT8czyZwg;Doctor Myro
The moment he realized he got a hernia ??;https://www.youtube.com/watch?v=8DMcB1kunp4;Doctor Myro
Doctor Reacts: whats on her head?!;https://www.youtube.com/watch?v=W4jLICA1MbQ;Doctor Myro
Doctor Explains: fear of swallowing?!;https://www.youtube.com/watch?v=y06inkIUK10;Doctor Myro
Doctor Explains the blowers disease;https://www.youtube.com/watch?v=7TRVox4DpA0;Doctor Myro
Doctor Reacts: extreme nose job!;https://www.youtube.com/watch?v=Bjvq4-sHCq4;Doctor Myro
Doctor Reacts: extreme first aid;https://www.youtube.com/watch?v=SdqA2xoLaS0;Doctor Myro
What happened to all the disorganized kids?;https://www.youtube.com/watch?v=Kxrm7dZk-S4;Doctor Myro
Stranger Things saved his life!;https://www.youtube.com/watch?v=gCRgbVwUzyU;Doctor Myro
When your nails are too long;https://www.youtube.com/watch?v=FHy58V6LR9M;Doctor Myro
Iron lungs - Doctor Explains #doctor #shorts;https://www.youtube.com/watch?v=bb4yDKNZIcc;Doctor Myro
Whats in his hand? @cgbarbershop;https://www.youtube.com/watch?v=SEToQhoCxvM;Doctor Myro
Doctor Reacts: the disease that killed Steve Jobs;https://www.youtube.com/watch?v=Tn8SEsr4HOU;Doctor Myro
Is AI disrupting the medical field?!;https://www.youtube.com/watch?v=ljFp_66Xcww;Doctor Myro
Does the pullout method really work?;https://www.youtube.com/watch?v=UBJdnYpe7_M;Doctor Myro
This is a sad statistic ??;https://www.youtube.com/watch?v=jRwQ5EcmH8Q;Doctor Myro
What are they doing to him?!;https://www.youtube.com/watch?v=6TNz-uTMSmk;Doctor Myro
What happened to her lips?!;https://www.youtube.com/watch?v=AyH8ga3srUA;Doctor Myro
Are these the toughest hands in the world?!;https://www.youtube.com/watch?v=w-Gyw-khmZM;Doctor Myro
Doctor Reacts: whats on their hand?!;https://www.youtube.com/watch?v=Bwffi0DOAHo;Doctor Myro
Doctor Reacts: expired watermelon;https://www.youtube.com/watch?v=1_WdVaRu-kI;Doctor Myro
What happens when you go under General Anesthesia #shorts #anesthesiologist;https://www.youtube.com/watch?v=3gof4vbyAAs;Doctor Myro
How to stay awake during surgery;https://www.youtube.com/watch?v=fw9GMCirj-4;Doctor Myro
Doctor Reacts: his wife will be mad ??;https://www.youtube.com/watch?v=yDL_oqLe3rM;Doctor Myro
How HealFast changed my life;https://www.youtube.com/watch?v=fSsoYwdHmZ8;Doctor Myro
Wrapping cabbage on the knee for pain control - Doctor Reacts #shorts;https://www.youtube.com/watch?v=4-T4RKdJBWI;Doctor Myro
An unexpected side effect of anesthesia...;https://www.youtube.com/watch?v=bJGAF-xHlms;Doctor Myro
Why redheads are different;https://www.youtube.com/watch?v=SW7DfIIgXaQ;Doctor Myro
Doctor Reacts: they popped his shoulder?!;https://www.youtube.com/watch?v=uWCVy7d3Vak;Doctor Myro
GRWM: contagious disease edition;https://www.youtube.com/watch?v=B6yRtnOih9w;Doctor Myro
Are energy drinks dangerous?!;https://www.youtube.com/watch?v=z8T9uW8AKOY;Doctor Myro
The hardest part of being an anesthesiologist;https://www.youtube.com/watch?v=wyRBWjZIJCk;Doctor Myro
How does an allergy test work? #doctor #shorts;https://www.youtube.com/watch?v=_24fx9PuH24;Doctor Myro
Could this give you tetanus?;https://www.youtube.com/watch?v=WlPNgEv6Xx0;Doctor Myro
This is how kidney stones are removed;https://www.youtube.com/watch?v=g3dy7-XjuNg;Doctor Myro
Try this to fall asleep faster!;https://www.youtube.com/watch?v=hEBZZLQzyy4;Doctor Myro
Medical students be like;https://www.youtube.com/watch?v=Uw1WIkfWoL0;Doctor Myro
This story is heartbreaking;https://www.youtube.com/watch?v=8j9IwMNxuA0;Doctor Myro
Doctor Reacts: she put WHAT on her foot?!;https://www.youtube.com/watch?v=6FoR5nRgpPc;Doctor Myro
Why caffeine pills are INTENSE;https://www.youtube.com/watch?v=Dui2YdOHeJM;Doctor Myro
Pelvic Exams WITHOUT consent UNDER Anesthesia are LEGAL ??;https://www.youtube.com/watch?v=OyLfpAvP10U;Doctor Myro
How much do anesthesiologists REALLY make?;https://www.youtube.com/watch?v=IXSbK1siAP0;Doctor Myro
Surgery to get TALLER (w/ @FootDocDana);https://www.youtube.com/watch?v=X3dPPRDh098;Doctor Myro
Steve Jobs regretted this life or death medical decision - #Doctor Explains;https://www.youtube.com/watch?v=nsKQi_4A974;Doctor Myro
Doctor Explains: hair transplants;https://www.youtube.com/watch?v=9rkqOE9Ft4s;Doctor Myro
Doctor Reacts: mogging the classroom;https://www.youtube.com/watch?v=8P4et7K90u4;Doctor Myro
Doctor Reacts: oysters at In n Out?!;https://www.youtube.com/watch?v=gKjYz9gQjOc;Doctor Myro
Doctor Reacts: anesthesia for a child;https://www.youtube.com/watch?v=pzxMNPVxfBs;Doctor Myro
Why THIS could lead to diabetes ??;https://www.youtube.com/watch?v=U7aEyHLOSEM;Doctor Myro
Doctor reacts to colonoscopy;https://www.youtube.com/watch?v=6HjJGWI_C8k;Doctor Myro
Robot in the hospital ??;https://www.youtube.com/watch?v=c4xymgazIqA;Doctor Myro
Robot in the hospital ??;https://www.youtube.com/watch?v=c4xymgazIqA;Doctor Myro
Doctor Explains the blowers disease;https://www.youtube.com/watch?v=hEV06LG1rzI;Doctor Myro
Doctor Reacts: extreme sunburn!;https://www.youtube.com/watch?v=9VwOz89VmaQ;Doctor Myro
She's pregnant reaction - priceless ???????????? #doctor;https://www.youtube.com/watch?v=YNLNFWI3qxc;Doctor Myro
Why is she breathing into a syringe?!;https://www.youtube.com/watch?v=5gNXSvfAYLA;Doctor Myro
This is what blindness looks like;https://www.youtube.com/watch?v=Y01x9TINp0Q;Doctor Myro
