Title;Link;Creator
What it takes to be a Chiropractor on YouTube #doctor;https://www.youtube.com/watch?v=0IxGEd2ASyk;Doctor Myro
Whats wrong with his eye?!;https://www.youtube.com/watch?v=ObVX5u_2Xo4;Doctor Myro
Doctor Reacts: Extreme leg condition;https://www.youtube.com/watch?v=cFIk3g6zdHM;Doctor Myro
Can he beat anesthesia?!;https://www.youtube.com/watch?v=-FCGZ_1vffc;Doctor Myro
Why dont cast saws cut you?;https://www.youtube.com/watch?v=wnG2PCEcPOc;Doctor Myro
Doctor Reacts: colonoscopy surprise?;https://www.youtube.com/watch?v=X8fsAJXbH28;Doctor Myro
Undercooked meat can give you THIS?!;https://www.youtube.com/watch?v=OZPSFWVUzyw;Doctor Myro
Why you should NOT cut your cuticles at the salon;https://www.youtube.com/watch?v=Dokao7zoqU8;Doctor Myro
Anesthesiologist murders a colleague;https://www.youtube.com/watch?v=9yni_1zFn4g;Doctor Myro
Anesthesiologist murders a colleague;https://www.youtube.com/watch?v=9yni_1zFn4g;Doctor Myro
Doctor Reacts: octopus on her face?!;https://www.youtube.com/watch?v=gRLpP0a_6QU;Doctor Myro
Whats wrong with his leg?;https://www.youtube.com/watch?v=I7ixSN5RZuM;Doctor Myro
Is this treatment safe?!;https://www.youtube.com/watch?v=poiM4dDpVyU;Doctor Myro
THIS is what fertilization looks like;https://www.youtube.com/watch?v=ecC6vHIe-70;Doctor Myro
Doctor Reacts: choking on an orange?!;https://www.youtube.com/watch?v=pVponJT3DIw;Doctor Myro
Why are you paralyzed for intubation?;https://www.youtube.com/watch?v=2-Lw6sdXd7g;Doctor Myro
Becoming a Savant After Brain Surgery - Doctor Reacts #doctors #shorts;https://www.youtube.com/watch?v=U8gEwwgRYyM;Doctor Myro
Doctor Reacts: ankle shaman?!;https://www.youtube.com/watch?v=Cg3ITLYYMuI;Doctor Myro
Doctor Reacts: extreme cyst treatment;https://www.youtube.com/watch?v=1c5iIlufibM;Doctor Myro
Our doctor fits for the week!;https://www.youtube.com/watch?v=43ZXJBc3Zmg;Doctor Myro
This is what an Achilles tear looks like;https://www.youtube.com/watch?v=DguveIkNsF0;Doctor Myro
This babys head is breathing?!;https://www.youtube.com/watch?v=HUsSu7DNzBk;Doctor Myro
Doctor Explains: zapping his heart;https://www.youtube.com/watch?v=lTEUiBTlMW0;Doctor Myro
When your card declines at the hospital;https://www.youtube.com/watch?v=C4oe9okGkYM;Doctor Myro
Doctor Reacts: oddly satisfying nasal rinse;https://www.youtube.com/watch?v=6wkdqmVsQec;Doctor Myro
Doctor Reacts: popping a dislocated arm;https://www.youtube.com/watch?v=FEJ0F_7eO40;Doctor Myro
This skin treatment is oddly satisfying!;https://www.youtube.com/watch?v=WjmwMqp4gC8;Doctor Myro
How does the babys skin look like that?;https://www.youtube.com/watch?v=VQUYfg_WM_0;Doctor Myro
Can you complete this hearing challenge?;https://www.youtube.com/watch?v=4uoU2kkIcIM;Doctor Myro
Infections you can get from a kiss ?? - #doctor #medical;https://www.youtube.com/watch?v=4n8HgeKBzIU;Doctor Myro
How she lives without breathing!;https://www.youtube.com/watch?v=vOM9SBMs6wY;Doctor Myro
Anesthesiologists according to AI;https://www.youtube.com/watch?v=PVJBZMa_QdI;Doctor Myro
Doctor Reacts: eyeball tatto?!;https://www.youtube.com/watch?v=TZ9D0l6vNkE;Doctor Myro
Why a pregnancy test could be bad for MEN;https://www.youtube.com/watch?v=mtYZT_FJL8w;Doctor Myro
THIS could save your friends life;https://www.youtube.com/watch?v=5GP7moTGJ80;Doctor Myro
Doctors on YouTube raking in $100,000+ in big pharma money;https://www.youtube.com/watch?v=e0PVtLrTxM4;Doctor Myro
Can you sneeze with your eyes open?;https://www.youtube.com/watch?v=99UOvYujuz8;Doctor Myro
Doctor Reacts: hand amputation?!;https://www.youtube.com/watch?v=V6ixZwW8k9k;Doctor Myro
Doctor Reacts: touching boiling oil?!;https://www.youtube.com/watch?v=oTuTRsdJJgY;Doctor Myro
Doctor Reacts: preparing him for surgery;https://www.youtube.com/watch?v=ncv0lqhD4zA;Doctor Myro
Doctor Reacts: eating tarantulas?!;https://www.youtube.com/watch?v=p4-poGO30Gw;Doctor Myro
Doctor Reacts: thrifting is dangerous?!;https://www.youtube.com/watch?v=it0Mz1o7wXI;Doctor Myro
How to breathe without breathing!;https://www.youtube.com/watch?v=epLL_MDv21o;Doctor Myro
Doctor Reacts: poking his brain?!;https://www.youtube.com/watch?v=wIW1QsRUqvM;Doctor Myro
THESE are everyones final regrets;https://www.youtube.com/watch?v=m4l2nYfYCvM;Doctor Myro
Awake Fiberoptic Intubation for Airway Tumor;https://www.youtube.com/watch?v=dHFgw3-b7ss;Doctor Myro
How you breathe during surgery;https://www.youtube.com/watch?v=fOmo15W6IA0;Doctor Myro
Why strawberries are dirtier than you think;https://www.youtube.com/watch?v=j4hetP8ZvIQ;Doctor Myro
Weirdest swing Ive ever seen #doctor #shorts;https://www.youtube.com/watch?v=OFhGHsE5S4Q;Doctor Myro
Doctor Reacts: finger gloves?;https://www.youtube.com/watch?v=4YB6w1uf6PY;Doctor Myro
Doctors Explain: how to save a life (With @FootDocDana);https://www.youtube.com/watch?v=coIPkpL3Fik;Doctor Myro
Taylor Swift Under Anesthesia - Anesthesiologist Reacts #funny;https://www.youtube.com/watch?v=jzWIGs0rfnM;Doctor Myro
Doctor Reacts: toe for a thumb?!;https://www.youtube.com/watch?v=L_z154zGOLY;Doctor Myro
Doctor Reacts: passing out from deadlifting?;https://www.youtube.com/watch?v=b0akx2xIZwA;Doctor Myro
Is this a sign of iron deficiency?;https://www.youtube.com/watch?v=dkfK-EqWUUM;Doctor Myro
Doctor Reacts: tattoo in the operating room;https://www.youtube.com/watch?v=b6WOyG_Ah7s;Doctor Myro
Shes giving herself anesthesia?!;https://www.youtube.com/watch?v=xNzFOLpJTBA;Doctor Myro
What happens when you dont shower ??;https://www.youtube.com/watch?v=IM-n9BwFDVM;Doctor Myro
Smokers lungs looks like this (with @FootDocDana) #doctor;https://www.youtube.com/watch?v=7AzOWNhhI-Y;Doctor Myro
Whats wrong with his eye?!;https://www.youtube.com/watch?v=YVuVm9e-lyg;Doctor Myro
How surgeons change a battery!;https://www.youtube.com/watch?v=dyUky3Sn5nU;Doctor Myro
Doctor Reacts: hand amputation?!;https://www.youtube.com/watch?v=IJw-Lpb5a08;Doctor Myro
Did the gym give him hypertension?!;https://www.youtube.com/watch?v=oaKIqoPLNY8;Doctor Myro
Pigg-O-Stat - This device is still in use since 1960s;https://www.youtube.com/watch?v=CM4MMtICKwM;Doctor Myro
Doctor Reacts: MRI at the zoo?!;https://www.youtube.com/watch?v=XRRcKzDtcD0;Doctor Myro
Doctor Reacts: touching boiling oil?!;https://www.youtube.com/watch?v=hE2St0d2cTU;Doctor Myro
Doctor Reacts: traveling down a throat;https://www.youtube.com/watch?v=kJjg0jJ-mE8;Doctor Myro
This is my story;https://www.youtube.com/watch?v=CCzFsQCHxZY;Doctor Myro
Can beards cause infections?!;https://www.youtube.com/watch?v=iVNV9X3gsA0;Doctor Myro
Doctor Reacts: amazing pill life hack!;https://www.youtube.com/watch?v=7P9OdJMXdcs;Doctor Myro
Doctor Reacts: fish therapy?!;https://www.youtube.com/watch?v=67hKNMzdYtw;Doctor Myro
This fella lived inside of her ear ??;https://www.youtube.com/watch?v=2b77ljAcRZk;Doctor Myro
Doctor Explains: ?? after eating;https://www.youtube.com/watch?v=vAZkY9mBT70;Doctor Myro
Why everyone has anxiety;https://www.youtube.com/watch?v=0zmPE53IgkU;Doctor Myro
Spin class made him sick?!;https://www.youtube.com/watch?v=tBpQv-_cKV8;Doctor Myro
Could this cure hangovers?!;https://www.youtube.com/watch?v=mCar_yPxcEg;Doctor Myro
Why false eyelashes are unhygenic;https://www.youtube.com/watch?v=p1Mf_vt0iyM;Doctor Myro
What happened to his head?!;https://www.youtube.com/watch?v=RLIisI_gwHg;Doctor Myro
What NOT to do if youre ??d;https://www.youtube.com/watch?v=tpuDmbRTDeY;Doctor Myro
How to DESTROY a kidney stone!;https://www.youtube.com/watch?v=IVBQYUnmHgc;Doctor Myro
What are they putting in her eye?!;https://www.youtube.com/watch?v=npAmyTEml3I;Doctor Myro
Doctor Reacts: surgery on a tiger?!;https://www.youtube.com/watch?v=mc-CEb-NTI0;Doctor Myro
THIS can be a sign of heart failure;https://www.youtube.com/watch?v=3cC3e9JvdWU;Doctor Myro
Why steak can cause THIS;https://www.youtube.com/watch?v=wT4exhzVL-w;Doctor Myro
THIS is the craziest surgery;https://www.youtube.com/watch?v=Wi3ZteYVANU;Doctor Myro
She was about to name the child after her Anesthesiologist #shorts;https://www.youtube.com/watch?v=RfFxTp5H18U;Doctor Myro
Doctors used to drink urine?!;https://www.youtube.com/watch?v=IVLHWi24qB4;Doctor Myro
What CT scanner looks like on the inside #doctor #shorts;https://www.youtube.com/watch?v=6varXiwqJ50;Doctor Myro
How to eat without eating!;https://www.youtube.com/watch?v=Vb4NpSMl3mc;Doctor Myro
Why this is actually dangerous!;https://www.youtube.com/watch?v=mz6e2gMBwYM;Doctor Myro
Doctor Reacts: whats in her mouth?!;https://www.youtube.com/watch?v=xR94-kWr4oc;Doctor Myro
Theres roaches in your coffee?!;https://www.youtube.com/watch?v=6f8TKeOeW74;Doctor Myro
What happened to her eye?!;https://www.youtube.com/watch?v=SjtdqINGDog;Doctor Myro
This is what heart failure looks like;https://www.youtube.com/watch?v=TgJLMC-nIyA;Doctor Myro
Why you HAVE to wear a seatbelt;https://www.youtube.com/watch?v=jVyFsJlSXEU;Doctor Myro
Theres fungus on her leg?!;https://www.youtube.com/watch?v=4wqYofOIOaw;Doctor Myro
Career advice from an anesthesiologist!;https://www.youtube.com/watch?v=7Mb8gr7WfSU;Doctor Myro
He realized patient is DNR (do not resuscitate) while doing CPR ?? - Doctor Reacts;https://www.youtube.com/watch?v=oNxP7NzD4do;Doctor Myro
Doctor Reacts: pregnant from a swimming pool?!;https://www.youtube.com/watch?v=rmLy3HsUZSQ;Doctor Myro
Not so Successful CPR #doctor;https://www.youtube.com/watch?v=RKes0VJC0mA;Doctor Myro
Doctor Reacts: his side hustle is crazy ??;https://www.youtube.com/watch?v=ZYjIPMo35Ks;Doctor Myro
Can you guess his nickname?;https://www.youtube.com/watch?v=M0MyJ1048ms;Doctor Myro
This first aid tip could save a life!;https://www.youtube.com/watch?v=KqDBG61m7E8;Doctor Myro
Why your implants outlive you ??;https://www.youtube.com/watch?v=2U_iPrU4uYc;Doctor Myro
Why THIS is extremely dangerous;https://www.youtube.com/watch?v=uQ1cLTcZG0U;Doctor Myro
What happened to his finger?!;https://www.youtube.com/watch?v=4EcwJ4OAPEA;Doctor Myro
How to avoid these common surgeries!;https://www.youtube.com/watch?v=PFMcfx6QY58;Doctor Myro
What happens after death? (According to science);https://www.youtube.com/watch?v=jNG-qBDnb5E;Doctor Myro
His reaction to anesthesia is hilarious!;https://www.youtube.com/watch?v=Rskenn0qKh0;Doctor Myro
Doctor Reacts: why she cant swallow anything;https://www.youtube.com/watch?v=_0Y7yVPaqC0;Doctor Myro
Relocating a Shoulder Dislocation #doctor #shorts;https://www.youtube.com/watch?v=YlnBBAVA7Ug;Doctor Myro
This is how EpiPens REALLY work (With @FootDocDana);https://www.youtube.com/watch?v=_zR_nDwiSAc;Doctor Myro
Doctor Reacts: inhaling bleach?!;https://www.youtube.com/watch?v=w1vDmCS1b8E;Doctor Myro
This is how you can save a friend!;https://www.youtube.com/watch?v=Y96DSCWqX3k;Doctor Myro
Pacing the heart through the chest #doctor #shorts;https://www.youtube.com/watch?v=dbn9wWJs58A;Doctor Myro
Infinite soda glitch - #doctor explains esophagostomy tube;https://www.youtube.com/watch?v=hpS7pFvB7ng;Doctor Myro
Infinite soda glitch - #doctor explains esophagostomy tube;https://www.youtube.com/watch?v=hpS7pFvB7ng;Doctor Myro
What I DONT like about this Lamborghini;https://www.youtube.com/watch?v=vet1TKOOZI8;Doctor Myro
How does he function with screws in his head? #doctorexplains #shorts;https://www.youtube.com/watch?v=e0gotQ7EZ1c;Doctor Myro
Youre not a true gamer unless youve done this before ??;https://www.youtube.com/watch?v=qnnAQqW_0QQ;Doctor Myro
You NEED to know this band aid life hack;https://www.youtube.com/watch?v=dKRQCZNRY4Y;Doctor Myro
This doctor is going to prison for 45 YEARS!;https://www.youtube.com/watch?v=pq0S2Lm4dhQ;Doctor Myro
This could be DISASTROUS! (With @FootDocDana);https://www.youtube.com/watch?v=BVy2LhDG4Mw;Doctor Myro
The things you see in a psych ward;https://www.youtube.com/watch?v=nyBu7YI0oy8;Doctor Myro
How does this weight loss hack REALLY work?!;https://www.youtube.com/watch?v=iVpKhEe3c-Y;Doctor Myro
This is why your eye twitches!;https://www.youtube.com/watch?v=fYfRXd2xk50;Doctor Myro
They removed 23 contact lenses from her eye ??;https://www.youtube.com/watch?v=PrMpfp2TuYE;Doctor Myro
Is this the future of multitasking?;https://www.youtube.com/watch?v=M61E7Lxz4dU;Doctor Myro
Why THIS is the right way to treat scars!;https://www.youtube.com/watch?v=OAPM9iR8SOs;Doctor Myro
Doctor Explains: dissolvable stitches;https://www.youtube.com/watch?v=8xgXcwLNf_I;Doctor Myro
Doctor Reacts to CRAZY nail timelapse;https://www.youtube.com/watch?v=BKLZZIApyAo;Doctor Myro
You won't believe what these cysts are made of;https://www.youtube.com/watch?v=fVzhkb5S_vA;Doctor Myro
Anesthesia made her fall in love;https://www.youtube.com/watch?v=-RvYXBDrGnA;Doctor Myro
Doctor Reacts: extreme broken arm;https://www.youtube.com/watch?v=3pv5KFGyS5k;Doctor Myro
Doctor Reacts: toe treatment;https://www.youtube.com/watch?v=k-gUIuQ0QNM;Doctor Myro
Anesthesia made him confess! ??;https://www.youtube.com/watch?v=g_oBZfYTx0c;Doctor Myro
This is your sign to stop biting your nails;https://www.youtube.com/watch?v=sRksSsMwUQ4;Doctor Myro
Doctor Reacts: popping a blister;https://www.youtube.com/watch?v=GlRy1DKbC7w;Doctor Myro
Whats in her mouth?!;https://www.youtube.com/watch?v=wDIqHojd9hM;Doctor Myro
Why rare steak is more dangerous than you think ??;https://www.youtube.com/watch?v=oeYuL9fF7Og;Doctor Myro
Doctor Reacts: strange skin patterns;https://www.youtube.com/watch?v=IG11mPP-z4g;Doctor Myro
Why these students are sleeping in class!;https://www.youtube.com/watch?v=7t7-aPZXU8I;Doctor Myro
Fat loss hack delivers are promised ??;https://www.youtube.com/watch?v=NnMpDM0z92U;Doctor Myro
How to chop onions without crying!;https://www.youtube.com/watch?v=8Y2MO7T0YaY;Doctor Myro
Doctor Explains: nasal breathing tubes;https://www.youtube.com/watch?v=jN4ctQ3H6vo;Doctor Myro
Parkour accident ?? @hazalnhr;https://www.youtube.com/watch?v=JLEKB0gxlaM;Doctor Myro
Doctor Reacts: strange knee sound;https://www.youtube.com/watch?v=47dpnYQ-kfo;Doctor Myro
Doctor Reacts: grapes in her nose?!;https://www.youtube.com/watch?v=w9JnyykunjY;Doctor Myro
Husband Passes Out During Wife's Delivery;https://www.youtube.com/watch?v=7fIevpZX2Hg;Doctor Myro
How to save a wifes life!;https://www.youtube.com/watch?v=dKVx-_GQnVA;Doctor Myro
Doctor Reacts: extreme muscle cramps;https://www.youtube.com/watch?v=4FdCiz3mV4k;Doctor Myro
This is how ridiculous health costs are;https://www.youtube.com/watch?v=Kcqw9BHbDFs;Doctor Myro
How a port is implanted;https://www.youtube.com/watch?v=QJHjZO6WIh8;Doctor Myro
Could fish oils be dangerous?;https://www.youtube.com/watch?v=X_kkOgRmBEI;Doctor Myro
This is what hemorrhoids look like?!;https://www.youtube.com/watch?v=KICI3_7JlD4;Doctor Myro
Breathing tube insertion during surgery explained #doctor #shorts;https://www.youtube.com/watch?v=ZTxK0mc7060;Doctor Myro
This is why CPR saves lives;https://www.youtube.com/watch?v=tsFpXqyb7PM;Doctor Myro
Is this migraine hack legit?;https://www.youtube.com/watch?v=eWOXp3gd0Rw;Doctor Myro
"""nobody loves me"" ?? - CUUUTTEE Anesthesia Reaction - Anesthesiologist Reacts #shorts";https://www.youtube.com/watch?v=5PgN_Bq0KCY;Doctor Myro
Why sleep deprivation is DANGEROUS;https://www.youtube.com/watch?v=1Dg-Kl2csuM;Doctor Myro
How I get through 24 hour shifts #doctor explains;https://www.youtube.com/watch?v=D93tve5ZW5Q;Doctor Myro
This is how you breathe in surgery;https://www.youtube.com/watch?v=ZK1oYgFjofI;Doctor Myro
Why pregnancy is a BIG deal!;https://www.youtube.com/watch?v=QjyST29L7PY;Doctor Myro
Why men can test positive for pregnancy;https://www.youtube.com/watch?v=ESctXHptQ04;Doctor Myro
My farewell to TikTok;https://www.youtube.com/watch?v=e8IxRYKZZHQ;Doctor Myro
Doctor Reacts: barbecue leg?!;https://www.youtube.com/watch?v=FoIGgNoWvYw;Doctor Myro
Doctor Reacts: UNBELIEVABLE medical history;https://www.youtube.com/watch?v=AdTsKta4z08;Doctor Myro
This is how tattoos last forever;https://www.youtube.com/watch?v=YiLsMcDx-Ms;Doctor Myro
A scary moment in the operating room;https://www.youtube.com/watch?v=6ut8nK1XM6M;Doctor Myro
Doctor Reacts: emergency anesthesia?;https://www.youtube.com/watch?v=y4OJDVfnfVE;Doctor Myro
Why dont cast saws cut you?;https://www.youtube.com/watch?v=K8DEwcam-Oc;Doctor Myro
Could ChatGPT replace your doctor?!;https://www.youtube.com/watch?v=y4_YncJLnnI;Doctor Myro
"Funny Anesthesia Reactions ?????? ""Nothing hurts me!"" - Episode 2 #doctor #shorts";https://www.youtube.com/watch?v=R3-6zzu8jY4;Doctor Myro
This surgery can make you taller!;https://www.youtube.com/watch?v=nqJwaQCS7Jk;Doctor Myro
Human Heart in a Box #doctor #shorts;https://www.youtube.com/watch?v=GFo60A74fBI;Doctor Myro
Erm Tylenol isnt gonna cut it for this guys #anesthesiologist #surgery;https://www.youtube.com/watch?v=vjkQvyDe7Qo;Doctor Myro
Why THIS can prevent heart attacks;https://www.youtube.com/watch?v=wqoLEVil4nc;Doctor Myro
"""It's a HOOD snack "" - Hilarious Anesthesia Reaction - Anesthesiologist Explains";https://www.youtube.com/watch?v=DdCm_nRB1oA;Doctor Myro
Doctor Reacts: a hero in action;https://www.youtube.com/watch?v=qAQX4Wwh1Tg;Doctor Myro
He hasnt eaten for 2 years!;https://www.youtube.com/watch?v=8jXzHHyxHNI;Doctor Myro
My 8th BEST video of 2022 - Finger Amputation with a wooden spoon #doctor #shorts;https://www.youtube.com/watch?v=sIFCKZbe1CQ;Doctor Myro
Doctor Reacts: dislocated knee;https://www.youtube.com/watch?v=OGS-U77Lkew;Doctor Myro
What to do when you cant fall asleep!;https://www.youtube.com/watch?v=L21YPNgiS5M;Doctor Myro
Would you eat this venomous fish?;https://www.youtube.com/watch?v=MolybsFeMck;Doctor Myro
Scalpels are HOW sharp?;https://www.youtube.com/watch?v=DnCH2SBrkuI;Doctor Myro
She never knew she was pregnant?!;https://www.youtube.com/watch?v=MIdSVPEFmww;Doctor Myro
Whats in his nose?!;https://www.youtube.com/watch?v=xMFzYEbqJo8;Doctor Myro
He didn't want my Anesthesia... #doctor #shorts;https://www.youtube.com/watch?v=tCLAZxtJI0Y;Doctor Myro
Can eye color affect your driving?!;https://www.youtube.com/watch?v=U5fi4DrkbiM;Doctor Myro
This is your sign to get a new helmet;https://www.youtube.com/watch?v=6xTU9-mZZic;Doctor Myro
What happens when you wake up from surgery?;https://www.youtube.com/watch?v=KnUvaSGQveI;Doctor Myro
This surgery makes you taller!;https://www.youtube.com/watch?v=o_QxzT-lYdI;Doctor Myro
Do pregnancy tests have Plan B pills in them?!;https://www.youtube.com/watch?v=FLpKuWKfb0k;Doctor Myro
Why lifting could save your life?!;https://www.youtube.com/watch?v=U5piJh9U2Wg;Doctor Myro
Why this machine breathes for her!;https://www.youtube.com/watch?v=f0189XIUb34;Doctor Myro
Barbecue sauce in the operating room?!;https://www.youtube.com/watch?v=6p1G-eVgc8c;Doctor Myro
Are doctors being overpaid?;https://www.youtube.com/watch?v=5mLvTYQ1a3w;Doctor Myro
Doctor Reacts: the perfect thing for childbirth;https://www.youtube.com/watch?v=XJplxGEn4Js;Doctor Myro
How to screen for breast cancer!;https://www.youtube.com/watch?v=xMEaeBS1q1A;Doctor Myro
Doctor Reacts: hilarious anesthesia reactions;https://www.youtube.com/watch?v=zsQWLvdGnis;Doctor Myro
What would you change if you could be 30 again?;https://www.youtube.com/watch?v=W-7Agb2sgcY;Doctor Myro
Doctor Reacts: whats in her eye?!;https://www.youtube.com/watch?v=m6SR5nwDdxc;Doctor Myro
Doctor Reacts: the most satisfying treatment;https://www.youtube.com/watch?v=umKIi6imIJ4;Doctor Myro
Doctor Reacts: heart attack on camera;https://www.youtube.com/watch?v=wGW3U4jZcdI;Doctor Myro
Why THIS is a bad idea ??;https://www.youtube.com/watch?v=CnS2GpaWuS4;Doctor Myro
Inserting a nasal airway while AWAKE #doctor reacts;https://www.youtube.com/watch?v=pKYa-ymzc4Y;Doctor Myro
Patient Wakes up from ANESTHESIA #doctor #anesthesiologist #shorts;https://www.youtube.com/watch?v=MgKjhSdYd6E;Doctor Myro
Why PIGS are the solution to kidney problems;https://www.youtube.com/watch?v=q2d37ej1JGY;Doctor Myro
Did brain surgery make him a genius?;https://www.youtube.com/watch?v=MGSMGp5Aksw;Doctor Myro
How to SAFELY remove a fish hook;https://www.youtube.com/watch?v=5IOap5UeYs0;Doctor Myro
Doctor Reacts: tapeworm burger?!;https://www.youtube.com/watch?v=JosG8JHv4UE;Doctor Myro
Lives are lost every day, we can't wait for the politics.... #doctor #shorts;https://www.youtube.com/watch?v=GJantTe-1wU;Doctor Myro
How many calories are in your body?;https://www.youtube.com/watch?v=dhRTxBvMZpo;Doctor Myro
Tattoo with fire lava?!! #doctor #shorts;https://www.youtube.com/watch?v=qxWdfJFzXcg;Doctor Myro
Why you should NEVER do this!;https://www.youtube.com/watch?v=u4lUbSb1k1s;Doctor Myro
Infections you can get from a kiss ??;https://www.youtube.com/watch?v=9icB8-U_ROg;Doctor Myro
Doctor Reacts: extreme arm condition;https://www.youtube.com/watch?v=1o-rDY0h360;Doctor Myro
ASMR comes with DIABETES #doctor #shorts;https://www.youtube.com/watch?v=_FdwDh7qwmY;Doctor Myro
Doctor Explains: low calorie rice hack!;https://www.youtube.com/watch?v=DLmA1XLRV60;Doctor Myro
Anesthesia for a Brain Dead Patient? #Anesthesiologist Explains;https://www.youtube.com/watch?v=e3-GHfz1hBM;Doctor Myro
Can you do THIS with your eyes?;https://www.youtube.com/watch?v=LHkKn21KnR4;Doctor Myro
Are IUDs effective?;https://www.youtube.com/watch?v=A8DnN-AWmo4;Doctor Myro
Dislocated PATELLA - Doctor Reacts #doctor #shorts;https://www.youtube.com/watch?v=hC9WlwHmBKI;Doctor Myro
Dislocated PATELLA - Doctor Reacts #doctor #shorts;https://www.youtube.com/watch?v=hC9WlwHmBKI;Doctor Myro
What happens when you hold in a fart too long;https://www.youtube.com/watch?v=JS5JRvLTFSY;Doctor Myro
Toxic waste tattoo glows #doctor;https://www.youtube.com/watch?v=OznHn2i8K-Q;Doctor Myro
THIS is what happens in a Pap smear;https://www.youtube.com/watch?v=y6B6RSUwenE;Doctor Myro
Doctor Reacts: intubation through the nose?;https://www.youtube.com/watch?v=0D7RS9fWi0Q;Doctor Myro
Not a gamer until youve played this? ??;https://www.youtube.com/watch?v=G0s6k-FGBHk;Doctor Myro
As an anesthesiologist, Id NEVER do this;https://www.youtube.com/watch?v=C9xyDFaXZlg;Doctor Myro
Doctor Reacts: robotic legs;https://www.youtube.com/watch?v=WE5nBPSKhvs;Doctor Myro
Anesthesiologists vs surgeons (with @FootDocDana);https://www.youtube.com/watch?v=DDCT3xdxO-E;Doctor Myro
Doctor Reacts: broken paw?;https://www.youtube.com/watch?v=qogWKPzrhvA;Doctor Myro
Can ?? make you blind?!;https://www.youtube.com/watch?v=cwoXfntoLms;Doctor Myro
"THIS ""food"" didn't make the food pyramid, did it? - Doctor Reacts #shorts";https://www.youtube.com/watch?v=8KX38saySlI;Doctor Myro
Can you do this eye trick?!;https://www.youtube.com/watch?v=YmvF5w7VrWg;Doctor Myro
Have you heard this sleep life hack?;https://www.youtube.com/watch?v=5swa7wbUT44;Doctor Myro
Plastic surgeons recommend HealFast for scars of all types, here is why!;https://www.youtube.com/watch?v=FJLwqUj4OYc;Doctor Myro
Why laughing made her FAINT!;https://www.youtube.com/watch?v=EbxdNFVBi1s;Doctor Myro
Anesthesiologist placing a breathing tube for surgery;https://www.youtube.com/watch?v=-b8bUrm0kFA;Doctor Myro
Doctor Reacts: strange mole removal;https://www.youtube.com/watch?v=B6WGoFJzXeM;Doctor Myro
Anesthesia gave him RIZZ ??;https://www.youtube.com/watch?v=oCiZwBSjh70;Doctor Myro
Doctor Reacts: whats in his hand?!;https://www.youtube.com/watch?v=wzUw9ivBSRU;Doctor Myro
Paramedics in 2024 be like;https://www.youtube.com/watch?v=aDdayv7g6xo;Doctor Myro
How fake diploma nurses perform ?? - with @NurseBlake #doctor;https://www.youtube.com/watch?v=x_dRsFSrBnU;Doctor Myro
This surgery can make you taller!;https://www.youtube.com/watch?v=aCQq--L8PXE;Doctor Myro
Doctor Reacts: worlds most expensive medicine;https://www.youtube.com/watch?v=_SJOTOUck0g;Doctor Myro
Why did they drill his head?!;https://www.youtube.com/watch?v=cbec4zfzdtQ;Doctor Myro
Doctor Reacts: $75,000 treadmill?!;https://www.youtube.com/watch?v=cjdKe1QG2D0;Doctor Myro
An uncomfortable demonstration;https://www.youtube.com/watch?v=04YJ_aSdeqk;Doctor Myro
POV: when the case gets cancelled;https://www.youtube.com/watch?v=5vo8reN5C0Q;Doctor Myro
Why you NEED to take your earrings out;https://www.youtube.com/watch?v=BEXSEsYStrQ;Doctor Myro
Doctor explains: how to stop choking;https://www.youtube.com/watch?v=0IbWKasYa_w;Doctor Myro
Bodybuilder is playing playing with Fire - Doctor Reacts #shorts;https://www.youtube.com/watch?v=zhNeJV9v2lo;Doctor Myro
Doctor Reacts: a satisfying procedure;https://www.youtube.com/watch?v=pOIaL9KeNZA;Doctor Myro
Why anesthesia makes you numb;https://www.youtube.com/watch?v=rmEg8gOfl5c;Doctor Myro
Doctor Reacts: extreme nasal rinse;https://www.youtube.com/watch?v=KxYglMGgbvU;Doctor Myro
How to fix a dislocated knee!;https://www.youtube.com/watch?v=3-k3v66em2Q;Doctor Myro
Real-Life Infinite Fanta Glitch - Esophagostomy - Doctor Explains #doctor #shorts;https://www.youtube.com/watch?v=0Fkb6tIT5QY;Doctor Myro
Doctor Reacts to Lungs being inflated #doctors #shorts;https://www.youtube.com/watch?v=xRRvAv2pZPI;Doctor Myro
POV: When the Surgeon is pretty?????@FootDocDana #doctors #shorts;https://www.youtube.com/watch?v=vIXsfXx4cMM;Doctor Myro
What to do if you dislocate your knee;https://www.youtube.com/watch?v=NNA4e34ISOs;Doctor Myro
Please dont do this!!!;https://www.youtube.com/watch?v=52HqE5E0dWw;Doctor Myro
This nurse did NOT understand the assignment;https://www.youtube.com/watch?v=cEp074pGuDY;Doctor Myro
"Problem with ""Cutting My Alcohol"" - Doctor Reacts #shorts";https://www.youtube.com/watch?v=V1wB8ZBK6Ec;Doctor Myro
What REALLY happens in a CT scan;https://www.youtube.com/watch?v=WlRHATTLREQ;Doctor Myro
What a twitching eye REALLY means;https://www.youtube.com/watch?v=EAWLGGLp6sE;Doctor Myro
Why this kid LOVES surgery!;https://www.youtube.com/watch?v=Ef1XNoIJChI;Doctor Myro
Doctor Reacts: INSANE tattoo;https://www.youtube.com/watch?v=PUw_HjV8rC8;Doctor Myro
Whats in his nose?!;https://www.youtube.com/watch?v=m8RVqGX8ZGk;Doctor Myro
Why insurance is breaking healthcare;https://www.youtube.com/watch?v=XZTeq753xGg;Doctor Myro
