Title;Link;Creator
Vote To Demonize Sugar #shorts;https://www.youtube.com/watch?v=MlXFO4eWTHA;Living Well Dr. Michelle Jorgensen
Why Root Canals Fail. #shorts;https://www.youtube.com/watch?v=V5itp9BSIgs;Living Well Dr. Michelle Jorgensen
What is a cavitation and what do I do about it? #shorts;https://www.youtube.com/watch?v=Wt_ZFkfC9gs;Living Well Dr. Michelle Jorgensen
A CPAP makes you a lazy breather - your apnea could get worse #shorts;https://www.youtube.com/watch?v=BGEemrIMHEw;Living Well Dr. Michelle Jorgensen
A healthy breakfast is NOT this. #shorts;https://www.youtube.com/watch?v=5pauHtlOjKs;Living Well Dr. Michelle Jorgensen
Root Canals: A Possible Cause of Breast Cancer #shorts;https://www.youtube.com/watch?v=DL4mxrXNldU;Living Well Dr. Michelle Jorgensen
Why Dental Implants Fail #shorts;https://www.youtube.com/watch?v=GqD5MUhXE0I;Living Well Dr. Michelle Jorgensen
Have you heard of Switchel? #shorts;https://www.youtube.com/watch?v=8rMhgLpN5KQ;Living Well Dr. Michelle Jorgensen
It's time to see if you have hidden dental infections. #shorts;https://www.youtube.com/watch?v=iigaZl6t2nM;Living Well Dr. Michelle Jorgensen
Is there such thing as natural cosmetic dentistry? #shorts;https://www.youtube.com/watch?v=H50hBN9FWgc;Living Well Dr. Michelle Jorgensen
Were your dental symptoms resolved after surgery? #shorts;https://www.youtube.com/watch?v=6GYulBX_aqU;Living Well Dr. Michelle Jorgensen
A New Treatment For Sleep Apnea #shorts;https://www.youtube.com/watch?v=HQ2BgVQEI_c;Living Well Dr. Michelle Jorgensen
The food you eat will change your life expectancy #shorts;https://www.youtube.com/watch?v=5uMc4t2Atfk;Living Well Dr. Michelle Jorgensen
One of the saddest patients I've seen. #shorts;https://www.youtube.com/watch?v=67bUd4nPylo;Living Well Dr. Michelle Jorgensen
His ringing in the ears wasn't going away. #shorts;https://www.youtube.com/watch?v=rM2XweMsJUs;Living Well Dr. Michelle Jorgensen
A concerning CT scan for a young pilot. #shorts;https://www.youtube.com/watch?v=kCQg6Cbdz9U;Living Well Dr. Michelle Jorgensen
Do you see the infection? #shorts;https://www.youtube.com/watch?v=TdEgTk2Afqg;Living Well Dr. Michelle Jorgensen
What is a veneer? #shorts;https://www.youtube.com/watch?v=AkV27aJ1Kso;Living Well Dr. Michelle Jorgensen
Hate the CPAP machine? #shorts;https://www.youtube.com/watch?v=lD_paoHL8xw;Living Well Dr. Michelle Jorgensen
"""my gums started to look pink again!"" #shorts";https://www.youtube.com/watch?v=-4n-KScoqXw;Living Well Dr. Michelle Jorgensen
What are tonsil stones and how do you get rid of them? #shorts;https://www.youtube.com/watch?v=DmpRXkak3rk;Living Well Dr. Michelle Jorgensen
Children's high fevers can lead to teeth developmental issues #shorts;https://www.youtube.com/watch?v=Sdyx_Q0vgdQ;Living Well Dr. Michelle Jorgensen
Find Answers to Chronic Health Problems in Your Mouth!;https://www.youtube.com/watch?v=ChoWN-t0m_4;Living Well Dr. Michelle Jorgensen
Celiac Disease & Teeth #shorts;https://www.youtube.com/watch?v=YVFR83jb-FI;Living Well Dr. Michelle Jorgensen
This is an abscess #shorts;https://www.youtube.com/watch?v=j36aO2JyS84;Living Well Dr. Michelle Jorgensen
Sinus Infection? #shorts;https://www.youtube.com/watch?v=k7KwXcS5sKY;Living Well Dr. Michelle Jorgensen
Constant Fatigue: A Root Canal Connection? #shorts;https://www.youtube.com/watch?v=V5dA8JxtyRo;Living Well Dr. Michelle Jorgensen
Do you have bumps under your tongue? It's a sign...#shorts;https://www.youtube.com/watch?v=idNiGnJ1qP0;Living Well Dr. Michelle Jorgensen
One abscess was so large it was eating a hole in his jaw. #shorts;https://www.youtube.com/watch?v=0i9oWcx76v8;Living Well Dr. Michelle Jorgensen
The tried to fix his root canal 3 times #shorts;https://www.youtube.com/watch?v=qT5PmY5G0rM;Living Well Dr. Michelle Jorgensen
Can you heal teeth? #shorts;https://www.youtube.com/watch?v=FDzrCAiCH9c;Living Well Dr. Michelle Jorgensen
The dangers of having a dry mouth #shorts;https://www.youtube.com/watch?v=fJFyCFUPleg;Living Well Dr. Michelle Jorgensen
Not a fan of mouth guards. Here's why! #shorts;https://www.youtube.com/watch?v=C6mofjO9dWw;Living Well Dr. Michelle Jorgensen
Why are we using fluoride? #shorts;https://www.youtube.com/watch?v=Dv-bV_Bv7bk;Living Well Dr. Michelle Jorgensen
How to heal red and swollen gums #shorts;https://www.youtube.com/watch?v=Xq6bRVaCQkg;Living Well Dr. Michelle Jorgensen
Don't use a mouthwash. Here's why. #shorts;https://www.youtube.com/watch?v=3Iz1Tn6s3-U;Living Well Dr. Michelle Jorgensen
Could this be the reason your teeth are yellow? #shorts;https://www.youtube.com/watch?v=bMloxhCr4Iw;Living Well Dr. Michelle Jorgensen
Dental infection & covid #shorts;https://www.youtube.com/watch?v=xMyMjTg2EKg;Living Well Dr. Michelle Jorgensen
New Way To Treat Sleep Apnea, Without A CPAP #shorts;https://www.youtube.com/watch?v=H5y03tNJddI;Living Well Dr. Michelle Jorgensen
Braces vs. Veneers #shorts;https://www.youtube.com/watch?v=NAObkqKbiZU;Living Well Dr. Michelle Jorgensen
Sleep study shows airway issues could cause cracked teeth #shorts;https://www.youtube.com/watch?v=rozqUbgB824;Living Well Dr. Michelle Jorgensen
This is not a weightloss scam. This is dental health. #shorts;https://www.youtube.com/watch?v=4bST-LNbP5o;Living Well Dr. Michelle Jorgensen
Sealants: Are They Really Protecting Your Teeth? #shorts;https://www.youtube.com/watch?v=7L6yTDpik_M;Living Well Dr. Michelle Jorgensen
When your dentist says you need an implant... #shorts;https://www.youtube.com/watch?v=plP7SaEZTTk;Living Well Dr. Michelle Jorgensen
How dry mouth can destroy your teeth #shorts;https://www.youtube.com/watch?v=k5Fuf_P7q6A;Living Well Dr. Michelle Jorgensen
Jaw got worse after braces? #shorts;https://www.youtube.com/watch?v=j1-YNjdW9gs;Living Well Dr. Michelle Jorgensen
This is what your medication is doing to your teeth #shorts;https://www.youtube.com/watch?v=-FHeft5fLQg;Living Well Dr. Michelle Jorgensen
Dental infection & anxiety. There's a connection! #shorts;https://www.youtube.com/watch?v=pcbY67VXBDs;Living Well Dr. Michelle Jorgensen
"""You brush too hard""... is a Lie. #shorts";https://www.youtube.com/watch?v=WB3edJ8cBaQ;Living Well Dr. Michelle Jorgensen
My Biggest Pet Peeve #shorts;https://www.youtube.com/watch?v=PSuyP7145sM;Living Well Dr. Michelle Jorgensen
12 year old biking accident led to bone being eaten away. #shorts;https://www.youtube.com/watch?v=uwPeiABXO70;Living Well Dr. Michelle Jorgensen
The astonishing connection between anxiety & dental infection #shorts;https://www.youtube.com/watch?v=XvCP2zSuYx0;Living Well Dr. Michelle Jorgensen
A Rare Tour #shorts;https://www.youtube.com/watch?v=fctvVEfLTTM;Living Well Dr. Michelle Jorgensen
Behind the Scenes of My Holistic Dental Office: A Rare Tour Inside Total Care Dental;https://www.youtube.com/watch?v=LtAZn8lfxag;Living Well Dr. Michelle Jorgensen
Root Cause For Cracked Teeth #shorts;https://www.youtube.com/watch?v=ZVY3WciHlA4;Living Well Dr. Michelle Jorgensen
The connection between braces and jaw problems #shorts;https://www.youtube.com/watch?v=L-4qNEUVasY;Living Well Dr. Michelle Jorgensen
On a detox or diet? Don't harm your teeth. #shorts;https://www.youtube.com/watch?v=xeOjEFcbyxk;Living Well Dr. Michelle Jorgensen
Wisdom Teeth: How your diet affects the size of your mouth #shorts;https://www.youtube.com/watch?v=yJoG54d2fKc;Living Well Dr. Michelle Jorgensen
Another massive abscess found...the ENT had no idea. #shorts;https://www.youtube.com/watch?v=gvIw2lYNkaE;Living Well Dr. Michelle Jorgensen
Ozone: A Holistic Dentist Favorite #shorts;https://www.youtube.com/watch?v=6klzBFVC9Dc;Living Well Dr. Michelle Jorgensen
Help Your Child Breathe & Sleep Better #shorts;https://www.youtube.com/watch?v=CobE7eVxav4;Living Well Dr. Michelle Jorgensen
Kids bedwetting? Try this! #shorts;https://www.youtube.com/watch?v=QGbeH2-t96g;Living Well Dr. Michelle Jorgensen
5 Cooking Tips For Beginners;https://www.youtube.com/watch?v=nVx7qivhgYI;Living Well Dr. Michelle Jorgensen
The tooth abscess was leaking into her nose #shorts;https://www.youtube.com/watch?v=hJl85yeUnyU;Living Well Dr. Michelle Jorgensen
Baking Soda Test: Find Out Why You're Getting Cavities #shorts;https://www.youtube.com/watch?v=07-_TfOgiL4;Living Well Dr. Michelle Jorgensen
Look what we found in her wisdom teeth area! #shorts;https://www.youtube.com/watch?v=LVMG3jhTRxo;Living Well Dr. Michelle Jorgensen
My Story #shorts;https://www.youtube.com/watch?v=6cU3QV2kNOM;Living Well Dr. Michelle Jorgensen
Are Metal Braces Safe? #shorts;https://www.youtube.com/watch?v=loVa9bB67-c;Living Well Dr. Michelle Jorgensen
Easy Tricks To Cooking Healthy On A Small Budget;https://www.youtube.com/watch?v=BAqkwJrjQs0;Living Well Dr. Michelle Jorgensen
ADHD, not sleeping, dementia..find out if it's an airway issue #shorts;https://www.youtube.com/watch?v=McIMZWDyIdk;Living Well Dr. Michelle Jorgensen
If you don't find a good dentist...this could happen. #shorts;https://www.youtube.com/watch?v=_iO26w65TrI;Living Well Dr. Michelle Jorgensen
One Root Cause Of ADHD #shorts;https://www.youtube.com/watch?v=5kBKW7v5o_Q;Living Well Dr. Michelle Jorgensen
Bleeding Gums Solution #shorts;https://www.youtube.com/watch?v=zZIXBgOkb4I;Living Well Dr. Michelle Jorgensen
Are Dental Spacers Safe? #shorts;https://www.youtube.com/watch?v=AL2S14gqbPM;Living Well Dr. Michelle Jorgensen
What Is A Palate Expander? #shorts;https://www.youtube.com/watch?v=mQ7LBJT03Vg;Living Well Dr. Michelle Jorgensen
Solution To A Mouth Of Failing Teeth #shorts;https://www.youtube.com/watch?v=m0LFNhDiB84;Living Well Dr. Michelle Jorgensen
Lessons Learned At Culinary Boot Camp #shorts;https://www.youtube.com/watch?v=qIAaGFE_utk;Living Well Dr. Michelle Jorgensen
Let's Talk About Antibiotics: A Holistic Perspective #shorts;https://www.youtube.com/watch?v=6F-G7zpfGrY;Living Well Dr. Michelle Jorgensen
Are Dental Crowns Safe For Kids & Adults? #shorts;https://www.youtube.com/watch?v=N0vIk8f1Tgo;Living Well Dr. Michelle Jorgensen
Lessons Learned at Culinary Bootcamp!;https://www.youtube.com/watch?v=g_uxBfCvHj0;Living Well Dr. Michelle Jorgensen
Major Sleep Issues Cause By Poor Dental Health! #shorts;https://www.youtube.com/watch?v=aahI6tGihAg;Living Well Dr. Michelle Jorgensen
Nutrition Solution For Tooth Decay: Eat These Foods! #shorts;https://www.youtube.com/watch?v=5_xzabImZCI;Living Well Dr. Michelle Jorgensen
The Dangers Of Mouth Breathing & What To Do About It #shorts;https://www.youtube.com/watch?v=Q83DPHKYQa4;Living Well Dr. Michelle Jorgensen
Sinus Broken Through. Not Shown On Regular X Ray #shorts;https://www.youtube.com/watch?v=fmNtV-muefM;Living Well Dr. Michelle Jorgensen
How To Tell What Type Of Filling You Have #shorts;https://www.youtube.com/watch?v=DrMVEW4Xk6k;Living Well Dr. Michelle Jorgensen
The Danger Of Mercury Filling Removal #shorts;https://www.youtube.com/watch?v=Co6sg7H8ox4;Living Well Dr. Michelle Jorgensen
He Had No Symptoms But Here's What We Found #shorts;https://www.youtube.com/watch?v=hQUPWissRJ0;Living Well Dr. Michelle Jorgensen
How to Brush Your Teeth and Clean Your Mouth - a Holistic Dentist's Guide;https://www.youtube.com/watch?v=oXAIn4DZxp8;Living Well Dr. Michelle Jorgensen
Prostate Issues Could Come From Dental Health #shorts;https://www.youtube.com/watch?v=1se81pf_0eU;Living Well Dr. Michelle Jorgensen
Gallbladder Removal? Make Sure You're Taking This! #shorts;https://www.youtube.com/watch?v=cr8JByUYx60;Living Well Dr. Michelle Jorgensen
Why You May Wake Up A Lot To Go To The Bathroom #shorts;https://www.youtube.com/watch?v=iCVs2U_Ohtg;Living Well Dr. Michelle Jorgensen
Pregnancy & Breastfeeding Effect On Teeth Health #shorts;https://www.youtube.com/watch?v=mdyZgIxc-QM;Living Well Dr. Michelle Jorgensen
Prevent Oxalates & Tooth Decay With This Ingredient! #shorts;https://www.youtube.com/watch?v=Eb4Cwo4geBE;Living Well Dr. Michelle Jorgensen
The Astounding Connection Between Dental Health & Lyme Disease #shorts;https://www.youtube.com/watch?v=eL-UVVEp320;Living Well Dr. Michelle Jorgensen
Cause Of Sensitive Teeth #shorts;https://www.youtube.com/watch?v=qwhanGR9wng;Living Well Dr. Michelle Jorgensen
Heritage Gardens Is Changing Lives #shorts;https://www.youtube.com/watch?v=b4SZvLM6hhg;Living Well Dr. Michelle Jorgensen
Sweat, Sunflowers, and Success: The Transformative Journey of Heritage Gardens;https://www.youtube.com/watch?v=RKpZp5BaZNw;Living Well Dr. Michelle Jorgensen
Tooth Removal Gone Wrong! #shorts;https://www.youtube.com/watch?v=7BzpbE4k5F0;Living Well Dr. Michelle Jorgensen
Do You Wake Up With Headaches? #shorts;https://www.youtube.com/watch?v=B9153tFK3M0;Living Well Dr. Michelle Jorgensen
Is Acne Related To Dental Infection? #shorts;https://www.youtube.com/watch?v=LIfqzxmFXY8;Living Well Dr. Michelle Jorgensen
MTHFR Genetic Variant? Tongue Tie? #shorts;https://www.youtube.com/watch?v=CNLYUJWvXxY;Living Well Dr. Michelle Jorgensen
Cone Beam CT Scan Offers Relief & Clarity #shorts;https://www.youtube.com/watch?v=dZr-ZykLwJA;Living Well Dr. Michelle Jorgensen
Watch This To See If You're Low On Oxygen #shorts;https://www.youtube.com/watch?v=4c2XTt7YlPQ;Living Well Dr. Michelle Jorgensen
Do This To Find Out WHY You Have Cavities #shorts;https://www.youtube.com/watch?v=9GQ70hybcv8;Living Well Dr. Michelle Jorgensen
Dental Infections Could Cause Depression, Fatigue & Anxiety... #shorts;https://www.youtube.com/watch?v=3wguyEBoc1o;Living Well Dr. Michelle Jorgensen
Hearing Aids Because Of Dental Infection?! #shorts;https://www.youtube.com/watch?v=LDaFRY-l5SU;Living Well Dr. Michelle Jorgensen
Your Dentist May Be Missing The Big Picture. Here's Why! #shorts;https://www.youtube.com/watch?v=Rz-ts5QqDP4;Living Well Dr. Michelle Jorgensen
Dental Infection May Lead To Infertility, Thyroid Issues &More #shorts;https://www.youtube.com/watch?v=T8zVWnWuExY;Living Well Dr. Michelle Jorgensen
Canker Sore Solutions #shorts;https://www.youtube.com/watch?v=ParHd9FkrLw;Living Well Dr. Michelle Jorgensen
Dental Sealants Can Be Toxic. Make Sure You Get This Kind. #shorts;https://www.youtube.com/watch?v=Q0Jt3OqzaYQ;Living Well Dr. Michelle Jorgensen
Feeling Dizzy or Lightheaded When You Stand Up? Watch This! #shorts;https://www.youtube.com/watch?v=XfQEuh2P0qQ;Living Well Dr. Michelle Jorgensen
The Only Dental Filling Material You Should Get #shorts;https://www.youtube.com/watch?v=hp9zcaQ00JE;Living Well Dr. Michelle Jorgensen
This Is Why You're Getting Cavities #shorts;https://www.youtube.com/watch?v=K0MvlhhrgOc;Living Well Dr. Michelle Jorgensen
Need More Energy? Watch This! #shorts;https://www.youtube.com/watch?v=NumhzUkDbbA;Living Well Dr. Michelle Jorgensen
You May Have An Infected Root Canal! #shorts;https://www.youtube.com/watch?v=JooQ0k98HVI;Living Well Dr. Michelle Jorgensen
Tillamook Cheese Factory & Lactase #shorts;https://www.youtube.com/watch?v=QfmOc_WA728;Living Well Dr. Michelle Jorgensen
You May Not Need To Get Your Wisdom Teeth Out #shorts;https://www.youtube.com/watch?v=pF547PrjSQ8;Living Well Dr. Michelle Jorgensen
The Controversy Between Raw & Pasteurized Milk! #shorts;https://www.youtube.com/watch?v=nUSZL7jMStw;Living Well Dr. Michelle Jorgensen
This Dental Work Can Cause Other Health Issues... #shorts;https://www.youtube.com/watch?v=Q-WlEtChEt0;Living Well Dr. Michelle Jorgensen
Wait...You Don't Need Mouthwash?!? #shorts;https://www.youtube.com/watch?v=MgenPbkk9fk;Living Well Dr. Michelle Jorgensen
She told me my book wouldn't sell: I have a better idea #shorts;https://www.youtube.com/watch?v=0Y1dvhL5b38;Living Well Dr. Michelle Jorgensen
She Told Me My Book Wouldn't Sell: I Came Up With A Better Idea...;https://www.youtube.com/watch?v=AyRdzw2g2lE;Living Well Dr. Michelle Jorgensen
External Resorption? What Is It & Treatment! #shorts;https://www.youtube.com/watch?v=Xr1TWFPaWTQ;Living Well Dr. Michelle Jorgensen
Bad News For Those With Gum Disease #shorts;https://www.youtube.com/watch?v=1tgUNq5g7EU;Living Well Dr. Michelle Jorgensen
Treating Gum Disease #shorts;https://www.youtube.com/watch?v=7_Ki5ubhOMw;Living Well Dr. Michelle Jorgensen
How To Treat Gum Disease #shorts;https://www.youtube.com/watch?v=a23-JbKFRfY;Living Well Dr. Michelle Jorgensen
What REALLY Causes Gum Disease? #shorts;https://www.youtube.com/watch?v=bVUmiMgUzI4;Living Well Dr. Michelle Jorgensen
Nutrition On The Go: My Choir Tour Adventures #shorts;https://www.youtube.com/watch?v=gzhP9JtwtiY;Living Well Dr. Michelle Jorgensen
From Bus Emergencies to Healthy Travel Hacks: My Journey on Choir Tour;https://www.youtube.com/watch?v=TerNvbRayaE;Living Well Dr. Michelle Jorgensen
How Do You Diagnose Periodontal Disease? #shorts;https://www.youtube.com/watch?v=qE5O5c5I1v8;Living Well Dr. Michelle Jorgensen
Gum & Periodontal Disease? Watch This! #shorts;https://www.youtube.com/watch?v=S1YSjzpanWM;Living Well Dr. Michelle Jorgensen
HUGE Abscess found on woman's CT scan. #shorts;https://www.youtube.com/watch?v=SsCd829YJ2w;Living Well Dr. Michelle Jorgensen
I Got Sick! | Natural Remedies I Used To Get Better #shorts;https://www.youtube.com/watch?v=xO7AKp50kHg;Living Well Dr. Michelle Jorgensen
I GOT SICK! | Here's The Natural Remedies I Took to Get Better!;https://www.youtube.com/watch?v=XrjoI-d9884;Living Well Dr. Michelle Jorgensen
Root Cause For Kids Teeth Grinding #shorts;https://www.youtube.com/watch?v=YW3lcwCEOmE;Living Well Dr. Michelle Jorgensen
What Parents Need To Know About Dental Sealants #shorts;https://www.youtube.com/watch?v=m7e5-pJ67MU;Living Well Dr. Michelle Jorgensen
How To Heal Cavities #shorts;https://www.youtube.com/watch?v=eKgnt5H-xO4;Living Well Dr. Michelle Jorgensen
The Only Time You Should Have A Root Canal #shorts;https://www.youtube.com/watch?v=jgyxrSt-XYw;Living Well Dr. Michelle Jorgensen
What Parents Need To Know About Spacers #shorts;https://www.youtube.com/watch?v=lvRzWayyxZs;Living Well Dr. Michelle Jorgensen
19 Vials of Blood & My Son's Struggle: A Journey Of Diagnoses #shorts;https://www.youtube.com/watch?v=q8fw-u5Cqik;Living Well Dr. Michelle Jorgensen
19 Vials of Blood & My Son's Struggle: A Journey of Diagnoses & Answers:;https://www.youtube.com/watch?v=WhQFYsPdbxI;Living Well Dr. Michelle Jorgensen
3 Reasons To Not Get A Dental Bridge #shorts;https://www.youtube.com/watch?v=oYOo4ogyZ7k;Living Well Dr. Michelle Jorgensen
Treat Parasites With These 3 Plants #shorts;https://www.youtube.com/watch?v=e2bs4ee6NtU;Living Well Dr. Michelle Jorgensen
Watch This BEFORE You Get A Dental Crown #shorts;https://www.youtube.com/watch?v=46DGWxluhgc;Living Well Dr. Michelle Jorgensen
Don't Do This If You've Had A Tooth Removed #shorts;https://www.youtube.com/watch?v=UKMPnS613-I;Living Well Dr. Michelle Jorgensen
Natural Pain Relief After Wisdom Teeth Removal #shorts;https://www.youtube.com/watch?v=6LulS93HAUM;Living Well Dr. Michelle Jorgensen
My Morning Routine For Optimal Health #shorts;https://www.youtube.com/watch?v=TIjWKAtyQhk;Living Well Dr. Michelle Jorgensen
Solution For Sensitive Teeth #shorts;https://www.youtube.com/watch?v=chQNWqfobKo;Living Well Dr. Michelle Jorgensen
Healing Wisdom Teeth The Natural Way #shorts;https://www.youtube.com/watch?v=f8vi-u8mL58;Living Well Dr. Michelle Jorgensen
My Natural Journey to Beat Endometriosis & Boost Metabolism #shorts;https://www.youtube.com/watch?v=FRACGvQCBUQ;Living Well Dr. Michelle Jorgensen
Getting A Tooth Removed? Watch This! #shorts;https://www.youtube.com/watch?v=14aKyVLKTBI;Living Well Dr. Michelle Jorgensen
How To Choose The Right Dentist #shorts;https://www.youtube.com/watch?v=36VhiHsJn2o;Living Well Dr. Michelle Jorgensen
Antibiotics Don't Help An Infected Root Canal #shorts;https://www.youtube.com/watch?v=SN0SODoxRI4;Living Well Dr. Michelle Jorgensen
Failed Root Canals Don't Hurt! #shorts;https://www.youtube.com/watch?v=QMJV8Ygohws;Living Well Dr. Michelle Jorgensen
Unlocking Hormonal Balance: My Natural Journey to Beat Endometriosis & Boost Metabolism;https://www.youtube.com/watch?v=80xS8i1jvAc;Living Well Dr. Michelle Jorgensen
Another Deadly Disease Caused By Mouth Infections #shorts;https://www.youtube.com/watch?v=FKSJOvLHPKE;Living Well Dr. Michelle Jorgensen
Is A Dental Crown Safe? #shorts;https://www.youtube.com/watch?v=gKnuPNBPcU0;Living Well Dr. Michelle Jorgensen
The REAL Reason Why There Are So Many Teeth Problems! #shorts;https://www.youtube.com/watch?v=hMUJncOGciM;Living Well Dr. Michelle Jorgensen
A Shocking Visit To The Emergency Room: What I Learned About Hormones;https://www.youtube.com/watch?v=JVMaA53LVHI;Living Well Dr. Michelle Jorgensen
Simple tip for balancing hormones. #shorts;https://www.youtube.com/watch?v=KI2NXisIvNw;Living Well Dr. Michelle Jorgensen
Cracked Tooth? Here's What You Do... #shorts;https://www.youtube.com/watch?v=9I9R09JOBmI;Living Well Dr. Michelle Jorgensen
10,000+ Microgreens | A Behind-the-Scenes Look at My Brand New Business!;https://www.youtube.com/watch?v=5SZCBPbjVVs;Living Well Dr. Michelle Jorgensen
A Day in the Life of a Holistic Dentist;https://www.youtube.com/watch?v=GIeEXcL8WeA;Living Well Dr. Michelle Jorgensen
Compost Tips | How to Make Homemade Fertilizer;https://www.youtube.com/watch?v=53fbAjUtK0c;Living Well Dr. Michelle Jorgensen
Watering Tips for Spring Gardening & How to Space Your Plants;https://www.youtube.com/watch?v=ZXm_04AFkh0;Living Well Dr. Michelle Jorgensen
Spring Gardening | What Vegetables to Plant in the Spring?;https://www.youtube.com/watch?v=qUciyyMoj-0;Living Well Dr. Michelle Jorgensen
The Baking Soda Test for Low Stomach Acid;https://www.youtube.com/watch?v=jnUNJVCe6J8;Living Well Dr. Michelle Jorgensen
How to Use Hydroxyapatite Tooth Powder;https://www.youtube.com/watch?v=rXmXwOJ1fh4;Living Well Dr. Michelle Jorgensen
Are Amalgam Fillings (Mercury Fillings) SAFE?;https://www.youtube.com/watch?v=Dvy77zJz_TY;Living Well Dr. Michelle Jorgensen
Is Fluoride Bad For You? Is it REALLY good for your teeth?;https://www.youtube.com/watch?v=g5lx5mtMcM0;Living Well Dr. Michelle Jorgensen
How To Reverse Tooth Decay Naturally;https://www.youtube.com/watch?v=vkxkOtVZhh4;Living Well Dr. Michelle Jorgensen
Be Prepared Conference 2021 | Preparedness Overview - Dr. Michelle Jorgensen;https://www.youtube.com/watch?v=uMLXVnUC_Uk;Living Well Dr. Michelle Jorgensen
Be Prepared Conference 2021 | Backup Electricity - Grant Johnson;https://www.youtube.com/watch?v=dQf1n9HcIpg;Living Well Dr. Michelle Jorgensen
Be Prepared Conference 2021 | Backyard Chickens - Steve Jorgensen;https://www.youtube.com/watch?v=SM50URo3X5g;Living Well Dr. Michelle Jorgensen
Be Prepared Conference 2021 | Emergency Kits - Brooklyn Jorgensen;https://www.youtube.com/watch?v=pZ4Lq6xTCyY;Living Well Dr. Michelle Jorgensen
Be Prepared Conference 2021 | Cooking Without Electricity - Linda Mount;https://www.youtube.com/watch?v=3iqxKHlhIuE;Living Well Dr. Michelle Jorgensen
Be Prepared Conference 2021 | Medicinal Gardens - Michelle Jorgensen;https://www.youtube.com/watch?v=8bB0Ei8KTk4;Living Well Dr. Michelle Jorgensen
Be Prepared Conference 2021 | Off Grid Lighting & Communication - Scott Jackson;https://www.youtube.com/watch?v=pzHW9rHonXE;Living Well Dr. Michelle Jorgensen
Be Prepared Conference 2021 | Q&A;https://www.youtube.com/watch?v=Fy27N4SVhWg;Living Well Dr. Michelle Jorgensen
Be Prepared Conference 2021 | Rain Water Storage - Jens Jorgensen;https://www.youtube.com/watch?v=N1u8fw0pVL4;Living Well Dr. Michelle Jorgensen
Michelle Jorgensen & Marjory Wildcraft - The Health Benefits Of Elderberries;https://www.youtube.com/watch?v=t4fjsBAe5NE;Living Well Dr. Michelle Jorgensen
Michelle Jorgensen & Marjory Wildcraft - The Health Benefits Of Comfrey;https://www.youtube.com/watch?v=fI1B3K5epkY;Living Well Dr. Michelle Jorgensen
Michelle Jorgensen & Marjory Wildcraft - Emergency Get Home Car Kit;https://www.youtube.com/watch?v=oZ47bSKmfhQ;Living Well Dr. Michelle Jorgensen
Michelle Jorgensen & Marjory Wildcraft - The Health Benefits Of Sweet Annie;https://www.youtube.com/watch?v=AuoHXD6gkdw;Living Well Dr. Michelle Jorgensen
Fall & Winter Gardening - Event - Oct 9th, 2021;https://www.youtube.com/watch?v=AJ6E-Hz_lTw;Living Well Dr. Michelle Jorgensen
Be Prepared, Not Scared Conference;https://www.youtube.com/watch?v=G4hmbwApMec;Living Well Dr. Michelle Jorgensen
Hands-On Health & Harvest Class - ??????;https://www.youtube.com/watch?v=LpYvepw_f2g;Living Well Dr. Michelle Jorgensen
Event - Hands-On Health and Harvest Class;https://www.youtube.com/watch?v=ER95Lu0Eeyw;Living Well Dr. Michelle Jorgensen
Backyard Chicken - Live and Recorded Event!;https://www.youtube.com/watch?v=tEQS-ttwn5w;Living Well Dr. Michelle Jorgensen
NEW! Self-Sufficient Living Book Launch!??;https://www.youtube.com/watch?v=sVuy0T3i0PQ;Living Well Dr. Michelle Jorgensen
Chapter 12 - Creating Your Self-Sufficient Lifestyle;https://www.youtube.com/watch?v=9xZUdUbPvM0;Living Well Dr. Michelle Jorgensen
Chapter 11 - Eating Locally and Seasonally;https://www.youtube.com/watch?v=iPw8BpVzYu0;Living Well Dr. Michelle Jorgensen
Chapter 10 - Backyard Animals;https://www.youtube.com/watch?v=dmbkRAVWAmA;Living Well Dr. Michelle Jorgensen
Chapter 9 - Preserve Your Food;https://www.youtube.com/watch?v=dShGpbYJz_s;Living Well Dr. Michelle Jorgensen
Chapter 8 - Good Health at Home;https://www.youtube.com/watch?v=qBhfKatpCdA;Living Well Dr. Michelle Jorgensen
Chapter 7 - Make Your Own Medicine??;https://www.youtube.com/watch?v=urwyAaGrsfA;Living Well Dr. Michelle Jorgensen
Chapter 6 - Make Your Own Supplies;https://www.youtube.com/watch?v=rzj31iPJIUo;Living Well Dr. Michelle Jorgensen
Chapter 5 - Gardening Part Two: Gardening Anywhere, Anytime, For Anyone;https://www.youtube.com/watch?v=N-VsP1cZsq4;Living Well Dr. Michelle Jorgensen
Chapter 4 - Gardening Part One: Gardening Basics;https://www.youtube.com/watch?v=7cTy8SYd_Vo;Living Well Dr. Michelle Jorgensen
Chapter 3 - Cook Your Own Food;https://www.youtube.com/watch?v=Ausp0Gzlrtk;Living Well Dr. Michelle Jorgensen
