Title;Link;Creator
Water Masterclass: What You NEED to Know | Dr. Scott Sherr;https://www.youtube.com/watch?v=Y9tGIyplYew;Jesse Chappus
Why Dr. Scott Sherr Changed His Mind on Fasting;https://www.youtube.com/watch?v=gkfa5JsRJFg;Jesse Chappus
How to Repair Your Mitochondria if They're Old and Damaged | Dr. Chris Palmer;https://www.youtube.com/watch?v=0xGXzD2nkj0;Jesse Chappus
The REAL Superstar Neurotransmitter Is NOT Dopamine or Serotonin | Dr. Scott Sherr;https://www.youtube.com/watch?v=jqcP5w8yg3w;Jesse Chappus
Methylene Blue Masterclass: What You NEED to Know | Dr. Scott Sherr;https://www.youtube.com/watch?v=9Wx_AcDypjM;Jesse Chappus
You Will NEVER BUY Supplements on Amazon Again After WATCHING THIS! | Dr. Scott Sherr;https://www.youtube.com/watch?v=91KiTxleleo;Jesse Chappus
Busting the MYTHS About Hashimoto's and Iodine | Dr. David Brownstein;https://www.youtube.com/watch?v=Wp3mnW3wxJ4;Jesse Chappus
Iodine 101: What You NEED to Know Before You Take it | Dr. David Brownstein;https://www.youtube.com/watch?v=JglFYmcdAWY;Jesse Chappus
Mitochondria Arent Just the Powerhouses of the Cell | Dr. Chris Palmer;https://www.youtube.com/watch?v=FMs3bf0g5yI;Jesse Chappus
Stents Don't Prevent Heart Attacks | Dr. Ford Brewer;https://www.youtube.com/watch?v=aw34cEuxPeI;Jesse Chappus
#1 Absolute Best Diet to Reverse Mental Disorders | Dr. Chris Palmer;https://www.youtube.com/watch?v=IU-iK5nhKc0;Jesse Chappus
Harvard Psychiatrist REVEALS the Root Cause of Mental Illness & How to FIX IT! | Dr. Chris Palmer;https://www.youtube.com/watch?v=pzJXeGdK5ZY;Jesse Chappus
This Non-Invasive Test Finds Clogged Arteries | Dr. Ford Brewer;https://www.youtube.com/watch?v=Llb_1smESj0;Jesse Chappus
Top Muscle Health SECRETS to Avoid Blood Sugar Spikes and Increase Longevity | Dr. Ford Brewer;https://www.youtube.com/watch?v=TtvMtd8LZ8g;Jesse Chappus
Preventing Cardiovascular Disease: What Everyone Should Know | Dr. Ford Brewer;https://www.youtube.com/watch?v=w6Qh57dvb5U;Jesse Chappus
Eye Doctor: What You Need to Know about Dry Eyes | Dr. Joseph Allen;https://www.youtube.com/watch?v=krK400HkS9g;Jesse Chappus
#1 Best AT HOME Test to Predict Arterial Plaque | Dr. Ford Brewer;https://www.youtube.com/watch?v=tQqS8YjBKr0;Jesse Chappus
The ACTUAL Cause of Clogged Arteries | Dr. Ford Brewer;https://www.youtube.com/watch?v=kl03VPEG8MA;Jesse Chappus
Why Stress Tests DON'T Predict Heart Attacks | Dr. Ford Brewer;https://www.youtube.com/watch?v=tSN2YuLJeas;Jesse Chappus
The Truth About LDL Cholesterol & Clogged Arteries | Dr. Ford Brewer;https://www.youtube.com/watch?v=Pn9ueUHY_iw;Jesse Chappus
Eye Doctor Shares His Daily Eye Care Routine | Dr. Joseph Allen;https://www.youtube.com/watch?v=LOjC__01biI;Jesse Chappus
Early Signs of Dementia & an Unconventional but Effective Alzheimers Therapy (Steve Newports Story);https://www.youtube.com/watch?v=MbzjE_zMqxI;Jesse Chappus
The TOP Supplements That ACTUALLY Work! | Mike Mutzel;https://www.youtube.com/watch?v=ILjroC9P9ts;Jesse Chappus
Your Brain Is BEGGING for More of THESE... | Dr. Mary Newport;https://www.youtube.com/watch?v=_M-rXhXi7N8;Jesse Chappus
EAT THIS to Get Rid of Insulin Resistance FAST | Mike Mutzel;https://www.youtube.com/watch?v=gEG0lPpQRh0;Jesse Chappus
Eye Doctor: What You Need to Know about Cataracts | Dr. Joseph Allen;https://www.youtube.com/watch?v=yrTlCh_wcf8;Jesse Chappus
9 Powerful Ways to Increase Autophagy | Mike Mutzel;https://www.youtube.com/watch?v=j5cmgXsV8_4;Jesse Chappus
#1 Absolute Best Way to Increase Autophagy | Mike Mutzel;https://www.youtube.com/watch?v=oLMbIlSai9g;Jesse Chappus
"The ""Healthy"" Food You Need to AVOID EATING to Reduce Inflammation & Prevent Disease | Mike Mutzel";https://www.youtube.com/watch?v=0iJBM4bk85Q;Jesse Chappus
This DAILY HACK Burns Body Fat & LOWERS Glucose Spikes | Mike Mutzel;https://www.youtube.com/watch?v=nwrA5-B2r68;Jesse Chappus
Treating Mental Illness and Dementia With a Keto Diet | Dr. Bret Scher;https://www.youtube.com/watch?v=eMQHdlBIufM;Jesse Chappus
How to Tell if You Are Insulin Resistant | Dr. Bret Scher;https://www.youtube.com/watch?v=hK4yogjENWU;Jesse Chappus
3 Natural Supplements That Actually Work! (Not Sponsored);https://www.youtube.com/watch?v=7dVy-Hl8MX8;Jesse Chappus
Vegan Diets Dont Work. This Is Why... | Dr. Zoë Harcombe;https://www.youtube.com/watch?v=snhQOxjGRag;Jesse Chappus
Does Fasting Damage Your Metabolism? | Dr. Zoë Harcombe;https://www.youtube.com/watch?v=0ATvtz_JP1s;Jesse Chappus
Cardiologists TRUTH About Saturated Fat and Clogged Arteries | Dr. Bret Scher;https://www.youtube.com/watch?v=RSn8duhAv5E;Jesse Chappus
Is Dairy Good or Bad for You? | Dr. Zoë Harcombe;https://www.youtube.com/watch?v=ceApAgWM99k;Jesse Chappus
How to UNLOCK Stored Body Fat and Force Your Body to BURN IT! | Dr. Zoë Harcombe;https://www.youtube.com/watch?v=VRwzkBKrDmk;Jesse Chappus
You've Been LIED TO About Saturated Fat | Dr. Zoë Harcombe;https://www.youtube.com/watch?v=I5QwHN9zvHA;Jesse Chappus
Before You Eat Fiber - The Surprising Truth About the Microbiome | Dr. Bret Scher;https://www.youtube.com/watch?v=6CZtL_V7_Mg;Jesse Chappus
Cardiologist Explains Why LDL Cholesterol Is a POOR PREDICTOR of Clogged Arteries | Dr. Bret Scher;https://www.youtube.com/watch?v=17o3dUNybeI;Jesse Chappus
DO THIS to Reverse Insulin Resistance and TYPE 2 DIABETES | Dr. Bret Scher;https://www.youtube.com/watch?v=ejO90CQDC5U;Jesse Chappus
Youve Been LIED TO About the Mediterranean Diet & Olive Oil | Dr. Gary Fettke;https://www.youtube.com/watch?v=b2v7leOGmIQ;Jesse Chappus
Eye Doctor Explains How Diabetes Ruins Your Vision | Dr. Joseph Allen;https://www.youtube.com/watch?v=By2cmqhWE2c;Jesse Chappus
Energy for the Body Is Actually Held HERE... (Not in ATP) | Dr. Stephen Hussey;https://www.youtube.com/watch?v=vW3CrdmP4nw;Jesse Chappus
The BEST WAYS to Structure Water and PREVENT Clogged Arteries | Dr. Steven Hussey;https://www.youtube.com/watch?v=PVO5ExsTxC8;Jesse Chappus
The REAL Cause of Clogged Arteries (Its NOT a Cholesterol Problem) | Dr. Stephen Hussey;https://www.youtube.com/watch?v=_kB2rAKNkIQ;Jesse Chappus
The Heart Is NOT a Pump - So What Is It? | Dr. Stephen Hussey;https://www.youtube.com/watch?v=Lups7s44wSw;Jesse Chappus
Eye Doctor: The Truth About Floaters and When to Worry | Dr. Joseph Allen;https://www.youtube.com/watch?v=rPnZy7XKR2s;Jesse Chappus
What Happens if You Only Eat Sardines for 3 Days? | Dr. Boz;https://www.youtube.com/watch?v=Q8HShoIvXqk;Jesse Chappus
Omega-3 and Omega-6: The Dose Is the Poison! | Dr. Gary Fettke;https://www.youtube.com/watch?v=fa9RWuaIZCU;Jesse Chappus
Eye Doctor Explains How MACULAR DEGENERATION Affects Your Vision (Prevent It/Slow Progression);https://www.youtube.com/watch?v=vKalp6lAMN8;Jesse Chappus
Eye Doctor: Is Red Light Therapy Good or Bad for Your Eyes? | Dr. Joseph Allen;https://www.youtube.com/watch?v=Yas9Y6SEqGY;Jesse Chappus
Eye Doctor REVEALS How to Get Rid of Under EYE BAGS | Dr. Joseph Allen;https://www.youtube.com/watch?v=cnIbEL7_7c4;Jesse Chappus
#1 Best FUEL for Peak Brain Performance | Dr. Boz;https://www.youtube.com/watch?v=Fwsjwu4hmk4;Jesse Chappus
The Corruption of Our Nutritional Guidelines | Dr. Gary Fettke;https://www.youtube.com/watch?v=RjklsZDqFtg;Jesse Chappus
How to TEST for Insulin Resistance at Home | Dr. Boz;https://www.youtube.com/watch?v=zNl8lXod4rY;Jesse Chappus
Dr. Boz's Supplement List;https://www.youtube.com/watch?v=QJk9D-zq0BI;Jesse Chappus
Everything Youre Eating Is Toxic (Its NOT a Conspiracy) | Dr. Gary Fettke;https://www.youtube.com/watch?v=_xQssKZBJhQ;Jesse Chappus
The Bitter Truth: What Happens to Your Body When You Eat Fructose? (This INCLUDES Fruit!);https://www.youtube.com/watch?v=04s8B-w0NYA;Jesse Chappus
DO THIS First Thing in the Morning to Rewire Your Brain & LIVE LONGER (Only 3 Minutes a Day);https://www.youtube.com/watch?v=-mLxTzyofxo;Jesse Chappus
How to Start the Keto Diet Correctly | Dr. Boz;https://www.youtube.com/watch?v=vgHqUQXTWgc;Jesse Chappus
Is Long-Term Ketosis Dangerous? | Dr. Boz;https://www.youtube.com/watch?v=10NzmueSx9Y;Jesse Chappus
The ROOT CAUSE of Insulin Resistance and How to FIX IT | Dr. Boz;https://www.youtube.com/watch?v=D4ojKO0LZ9E;Jesse Chappus
Measuring Insulin Resistance: Why Dr. Boz STOPPED Testing Fasting Insulin - DO THIS Instead...;https://www.youtube.com/watch?v=MuSQnslVK0I;Jesse Chappus
If Your Heart Rate Variability Is Low, Do This... (HRV Hack) | Ben Azadi;https://www.youtube.com/watch?v=4c-VKOsZWqw;Jesse Chappus
Gut Health Expert: The Ultimate Morning Routine to Optimize Your Microbiome | Dr. Will Bulsiewicz;https://www.youtube.com/watch?v=TBWPsjZ-93I;Jesse Chappus
Why Paul Saladino NEVER Uses Toothpaste (It's NOT Just the Fluoride);https://www.youtube.com/watch?v=6bQHPWhlK1I;Jesse Chappus
EAT THIS to Feed Your Microbes and OPTIMIZE Gut Health | Dr. Will Bulsiewicz;https://www.youtube.com/watch?v=qGVJr_k4ja0;Jesse Chappus
EMFs Are No Joke! - How to Protect Yourself | Dr. Paul Saladino;https://www.youtube.com/watch?v=Pbjbtg6_Ns8;Jesse Chappus
The Fascinating Health Benefits of Raw Dairy | Dr. Paul Saladino;https://www.youtube.com/watch?v=L55qThXck3Y;Jesse Chappus
Before You Get a DENTAL FILLING, You Need to WATCH THIS! | Dr. Staci Whitman;https://www.youtube.com/watch?v=Zza8bYpFIos;Jesse Chappus
Paul Saladino Changed His Mind on Creatine (and 2 other things);https://www.youtube.com/watch?v=X14O2xFglfM;Jesse Chappus
You Might NEVER EAT Fish Again After WATCHING THIS! | Dr. Paul Saladino;https://www.youtube.com/watch?v=YO7dnlguzIk;Jesse Chappus
How to PROTECT Your Eyes From BLUE LIGHT and Flicker | Dr. Paul Saladino;https://www.youtube.com/watch?v=RiCGeTDfmcI;Jesse Chappus
Should You Get Old Mercury Fillings REMOVED? | Dr. Staci Whitman;https://www.youtube.com/watch?v=zQ9ARsi-U_s;Jesse Chappus
7 Top Biohacks to Optimize Your Body & Mind | Ben Azadi;https://www.youtube.com/watch?v=asPaWQCBajA;Jesse Chappus
Before You Eat Animal Foods! - The WORST Ones to STOP EATING | Dr. Paul Saladino;https://www.youtube.com/watch?v=YrioANUmpbI;Jesse Chappus
Paul Saladino Changed His Mind on the Carnivore Diet - Is He Now Carnivore 2.0?;https://www.youtube.com/watch?v=Dd-aYAwcu-o;Jesse Chappus
This Cheap and Easy Test Will Determine if You Have Insulin Resistance | Ben Azadi;https://www.youtube.com/watch?v=ptzWfMgLdPE;Jesse Chappus
Gut Health Expert: If Your Poo Looks Like THIS... Go to a Doctor! | Dr. Will Bulsiewicz;https://www.youtube.com/watch?v=lxz31GPpwwE;Jesse Chappus
He Tried the Carnivore Diet for 90 Days - This Will Shock You! | Ben Azadi;https://www.youtube.com/watch?v=JDU7Fu4fF7k;Jesse Chappus
What and When Dr. Will Bulsiewicz Eats to Stay Fiber Fueled;https://www.youtube.com/watch?v=W5OxIUmxIMo;Jesse Chappus
Why Ben Azadi Changed His Mind on Long-Term Ketosis (and how he eats now);https://www.youtube.com/watch?v=jC9-_jKD8B0;Jesse Chappus
What Happens in the Gut if You ONLY Eat Meat? | Dr. Will Bulsiewicz;https://www.youtube.com/watch?v=woVBqU-Vyi0;Jesse Chappus
The SURPRISING LINK Between Insulin Resistance and the MICROBIOME | Dr. Will Bulsiewicz;https://www.youtube.com/watch?v=QVhfijTNFKE;Jesse Chappus
Functional Dentist: How to Pick the Perfect Toothbrush and Floss | Dr. Staci Whitman;https://www.youtube.com/watch?v=iguOpA6ECAg;Jesse Chappus
The KEY SIGNS You Have Insulin Resistance & How to FIX IT! | Ben Azadi;https://www.youtube.com/watch?v=qG3QjMY-l2Q;Jesse Chappus
The SURPRISING CONNECTION Between Morning Light and GUT MICROBES | Dr. Will Bulsiewicz;https://www.youtube.com/watch?v=rpaDJcZVICA;Jesse Chappus
DRINK THIS Before Bed to Sleep Deep and BURN FAT (and 2 other sleep hacks) | Ben Azadi;https://www.youtube.com/watch?v=E_grZS9h2Bw;Jesse Chappus
He Improved His Microbiome by Eating NO FIBER (shocking test results) | Ben Azadi;https://www.youtube.com/watch?v=MK9gv5ANCE4;Jesse Chappus
The INSANE BENEFITS of Functional Cranial Release (FCR) | Dr. John Lieurance;https://www.youtube.com/watch?v=5Tsi9s0UtOg;Jesse Chappus
The PRIMARY Antioxidant Is Melatonin, NOT Glutathione | Dr. John Lieurance;https://www.youtube.com/watch?v=eC6h_xEM0_Q;Jesse Chappus
Magic Bullet: Fascinating Health Benefits of Methylene Blue | Dr. John Lieurance;https://www.youtube.com/watch?v=HkoAxqjmBMA;Jesse Chappus
Are Dental Cleanings Bad for You? | Dr. Staci Whitman;https://www.youtube.com/watch?v=n7ORJjryEKg;Jesse Chappus
This Could Save Your Teeth From Falling Apart | Dr. Staci Whitman;https://www.youtube.com/watch?v=Ywqef24b71E;Jesse Chappus
The Science on Salt Is Completely Being Ignored | Dr. Nina Teicholz;https://www.youtube.com/watch?v=BZTgT5-bnHA;Jesse Chappus
The #1 BEST Natural Toothpaste | Dr. Staci Whitman;https://www.youtube.com/watch?v=1s7VGCczQZM;Jesse Chappus
The Surprising Truth About Dietary Cholesterol | Dr. Nina Teicholz;https://www.youtube.com/watch?v=QxgAZ1MKpcM;Jesse Chappus
Functional Dentist REVEALS the Truth About ROOT CANALS | Dr. Staci Whitman;https://www.youtube.com/watch?v=g-4ZeqRURNQ;Jesse Chappus
How to Reverse a Cavity at Home (Complete Guide) | Dr. Staci Whitman;https://www.youtube.com/watch?v=H8vOAMqXXlk;Jesse Chappus
Functional Dentist REVEALS the Shocking Truth About FLUORIDE | Dr. Staci Whitman;https://www.youtube.com/watch?v=OPkHC6XDfSs;Jesse Chappus
Youve Been LIED TO About Saturated Fat & Heart Disease | Dr. Nina Teicholz;https://www.youtube.com/watch?v=yR0sQCBBQ3o;Jesse Chappus
The Dietary Guidelines Are Corrupt | Dr. Nina Teicholz;https://www.youtube.com/watch?v=GOieE6XRrvw;Jesse Chappus
You Will NEVER EAT Vegetable Oils Again After WATCHING THIS! | Dr. Nina Teicholz;https://www.youtube.com/watch?v=TbmyobIj9vE;Jesse Chappus
How to Melt Your Stress Away Fast | Dr. David Sinclair;https://www.youtube.com/watch?v=2cjj7sow5jc;Jesse Chappus
Brushing After You Eat Is DAMAGING Your Teeth! | Dr. Staci Whitman;https://www.youtube.com/watch?v=wZ9WYk6_1k0;Jesse Chappus
Functional Dentist REVEALS the Perfect Oral Care Routine (Morning & Night) | Dr. Staci Whitman;https://www.youtube.com/watch?v=wKUhjoKXNBA;Jesse Chappus
How Dr. David Sinclair Got off Sleeping Pills and Fixed His Sleep;https://www.youtube.com/watch?v=IHqaQOYVquU;Jesse Chappus
Dr. David Sinclair Reveals His LATEST Supplement Stack and Diet;https://www.youtube.com/watch?v=2EKFxtGbJ5I;Jesse Chappus
Allulose: Healthiest Sugar on the Planet | Nick Norwitz;https://www.youtube.com/watch?v=-oh9fbdW1tA;Jesse Chappus
Neuroscientist REVEALS the Best Foods & Supplements to BOOST BRAIN HEALTH | Louisa Nicola;https://www.youtube.com/watch?v=S73AsTIno_g;Jesse Chappus
Nick Norwitz Shares the Specifics of His Ketogenic Diet;https://www.youtube.com/watch?v=Dvwj54gkf1s;Jesse Chappus
Vegans Are Severely Deficient in THIS... (Its Not B12) | Dr. Stephanie Venn-Watson;https://www.youtube.com/watch?v=68pmaHw2DSY;Jesse Chappus
Jesse Asks Harvard Scientist What He Thinks About Death | Dr. David Sinclair;https://www.youtube.com/watch?v=WdbxaydtVV8;Jesse Chappus
Are All Carbs Bad for Your Metabolic Health? | Nick Norwitz;https://www.youtube.com/watch?v=tSZgPCB6XIQ;Jesse Chappus
START DOING THIS to Get the Brain-Changing Benefits of EXERCISE | Louisa Nicola;https://www.youtube.com/watch?v=jSsQzse1Ln4;Jesse Chappus
Why Carnivore ISN'T the Best Diet for Everyone | Nick Norwitz;https://www.youtube.com/watch?v=f-7QD-tn2CM;Jesse Chappus
How to Make Your Dog Live Longer | Dr. David Sinclair;https://www.youtube.com/watch?v=1DSZiwaE7qo;Jesse Chappus
What Happens if You Eat 4.5 lbs of Butter in a Week? | Nick Norwitz;https://www.youtube.com/watch?v=xMXlqW91tz0;Jesse Chappus
If You Have METABOLIC ISSUES, You Need to WATCH THIS! | Nick Norwitz;https://www.youtube.com/watch?v=6CSERD4tf3A;Jesse Chappus
How to GET RID of Amyloid Beta BEFORE It Forms Plaques | Louisa Nicola;https://www.youtube.com/watch?v=nFV_U-vyXn0;Jesse Chappus
Oreos Are MORE POTENT Than Statins for LOWERING LDL Cholesterol | Nick Norwitz;https://www.youtube.com/watch?v=_5m5vElN30c;Jesse Chappus
Neuroscientist Reveals the INSANE BENEFITS of Creatine for Your Body & BRAIN! | Louisa Nicola;https://www.youtube.com/watch?v=HEWnjHPOTgA;Jesse Chappus
Everything You NEED to Know About C15 | Dr. Stephanie Venn-Watson;https://www.youtube.com/watch?v=N4ZV3pdL-Q0;Jesse Chappus
The SECRETS to Choosing Dairy With the MOST C15 | Dr. Stephanie Venn-Watson;https://www.youtube.com/watch?v=kouWavs3qlI;Jesse Chappus
Use This Step by Step Strategy for a Total Body Transformation | JJ Virgin;https://www.youtube.com/watch?v=UBIcEbioopk;Jesse Chappus
Fasting Hack: EATING THIS Could Actually Help You Lose MORE Weight | Dr. Mindy Pelz;https://www.youtube.com/watch?v=KNlKTCU7UVM;Jesse Chappus
Before You Use Ozempic, Watch This! (Theres a FREE Alternative) | Dr. Mindy Pelz;https://www.youtube.com/watch?v=mmsylIGU28E;Jesse Chappus
Why Dr. Elizabeth Bright Changed Her Mind on Dairy;https://www.youtube.com/watch?v=D82Fmto-mHw;Jesse Chappus
Are Organ Meats Actually Healthy? | Dr. Elizabeth Bright;https://www.youtube.com/watch?v=AUFHA8i8WD8;Jesse Chappus
What Does Dr. Bill Schindler Eat in a Day?;https://www.youtube.com/watch?v=7_gBIUVn0mk;Jesse Chappus
The SHOCKING TRUTH About Iodine! (Nobody Shares This) | Dr. Elizabeth Bright;https://www.youtube.com/watch?v=mQeq1YjNKQ0;Jesse Chappus
Does Meat Quality Actually Matter? | Dr. Elizabeth Bright;https://www.youtube.com/watch?v=V1MfHTZr6X8;Jesse Chappus
Is Extra Protein Making You Fatter? | Dr Mindy Pelz;https://www.youtube.com/watch?v=B5v0loo1C1U;Jesse Chappus
A Day in the Life of Dr. Elizabeth Bright;https://www.youtube.com/watch?v=WZ8fuIX9sgU;Jesse Chappus
Do We Really Need Sunlight to Get Vitamin D? | Dr. Elizabeth Bright;https://www.youtube.com/watch?v=bQxyO7BhkFw;Jesse Chappus
You Will NEVER DRINK Tea Again After WATCHING THIS! | Dr. Elizabeth Bright;https://www.youtube.com/watch?v=PLyHMC8xOzM;Jesse Chappus
2 Popular Fasting Myths Debunked | Dr. Mindy Pelz;https://www.youtube.com/watch?v=2G8G_-45AOE;Jesse Chappus
How to Eat Like a Human | Dr. Bill Schindler;https://www.youtube.com/watch?v=oaEUujGOBVg;Jesse Chappus
How to Naturally Build Strong & Healthy Bones | JJ Virgin;https://www.youtube.com/watch?v=yNfKPIt6MbY;Jesse Chappus
Before You EAT CORN, You Need to WATCH THIS! | Dr. Bill Schindler;https://www.youtube.com/watch?v=EyMQUQZq1Hs;Jesse Chappus
Why You Cant Lose Weight (Its NOT About Calories) | Dr. Mindy Pelz;https://www.youtube.com/watch?v=TfswdzblfMs;Jesse Chappus
Best and Worst Dairy (Milk Products) - What You NEED to Know! | Dr. Bill Schindler;https://www.youtube.com/watch?v=F10sj5Dt7mU;Jesse Chappus
Your Mitochondria Have Been Waiting for THIS... | Dr. Mindy Pelz;https://www.youtube.com/watch?v=eUlk_27Rk4Q;Jesse Chappus
7 Things That Make You More Insulin Sensitive (Reverse Insulin Resistance) | Dr. Mindy Pelz;https://www.youtube.com/watch?v=u6FmdaEqnR8;Jesse Chappus
How to Naturally Balance Your Hormones | Dr. Mindy Pelz;https://www.youtube.com/watch?v=aHiBBPIQIW8;Jesse Chappus
Is Wild Meat More Nutritious Than Store-Bought? | Dr. Bill Schindler;https://www.youtube.com/watch?v=95tBWIU4epA;Jesse Chappus
Archaeologist Reveals What Our Ancestors Really Ate (Not Just Meat) | Dr. Bill Schindler;https://www.youtube.com/watch?v=Dxt3433C08g;Jesse Chappus
Before You EAT PLANTS, You Need to WATCH THIS! | Dr. Bill Schindler;https://www.youtube.com/watch?v=-AMkIEygZCQ;Jesse Chappus
What Does Dr. Kevin Stock Eat in a Day? (Carnivore Dentist);https://www.youtube.com/watch?v=omVV_clCk3M;Jesse Chappus
DO THIS Every Week to Build Muscle & BURN FAT | Mark Sisson;https://www.youtube.com/watch?v=BcHS_mIzXgM;Jesse Chappus
This Will Make You THINK TWICE About Taking Vitamin D | Dr. Kevin Stock;https://www.youtube.com/watch?v=2ylJwwmNb3A;Jesse Chappus
The SURPRISING Connection Between Dehydration & WEIGHT GAIN | JJ Virgin;https://www.youtube.com/watch?v=84Jpfk3vwDs;Jesse Chappus
You Will Want Barefoot Shoes After Watching This! | Mark Sisson;https://www.youtube.com/watch?v=JqKRPiudDL0;Jesse Chappus
How to Fix Snoring & Sleep Apnea Once and for All | Dr. Kevin Stock;https://www.youtube.com/watch?v=MTyWCd2c_C0;Jesse Chappus
Why Mark Sisson Changed His Mind on Cold Plunging;https://www.youtube.com/watch?v=7rXLiLJFGTA;Jesse Chappus
The Key to a Healthy Microbiome ISN'T Diversity, Its Actually THIS... | Mary Ruddick;https://www.youtube.com/watch?v=oy5XcVsCpAo;Jesse Chappus
What Does Mark Sisson Eat in a Day?;https://www.youtube.com/watch?v=gau5tw5eJTY;Jesse Chappus
Im Strongly Considering Not Eating Liver Anymore | Dr. Kevin Stock;https://www.youtube.com/watch?v=WEMkCycfMYY;Jesse Chappus
Youve Been LIED TO About Running - Its NOT Healthy | Mark Sisson;https://www.youtube.com/watch?v=WEa2z_uC-_k;Jesse Chappus
The SURPRISING Benefits of Collagen That Have NOTHING to Do with Building Muscle | Mark Sisson;https://www.youtube.com/watch?v=EMt0I7WrpzI;Jesse Chappus
If You Want to FIX Your Microbiome, You Need to WATCH THIS! | Mary Ruddick;https://www.youtube.com/watch?v=oRkefS2-gf0;Jesse Chappus
Carnivore Dentist Shares His MINIMALISTIC Oral Care Routine | Dr. Kevin Stock;https://www.youtube.com/watch?v=xwnJ5Hsb_JI;Jesse Chappus
Everything You NEED to Know about Iodine | Mary Ruddick;https://www.youtube.com/watch?v=Lfjvr_I45-s;Jesse Chappus
The REAL Reason Why You Cant Lose Weight (How to FIX IT) | Mary Ruddick;https://www.youtube.com/watch?v=YjRRdt7sZ0E;Jesse Chappus
Raw Milk: Is It ACTUALLY Healthier Than Pasteurized? | Dr. Kevin Stock;https://www.youtube.com/watch?v=jGEmFPGhsyc;Jesse Chappus
The MIND-BLOWING Impact of Light & Sound on the MICROBIOME | Mary Ruddick;https://www.youtube.com/watch?v=KEo_VXGhLOk;Jesse Chappus
What to Eat & Avoid to Lose Weight & Reverse Metabolic Dysfunction | Dr. Kevin Stock;https://www.youtube.com/watch?v=VknrIyCvBvc;Jesse Chappus
The SURPRISING Truth About Using OZEPMIC for Weight Loss | JJ Virgin;https://www.youtube.com/watch?v=aFjQelvslB0;Jesse Chappus
Can Rapamycin Help You Age in Reverse? | Dr. Robert Lufkin;https://www.youtube.com/watch?v=Bqpdfo-86ZE;Jesse Chappus
You Might Be Skinny Fat and NOT Know It (How to Test, DON'T Guess) | JJ Virgin;https://www.youtube.com/watch?v=dAAQT4lMSiw;Jesse Chappus
Iodine Warning: Watch This BEFORE You Supplement! | Dr. William Davis;https://www.youtube.com/watch?v=IyZUqxVGiqU;Jesse Chappus
Youve Been LIED TO About Eating Plants - They're NOT Healthy! | Dr. Elizabeth Bright;https://www.youtube.com/watch?v=skPV_5S9d_g;Jesse Chappus
Top Strategies to REVERSE Metabolic Dysfunction (Besides Diet) | Dr. Robert Lufkin;https://www.youtube.com/watch?v=9oq0w59YY1s;Jesse Chappus
You Might NEVER CONSUME Dairy Again After WATCHING THIS! | Dr. Elizabeth Bright;https://www.youtube.com/watch?v=nTYPbcQ1WWs;Jesse Chappus
Fasted Workouts vs Eating Before: Which Is Better? | JJ Virgin;https://www.youtube.com/watch?v=t3leUw8ibxw;Jesse Chappus
Youve Been LIED TO About Vitamin D - It Has NOTHING to Do with the Sun | Dr. Elizabeth Bright;https://www.youtube.com/watch?v=hgyTmjExZhc;Jesse Chappus
Why Coffee, Intense Exercise & Fasting Are Actually DESTROYING Your Health | Dr. Elizabeth Bright;https://www.youtube.com/watch?v=xMifA-xffQA;Jesse Chappus
Top Foods That DESTROY Your HEALTH | Dr. Robert Lufkin;https://www.youtube.com/watch?v=4R424KOK4ds;Jesse Chappus
Nutrition Expert: DO THIS to Reverse Insulin Resistance & Burn BODY FAT! | JJ Virgin;https://www.youtube.com/watch?v=o7SrI1KqFz4;Jesse Chappus
Your Doctor Is Wrong! Modern Diseases Have a Common Root Cause | Dr. Robert Lufkin;https://www.youtube.com/watch?v=vyuB23hVsio;Jesse Chappus
Stop Eating THIS... It Causes Fatty Liver & Insulin Resistance! | Dr. Robert Lufkin;https://www.youtube.com/watch?v=pGP0rIjuRDw;Jesse Chappus
Follow This 2 WEEK PROTOCOL to Reduce Inflammation & HEAL THE BODY | Dr. Elizabeth Bright;https://www.youtube.com/watch?v=WQCO8wlldAQ;Jesse Chappus
How to LOSE Your Wrinkles (Natural Remedy) | Dr. William Davis;https://www.youtube.com/watch?v=jt5n-ZCnaGE;Jesse Chappus
Youve Been LIED TO About Iodine | Dr. Elizabeth Bright;https://www.youtube.com/watch?v=bp4OXagj0wg;Jesse Chappus
Vitamin K2 DOESN'T Increase Bone Density - It Actually Does THIS... | Dr. William Davis;https://www.youtube.com/watch?v=4vq0uEBFeR8;Jesse Chappus
Doctor Dispels the MYTHS About Fish Oil | Dr. William Davis;https://www.youtube.com/watch?v=NgBhnGrUxVI;Jesse Chappus
Why You NEED to Start Taking a Magnesium Supplement ASAP! | Dr. William Davis;https://www.youtube.com/watch?v=NUmDbRv5t4M;Jesse Chappus
Why Dr. Casey Means Changed Her Mind on Eating a Plant-Based Diet;https://www.youtube.com/watch?v=5clw6W7KXoE;Jesse Chappus
The BEST WAYS to Build Strong Bones WITHOUT Calcium Supplements | Dr. William Davis;https://www.youtube.com/watch?v=-LHqFRlfJzw;Jesse Chappus
You May Never Consume BONE BROTH Again After Watching This! | Dr. William Davis;https://www.youtube.com/watch?v=JvlLY8JR2Q4;Jesse Chappus
Amyloid Is NOT Causing Alzheimers - Its Actually Protecting the Brain! | Dr. Heather Sandison;https://www.youtube.com/watch?v=EWRSdlpsrYE;Jesse Chappus
The SCARY TRUTH About Ozempic & Other Weight Loss Injections! | Dr. William Davis;https://www.youtube.com/watch?v=pxsEhdTWfbw;Jesse Chappus
The OPTIMAL Vitamin D Level to Preserve Bones & Prevent Cancer | Dr. William Davis;https://www.youtube.com/watch?v=mE0OzDLPhPU;Jesse Chappus
Alzheimer's Doctor: The #1 Diet to Prevent & Reverse Cognitive Decline | Dr. Heather Sandison;https://www.youtube.com/watch?v=cd2B49sQqbs;Jesse Chappus
Stop Doing THIS... It Accelerates Skin Aging and Wrinkles! | Dr. William Davis;https://www.youtube.com/watch?v=hWpC4zcUQ-U;Jesse Chappus
Cardiologist Reveals the SHOCKING TRUTH About Cholesterol & Heart Disease! | Dr. William Davis;https://www.youtube.com/watch?v=ht02d7YROy8;Jesse Chappus
The UNTOLD TRUTH About Wisdom Teeth & Cavitations | Dr. Mark Burhenne;https://www.youtube.com/watch?v=4RLB9L-9UJ4;Jesse Chappus
The ROOT CAUSE of Insulin Resistance & How to Catch It EARLY! | Dr. Casey Means;https://www.youtube.com/watch?v=3NI_9-jRrg4;Jesse Chappus
