Title;Link;Creator
How To Revive Your Sourdough Starter #shorts;https://www.youtube.com/watch?v=0k81SeKM4EY;Living Well Dr. Michelle Jorgensen
Thyroid...and the dental connection! #shorts;https://www.youtube.com/watch?v=Jtj4e_x54rg;Living Well Dr. Michelle Jorgensen
SAFE Kids Toothpaste #shorts;https://www.youtube.com/watch?v=rwHfDW5qpZ4;Living Well Dr. Michelle Jorgensen
Signs You Need To Check Your Tonsils #shorts;https://www.youtube.com/watch?v=NJNX5VbWudM;Living Well Dr. Michelle Jorgensen
The Dr. Michelle Show LIVE - May 9th, 2024;https://www.youtube.com/watch?v=HG2Dy8oZSro;Living Well Dr. Michelle Jorgensen
This Mom's Secret Will Blow Your Mind #shorts;https://www.youtube.com/watch?v=0kLzQcn9bSA;Living Well Dr. Michelle Jorgensen
Hidden Dental Infection #shorts;https://www.youtube.com/watch?v=Gr8UWNTBVB8;Living Well Dr. Michelle Jorgensen
Can't Stop Grinding Your Teeth #shorts;https://www.youtube.com/watch?v=-_LStqG3NOs;Living Well Dr. Michelle Jorgensen
Sleep Apnea Mystery Solved #shorts;https://www.youtube.com/watch?v=s6FM80Eivos;Living Well Dr. Michelle Jorgensen
Manual vs. Electric Toothbrush: Which is Right for You?;https://www.youtube.com/watch?v=Zx4FhHTgTGg;Living Well Dr. Michelle Jorgensen
What are tonsil stones, and what to do about it? #shorts;https://www.youtube.com/watch?v=1KFQpj9-6dU;Living Well Dr. Michelle Jorgensen
The Dr. Michelle Show LIVE - May 2nd, 2024;https://www.youtube.com/watch?v=q9fJkB6ZDM0;Living Well Dr. Michelle Jorgensen
Signs You're A Mouth Breather #shorts;https://www.youtube.com/watch?v=2DIq_0Hj20U;Living Well Dr. Michelle Jorgensen
Signs You Need To Remineralize Your Teeth #shorts;https://www.youtube.com/watch?v=BbyjSqKe294;Living Well Dr. Michelle Jorgensen
Sinus Infections Are NOT Normal #shorts;https://www.youtube.com/watch?v=EpGCy1oWs-A;Living Well Dr. Michelle Jorgensen
How to save your kids tooth in an emergency #shorts;https://www.youtube.com/watch?v=4R_6GYxyAoA;Living Well Dr. Michelle Jorgensen
Scraping Tarter Off Your Teeth? Do This Instead! #shorts;https://www.youtube.com/watch?v=hsu9cLxNR0o;Living Well Dr. Michelle Jorgensen
When your dentist tells you that cavities are curable #shorts;https://www.youtube.com/watch?v=hGdTGT2r3_k;Living Well Dr. Michelle Jorgensen
How To Easily Activate & Use Sourdough Starter;https://www.youtube.com/watch?v=62kLBxSoqEU;Living Well Dr. Michelle Jorgensen
The Dr. Michelle Show LIVE - April 25th, 2024;https://www.youtube.com/watch?v=6tfNrwkjt4Q;Living Well Dr. Michelle Jorgensen
Are your hips and feet uneven? #shorts;https://www.youtube.com/watch?v=CeQwZS7GvnU;Living Well Dr. Michelle Jorgensen
Her teeth were dissolving in her sleep #shorts;https://www.youtube.com/watch?v=fA1jQJnhLzU;Living Well Dr. Michelle Jorgensen
This is the reason your gums are receding #shorts;https://www.youtube.com/watch?v=SsesaO3OQEQ;Living Well Dr. Michelle Jorgensen
Can failed root canals lead to cancer? #shorts;https://www.youtube.com/watch?v=MTW4Y-iAY7o;Living Well Dr. Michelle Jorgensen
Waking Up Gasping for Air? Shocking Scan Reveals the REAL Culprit #shorts;https://www.youtube.com/watch?v=uXagau4nzws;Living Well Dr. Michelle Jorgensen
The Shocking Truth About Teeth Grinding! #shorts;https://www.youtube.com/watch?v=0w4jYxcbsTc;Living Well Dr. Michelle Jorgensen
The Dr. Michelle Show LIVE - April 18th, 2024;https://www.youtube.com/watch?v=HY47lXqdOf8;Living Well Dr. Michelle Jorgensen
"Teen Almost Has Surgery for ""Cancer"" Until Mom Makes This Discovery #shorts";https://www.youtube.com/watch?v=K-1I8i84M_U;Living Well Dr. Michelle Jorgensen
"Woman with melanoma has infected root canal in ""liver zone"" #shorts";https://www.youtube.com/watch?v=IssZ12QjIg4;Living Well Dr. Michelle Jorgensen
Man's Throbbing Pain Had A Shocking Cause #shorts;https://www.youtube.com/watch?v=4hV6T3H79Ro;Living Well Dr. Michelle Jorgensen
His cone Beam CT scan showed he was suffocating #shorts;https://www.youtube.com/watch?v=lcdzBxHrG3k;Living Well Dr. Michelle Jorgensen
Your weight loss issue may because of your mouth. #shorts;https://www.youtube.com/watch?v=qOWCLOPcoOQ;Living Well Dr. Michelle Jorgensen
The Dr. Michelle Show LIVE - April 11, 2024;https://www.youtube.com/watch?v=ds4l2NDIyiM;Living Well Dr. Michelle Jorgensen
Don't step on your garden rows #shorts;https://www.youtube.com/watch?v=y4mN0t9Xs6M;Living Well Dr. Michelle Jorgensen
How Do You Know When You Have Gum Disease? #shorts;https://www.youtube.com/watch?v=xdBOft52AIk;Living Well Dr. Michelle Jorgensen
What Kind Of Soil Should You Use For Your Garden? #shorts;https://www.youtube.com/watch?v=z4Jjr6dzGBA;Living Well Dr. Michelle Jorgensen
What Do You Use For Pest Control? #shorts;https://www.youtube.com/watch?v=PnYBmDuWU38;Living Well Dr. Michelle Jorgensen
How Much Do You Need To Grow To Feed Your Family #shorts;https://www.youtube.com/watch?v=2Km-q8ur020;Living Well Dr. Michelle Jorgensen
You Won't Believe What This CBCT Scan Showed! #shorts;https://www.youtube.com/watch?v=xHPRBBgZtZY;Living Well Dr. Michelle Jorgensen
How To Solve Gum Disease #shorts;https://www.youtube.com/watch?v=T-qeO_lWCOA;Living Well Dr. Michelle Jorgensen
5 Things To Plant In April #shorts;https://www.youtube.com/watch?v=dq06gtiY-j0;Living Well Dr. Michelle Jorgensen
Root Cause For Teeth Grinding #shorts;https://www.youtube.com/watch?v=BW8MPwZePXg;Living Well Dr. Michelle Jorgensen
Are Your Cavities Linked To Sleep Issues? #shorts;https://www.youtube.com/watch?v=XtSKcOXuvqc;Living Well Dr. Michelle Jorgensen
How To Prune Raspberries #shorts;https://www.youtube.com/watch?v=rqK5tCTPEiw;Living Well Dr. Michelle Jorgensen
How To Protect Your Strawberries From Birds #shorts;https://www.youtube.com/watch?v=WANFAOo-u5k;Living Well Dr. Michelle Jorgensen
Live with Dr. Michelle;https://www.youtube.com/watch?v=3oKWly_luvc;Living Well Dr. Michelle Jorgensen
"""I Finally Stopped Snoring!"" #shorts";https://www.youtube.com/watch?v=EMpvkydYrl8;Living Well Dr. Michelle Jorgensen
Edible and Medicinal Plants That Grow Year Round #shorts;https://www.youtube.com/watch?v=Izk_vROLLKg;Living Well Dr. Michelle Jorgensen
Solution To Bad Breath #shorts;https://www.youtube.com/watch?v=_-49eqMNpoQ;Living Well Dr. Michelle Jorgensen
Don't Expose Your Babies To Mercury #shorts;https://www.youtube.com/watch?v=IQRFMm0a6uQ;Living Well Dr. Michelle Jorgensen
I Saved My Mom's Life: Snoring Can Lead To Major Health Issues;https://www.youtube.com/watch?v=cjVX3vSPyl4;Living Well Dr. Michelle Jorgensen
Stop. If You Care About Your Health, PLEASE Listen To This! #shorts;https://www.youtube.com/watch?v=w2MX01YQh9I;Living Well Dr. Michelle Jorgensen
Livestream;https://www.youtube.com/watch?v=ESfRmmOQCC0;Living Well Dr. Michelle Jorgensen
Grow Your Own Medicinal Plants #shorts;https://www.youtube.com/watch?v=95W_1TOOr1g;Living Well Dr. Michelle Jorgensen
Start Your Own Medicinal Garden With These 5 Plants! #shorts;https://www.youtube.com/watch?v=ai1EfBt8Muc;Living Well Dr. Michelle Jorgensen
High Blood Pressure And The Dental Connection #shorts;https://www.youtube.com/watch?v=LU-UfR7Buqk;Living Well Dr. Michelle Jorgensen
Mouth tape for mouth breathing? Does it work? #shorts;https://www.youtube.com/watch?v=cBmC0_PFneY;Living Well Dr. Michelle Jorgensen
2 Easy Ways To Plant Spinach #shorts;https://www.youtube.com/watch?v=O6iCDTab_78;Living Well Dr. Michelle Jorgensen
A Healthy Mouth Could Extend Your Life #shorts;https://www.youtube.com/watch?v=K6r7e6qgReo;Living Well Dr. Michelle Jorgensen
The Dr. Michelle Show LIVE - March 14th, 2024;https://www.youtube.com/watch?v=_TQ_eF3DkkU;Living Well Dr. Michelle Jorgensen
3 Hacks To Do Before Bed To Stop Snoring Now! #shorts;https://www.youtube.com/watch?v=MDAmbrfytK0;Living Well Dr. Michelle Jorgensen
Crop Rotating #shorts;https://www.youtube.com/watch?v=ZZ00b0rfOlM;Living Well Dr. Michelle Jorgensen
Don't Till Your Garden...Here's Why #shorts;https://www.youtube.com/watch?v=habls5EArIc;Living Well Dr. Michelle Jorgensen
Gardening 101: How To Start Your Garden Today!;https://www.youtube.com/watch?v=JaSAAlHXJrc;Living Well Dr. Michelle Jorgensen
3 Ways To Use Spinach #shorts;https://www.youtube.com/watch?v=R10L7VljNB8;Living Well Dr. Michelle Jorgensen
How Do You Make Compost? #shorts;https://www.youtube.com/watch?v=jXBTd-VpAGE;Living Well Dr. Michelle Jorgensen
Don't Eat Fake Food: Ask these questions to make sure you're getting the nutrients you need#shorts;https://www.youtube.com/watch?v=cUxDADmfQLQ;Living Well Dr. Michelle Jorgensen
Dental Fillings Dangerous To Pregnant Mothers #shorts;https://www.youtube.com/watch?v=Nsx1Sk3u9iM;Living Well Dr. Michelle Jorgensen
Seed Starting Simplified: 3 Hacks You NEED To Know #shorts;https://www.youtube.com/watch?v=CP_UqBpZZSY;Living Well Dr. Michelle Jorgensen
Secret For Natural Pest Control #shorts;https://www.youtube.com/watch?v=Oi-41mnB5Vs;Living Well Dr. Michelle Jorgensen
ALWAYS do this before you start your garden #shorts;https://www.youtube.com/watch?v=sUf7IA-N3t0;Living Well Dr. Michelle Jorgensen
The Dr. Michelle Show LIVE - February 29th, 2024;https://www.youtube.com/watch?v=NZ5nK-byomo;Living Well Dr. Michelle Jorgensen
Is a dental crown safe? What kind to get! #shorts;https://www.youtube.com/watch?v=2ODU-jykwrE;Living Well Dr. Michelle Jorgensen
Is Fluoride Good Or Bad For Your Teeth? AND the Fluoride Alternative.;https://www.youtube.com/watch?v=t4bCB8FBG1E;Living Well Dr. Michelle Jorgensen
Solution for teeth grinders & clenchers #shorts;https://www.youtube.com/watch?v=aDcSlFXLMUw;Living Well Dr. Michelle Jorgensen
Simple trick to avoid infection & aid bone growth after treatment #shorts;https://www.youtube.com/watch?v=gQUMlB830oc;Living Well Dr. Michelle Jorgensen
Are crowns safe? #shorts;https://www.youtube.com/watch?v=498lu8NOjjI;Living Well Dr. Michelle Jorgensen
Don't Go To A Normal Dentist #shorts;https://www.youtube.com/watch?v=Z-1BnP1JtNc;Living Well Dr. Michelle Jorgensen
How do you know if you have a toxic filling in your mouth #shorts;https://www.youtube.com/watch?v=u5Y2XjZaIYQ;Living Well Dr. Michelle Jorgensen
4 Causes for bleeding gums and gum disease #shorts;https://www.youtube.com/watch?v=yAk0padhSFQ;Living Well Dr. Michelle Jorgensen
The Dr. Michelle Show LIVE - February 22nd, 2024;https://www.youtube.com/watch?v=m6YRSI8nIYc;Living Well Dr. Michelle Jorgensen
How To Floss #shorts;https://www.youtube.com/watch?v=VrG8pIBGw78;Living Well Dr. Michelle Jorgensen
Watch this before you get dentures #shorts;https://www.youtube.com/watch?v=5-hxW6uSX3w;Living Well Dr. Michelle Jorgensen
How to call a dental office and see if they're good for... #shorts;https://www.youtube.com/watch?v=t7fqqCoYuTY;Living Well Dr. Michelle Jorgensen
6 Things Elderberry Tea Helps With #shorts;https://www.youtube.com/watch?v=j8VN7UxzpJg;Living Well Dr. Michelle Jorgensen
Oil Pulling! Watch Me Oil Pull For Better Dental Health #shorts;https://www.youtube.com/watch?v=KM_VacQpHT0;Living Well Dr. Michelle Jorgensen
Simple trick to brushing your child's teeth #shorts;https://www.youtube.com/watch?v=0-EJlpbn9wE;Living Well Dr. Michelle Jorgensen
The Dr. Michelle Show LIVE - February 15th, 2024;https://www.youtube.com/watch?v=dnaoR0l3puk;Living Well Dr. Michelle Jorgensen
3 Unexpected Ways to Floss You Never Knew Existed #shorts;https://www.youtube.com/watch?v=kzzAHsRgPRo;Living Well Dr. Michelle Jorgensen
The Health Benefits Of Elderberries: Immune, Energy, Sleep, Healing, And More!;https://www.youtube.com/watch?v=FFZUS8EYQyk;Living Well Dr. Michelle Jorgensen
Breastmilk can harm your child's teeth #shorts;https://www.youtube.com/watch?v=oOVDZlvRUdM;Living Well Dr. Michelle Jorgensen
Oil Pulling? Should You Do It? #shorts;https://www.youtube.com/watch?v=R-2HHncZjM0;Living Well Dr. Michelle Jorgensen
Breast Cancer & The Dental Connection #shorts;https://www.youtube.com/watch?v=Oqu0xN8n4sA;Living Well Dr. Michelle Jorgensen
Watch this before you get veneers #shorts;https://www.youtube.com/watch?v=QQ_WKxV7Cqw;Living Well Dr. Michelle Jorgensen
The Dr. Michelle Show LIVE - February 8th, 2024;https://www.youtube.com/watch?v=UOj8h3TqM0U;Living Well Dr. Michelle Jorgensen
Kids Dental Questions #shorts;https://www.youtube.com/watch?v=ok2w0MCGTz4;Living Well Dr. Michelle Jorgensen
Low Energy? Watch This. #shorts;https://www.youtube.com/watch?v=gVdMDEGJcEk;Living Well Dr. Michelle Jorgensen
How to brush with tooth powder #shorts;https://www.youtube.com/watch?v=FHcuCFoGGPE;Living Well Dr. Michelle Jorgensen
Low On Energy? This could be the root cause #shorts;https://www.youtube.com/watch?v=ntRh8j8i9WY;Living Well Dr. Michelle Jorgensen
The Dr. Michelle Show LIVE - February 1st, 2024;https://www.youtube.com/watch?v=bhc8ES4kOA4;Living Well Dr. Michelle Jorgensen
3 Things You Shouldn't Do For A Healthy Gut #shorts;https://www.youtube.com/watch?v=G2A3HnwktZM;Living Well Dr. Michelle Jorgensen
How To Do The Baking Soda Gut Test #shorts;https://www.youtube.com/watch?v=dbmpO0VoMNs;Living Well Dr. Michelle Jorgensen
Signs and symptoms of low stomach acid #shorts;https://www.youtube.com/watch?v=GVzvneC-gng;Living Well Dr. Michelle Jorgensen
If you want more energy, do this! #shorts;https://www.youtube.com/watch?v=YfWN9NcOnwo;Living Well Dr. Michelle Jorgensen
The Dr. Michelle Show LIVE - January 25th, 2024;https://www.youtube.com/watch?v=1KXN69SrRFw;Living Well Dr. Michelle Jorgensen
What to eat for strong gums #shorts;https://www.youtube.com/watch?v=YBx1h2MHvCU;Living Well Dr. Michelle Jorgensen
How to use your castor oil pack #shorts;https://www.youtube.com/watch?v=BBX6ArrRGXI;Living Well Dr. Michelle Jorgensen
Translucent Teeth #shorts;https://www.youtube.com/watch?v=5EBKzT6LpIk;Living Well Dr. Michelle Jorgensen
Are You Suffocating At Night? #shorts;https://www.youtube.com/watch?v=5BDbQMFrMho;Living Well Dr. Michelle Jorgensen
The Dr. Michelle Show LIVE - January 18th, 2024;https://www.youtube.com/watch?v=BeE_y8Jrg8Y;Living Well Dr. Michelle Jorgensen
The Infection Was Draining Down Her Throat #shorts;https://www.youtube.com/watch?v=rIPUOIfN5D8;Living Well Dr. Michelle Jorgensen
Baking Soda Trick Reveals The True Culprit For Your Tooth Decay #shorts;https://www.youtube.com/watch?v=ekDAEKkHLX8;Living Well Dr. Michelle Jorgensen
SIDS may be related to lip ties in infants #shorts;https://www.youtube.com/watch?v=9YM0sw3GIkY;Living Well Dr. Michelle Jorgensen
Your CPAP is causing ringing in your ears... #shorts;https://www.youtube.com/watch?v=fsKWJl0hxNI;Living Well Dr. Michelle Jorgensen
Get rid of your CPAP and breathe better #shorts;https://www.youtube.com/watch?v=qqzZ-RtfycM;Living Well Dr. Michelle Jorgensen
Food sensitivites? Fix your gut. #shorts;https://www.youtube.com/watch?v=jZOwkPQ7IQc;Living Well Dr. Michelle Jorgensen
The Dr. Michelle Show LIVE - January 11th, 2024;https://www.youtube.com/watch?v=V-3tfjMa7TM;Living Well Dr. Michelle Jorgensen
Gum Disease is the most commonly researched disease in the mouth #shorts;https://www.youtube.com/watch?v=gkeF9QIi1uc;Living Well Dr. Michelle Jorgensen
Does your dentist do this? #shorts;https://www.youtube.com/watch?v=jL5tut76a9Q;Living Well Dr. Michelle Jorgensen
Can you get a cavitation under a root canal tooth? #shorts;https://www.youtube.com/watch?v=ieShPAMQe-E;Living Well Dr. Michelle Jorgensen
The Truth About Antibiotics: The Good And The Bad;https://www.youtube.com/watch?v=enGWRBSSNNc;Living Well Dr. Michelle Jorgensen
Jaw Pain? TMJ? This is what's happening in your jaw...#shorts;https://www.youtube.com/watch?v=PWujS8yfcwg;Living Well Dr. Michelle Jorgensen
Sleep apnea? Look what we found in his mouth! #shorts;https://www.youtube.com/watch?v=TlK0q6W5X5c;Living Well Dr. Michelle Jorgensen
What to do for a geographic tongue #shorts;https://www.youtube.com/watch?v=NBnxkrkT3ko;Living Well Dr. Michelle Jorgensen
The Dr. Michelle Show LIVE - January 4, 2024;https://www.youtube.com/watch?v=uKsWHT-CG80;Living Well Dr. Michelle Jorgensen
These medications reduce stomach acid. #shorts;https://www.youtube.com/watch?v=Kmhs4LkIqhc;Living Well Dr. Michelle Jorgensen
What exactly does hydroxyapatite do to your teeth? #shorts;https://www.youtube.com/watch?v=1Lo5KWtSABI;Living Well Dr. Michelle Jorgensen
sippy cups, bottles, and pacifiers can harm your child's mouth #shorts;https://www.youtube.com/watch?v=spJu4hPwHns;Living Well Dr. Michelle Jorgensen
Breathing & Sinus Issues? Look at these two things to help. #shorts;https://www.youtube.com/watch?v=Yk47Asaewdw;Living Well Dr. Michelle Jorgensen
The Dental Connection To Breast Cancer #shorts;https://www.youtube.com/watch?v=pj3YLrVPgRo;Living Well Dr. Michelle Jorgensen
The Dr. Michelle Show LIVE - December 28th, 2023;https://www.youtube.com/watch?v=Qgbu_vmYvyU;Living Well Dr. Michelle Jorgensen
Say Goodbye To Migraines With This Dental Fix. #shorts;https://www.youtube.com/watch?v=ih92m6ywvig;Living Well Dr. Michelle Jorgensen
Is your tooth pain actually tooth pain? Or is it this?....#shorts;https://www.youtube.com/watch?v=QUsdLwbozkk;Living Well Dr. Michelle Jorgensen
Mast Cell Activation Syndrome (MCAS)? This could be your solution. #shorts;https://www.youtube.com/watch?v=rFqaR78rgAc;Living Well Dr. Michelle Jorgensen
Simple Dental Cure For Migraines #shorts;https://www.youtube.com/watch?v=aWkhyFXlQ00;Living Well Dr. Michelle Jorgensen
Are your front teeth worn off? This is why! #shorts;https://www.youtube.com/watch?v=LVIDBbzom0o;Living Well Dr. Michelle Jorgensen
Neck Pain Alert! Don't Ignore This Sign #shorts;https://www.youtube.com/watch?v=8fLrArXVwcM;Living Well Dr. Michelle Jorgensen
The Dr. Michelle Show LIVE - December 22nd, 2023;https://www.youtube.com/watch?v=TDz4WtOAHdw;Living Well Dr. Michelle Jorgensen
High Cholesterol? I have a secret you NEED to know #shorts;https://www.youtube.com/watch?v=s3JgF2GwnJg;Living Well Dr. Michelle Jorgensen
Ear Ringing, Dizziness, & Pressure? Do this. #shorts;https://www.youtube.com/watch?v=fCS2KENeV7U;Living Well Dr. Michelle Jorgensen
Weightloss & Dental Health #shorts;https://www.youtube.com/watch?v=tcnJHTG5Lyg;Living Well Dr. Michelle Jorgensen
Trouble Sleeping? This Mouth Problem Could Be Causing It...#shorts;https://www.youtube.com/watch?v=Lqv80E7HikE;Living Well Dr. Michelle Jorgensen
Cause of fatigue hidden in the mouth #shorts;https://www.youtube.com/watch?v=Lz9OCgzxMpQ;Living Well Dr. Michelle Jorgensen
Save Your Tooth from the Drill! This Test Could Be Your Lifesaver! #shorts;https://www.youtube.com/watch?v=-V0WZlQJcVs;Living Well Dr. Michelle Jorgensen
Natural Anxiety Relief! #shorts;https://www.youtube.com/watch?v=NH7q0RlVsok;Living Well Dr. Michelle Jorgensen
Why Can't I Swallow? I Have The Answer And It's Scary! #shorts;https://www.youtube.com/watch?v=FFhlTeJEqfw;Living Well Dr. Michelle Jorgensen
Hydroxyapatite Tooth Whitening Powder | How to Whiten Teeth Naturally;https://www.youtube.com/watch?v=E7xRaEgdeMY;Living Well Dr. Michelle Jorgensen
Ringing in the ears? Did you know it's connected to your teeth? #shorts;https://www.youtube.com/watch?v=NMAH4272jOg;Living Well Dr. Michelle Jorgensen
Don't let your gums disappear! Do this first. #shorts;https://www.youtube.com/watch?v=7_vBcEeVaf0;Living Well Dr. Michelle Jorgensen
Wait till she stops relaxing her lip...#shorts;https://www.youtube.com/watch?v=dBcdoeGh1Cc;Living Well Dr. Michelle Jorgensen
MCAS - & the dental solution to her allergies #shorts;https://www.youtube.com/watch?v=5kvKLccWbGA;Living Well Dr. Michelle Jorgensen
Food gets stuck in dental implant #shorts;https://www.youtube.com/watch?v=zv5rAmyp9gg;Living Well Dr. Michelle Jorgensen
Watch This If You're Feeling Lazy! #shorts;https://www.youtube.com/watch?v=t54uj-YnEdQ;Living Well Dr. Michelle Jorgensen
How to make the mouth bigger #shorts;https://www.youtube.com/watch?v=DizCrTp1BX0;Living Well Dr. Michelle Jorgensen
Warning: Dentures Could Be Silently Destroying Your Health #shorts;https://www.youtube.com/watch?v=0JM-hh_4eAs;Living Well Dr. Michelle Jorgensen
This Common Metal Could Be RUINING Your Life. #shorts;https://www.youtube.com/watch?v=GTjRgK66Kus;Living Well Dr. Michelle Jorgensen
I literally couldn't find an infection...what was going on?! #shorts;https://www.youtube.com/watch?v=QmcRQYEiw_g;Living Well Dr. Michelle Jorgensen
Alternatives to Cpap - Addressing the Root Cause of Low Oxygen;https://www.youtube.com/watch?v=JDAThgPKDpU;Living Well Dr. Michelle Jorgensen
Why removing teeth for braces can cause major problems... #shorts;https://www.youtube.com/watch?v=YwAKOmSe9Pw;Living Well Dr. Michelle Jorgensen
My hands suddenly went numb... #shorts;https://www.youtube.com/watch?v=qYu9VGN2WI4;Living Well Dr. Michelle Jorgensen
Shocking Truth: Jaw Problems Linked To Hearing Loss #shorts;https://www.youtube.com/watch?v=yt985_ObcOM;Living Well Dr. Michelle Jorgensen
Dental Infection Can Impact Athletic Performance #shorts;https://www.youtube.com/watch?v=tL9Ff7tcezg;Living Well Dr. Michelle Jorgensen
A Dental Nightmare: Woman Loses Seven Teeth #shorts;https://www.youtube.com/watch?v=vyoSWnh2KQ4;Living Well Dr. Michelle Jorgensen
What to use instead of Fluoride... #shorts;https://www.youtube.com/watch?v=QNnd1OeSbec;Living Well Dr. Michelle Jorgensen
Q&A With Dr Michelle: Implants, TMJ, Gum Recession, and more...;https://www.youtube.com/watch?v=adcsd2cX-Zk;Living Well Dr. Michelle Jorgensen
Trouble Swallowing? #shorts;https://www.youtube.com/watch?v=EXrVI3TCrDg;Living Well Dr. Michelle Jorgensen
Is your tooth infection preventing you from loosing weight? #shorts;https://www.youtube.com/watch?v=9trj7LloIMM;Living Well Dr. Michelle Jorgensen
Cats starved to death eating microwaved food #shorts;https://www.youtube.com/watch?v=FFnBdENrkLM;Living Well Dr. Michelle Jorgensen
Autoimmune issues? Look what we found... #shorts;https://www.youtube.com/watch?v=p3pEWARxasQ;Living Well Dr. Michelle Jorgensen
How to find a holistic dentist near you #shorts;https://www.youtube.com/watch?v=GTSxfH0Ww5E;Living Well Dr. Michelle Jorgensen
Announcement #shorts;https://www.youtube.com/watch?v=XmGcM62TYGA;Living Well Dr. Michelle Jorgensen
Save $60,000 on jaw surgery with this tip #shorts;https://www.youtube.com/watch?v=DTjLNfFdmUA;Living Well Dr. Michelle Jorgensen
#shorts;https://www.youtube.com/watch?v=aTSOVuOMFtw;Living Well Dr. Michelle Jorgensen
Jaw broken from abuse #shorts;https://www.youtube.com/watch?v=nAoRkbAvEpw;Living Well Dr. Michelle Jorgensen
Unpopular opinion: Root Canals will fail #shorts;https://www.youtube.com/watch?v=tDYYGAGw7BQ;Living Well Dr. Michelle Jorgensen
Dry Mouth? Here's The Solution. #shorts;https://www.youtube.com/watch?v=cqNOAC9ftN0;Living Well Dr. Michelle Jorgensen
How do you handle anxiety during a dental appointment? #shorts;https://www.youtube.com/watch?v=jjJGTZPgXDM;Living Well Dr. Michelle Jorgensen
Tooth Infection SO BAD It Broke Through Her Sinus #shorts;https://www.youtube.com/watch?v=QPmRXudhQ2k;Living Well Dr. Michelle Jorgensen
Root cause for thyroid problems found in the mouth?! #shorts;https://www.youtube.com/watch?v=zmhT0moi2Uw;Living Well Dr. Michelle Jorgensen
Jaw Pain..... SOLVED! #shorts;https://www.youtube.com/watch?v=cjt6NJbMQH4;Living Well Dr. Michelle Jorgensen
Oh My Gosh That's ME #shorts;https://www.youtube.com/watch?v=lJmB_Mjbrwk;Living Well Dr. Michelle Jorgensen
Do This One Thing To Protect Your Teeth From Sugar #shorts;https://www.youtube.com/watch?v=xQn1gA2kh0g;Living Well Dr. Michelle Jorgensen
Everytime you chew on an abscessed root canal, it spreads infection #shorts;https://www.youtube.com/watch?v=uHqGst9F43E;Living Well Dr. Michelle Jorgensen
The Baking Soda Test: How to Test for Low Stomach Acid;https://www.youtube.com/watch?v=d6HjNijyTtY;Living Well Dr. Michelle Jorgensen
Why Your Tooth Could Still Be Hurting After A Root Canal #shorts;https://www.youtube.com/watch?v=zYzXhPyUnrQ;Living Well Dr. Michelle Jorgensen
Patient misdiagnosed with lupus... #shorts;https://www.youtube.com/watch?v=fE9vcQlOjNk;Living Well Dr. Michelle Jorgensen
Fluoride Is Bad For You. #shorts;https://www.youtube.com/watch?v=Ll-f6ArOMMg;Living Well Dr. Michelle Jorgensen
This is what sugar can do #shorts;https://www.youtube.com/watch?v=bw6-JsRTKSo;Living Well Dr. Michelle Jorgensen
"He just ""knew something was wrong"" then we found this... #shorts";https://www.youtube.com/watch?v=SoAteZda8-8;Living Well Dr. Michelle Jorgensen
Is apple cider vinegar and lemon juice bad for your teeth? #shorts;https://www.youtube.com/watch?v=Mjm4inhX3RQ;Living Well Dr. Michelle Jorgensen
Solution to a tooth abscess #shorts;https://www.youtube.com/watch?v=-3ptt36Yu_Y;Living Well Dr. Michelle Jorgensen
The Surprising Connection Between Your Oral Health and Gut Health;https://www.youtube.com/watch?v=hKML4zNFMbE;Living Well Dr. Michelle Jorgensen
You don't need to get your adenoids out. #shorts;https://www.youtube.com/watch?v=Dp5g89uqIHY;Living Well Dr. Michelle Jorgensen
Root Cause Of Low Stomach Acid #shorts;https://www.youtube.com/watch?v=8P8zDxj1r_s;Living Well Dr. Michelle Jorgensen
Don't Remove Your Tonsils. Do This Instead. #shorts;https://www.youtube.com/watch?v=uNfejD5C7HI;Living Well Dr. Michelle Jorgensen
5 Things I Do Differently As A Holistic Dentist #shorts;https://www.youtube.com/watch?v=f4C07kIoUy4;Living Well Dr. Michelle Jorgensen
Inflammation and infection in her mouth was causing fight or flight mode. #shorts;https://www.youtube.com/watch?v=WUPvSaxXZkw;Living Well Dr. Michelle Jorgensen
Huge swollen knee. All because of a dental infection. #shorts;https://www.youtube.com/watch?v=D2CUFF74nbI;Living Well Dr. Michelle Jorgensen
When you're playing sports...can you breathe? #shorts;https://www.youtube.com/watch?v=Zx9LjZXt0rw;Living Well Dr. Michelle Jorgensen
Solution to severe jaw joint degeneration #shorts;https://www.youtube.com/watch?v=2mypHYOYWOA;Living Well Dr. Michelle Jorgensen
Found her tooth was dead #shorts;https://www.youtube.com/watch?v=ctQLcvae38U;Living Well Dr. Michelle Jorgensen
Antibiotics can cause cavities #shorts;https://www.youtube.com/watch?v=Jd63V1_6bxE;Living Well Dr. Michelle Jorgensen
