Title;Link;Creator
Scientist REVEALS the Weight Loss Diet That NEVER FAILS! (No Exaggeration) | Dr. Eric Westman;https://www.youtube.com/watch?v=Vdw0IOlXefg;Jesse Chappus
Cancer Researcher: How to STARVE CANCER Away! | Dr. Thomas Seyfried;https://www.youtube.com/watch?v=GuIk3qR-ws8;Jesse Chappus
The Father of Biohacking: The Top Biohacks to Lose Weight & AGE IN REVERSE | Dave Asprey;https://www.youtube.com/watch?v=Xg46TrtRIPE;Jesse Chappus
Youve Been LIED TO About What to Eat! (Proper Human Diet REVEALED) | Dr. Ken Berry;https://www.youtube.com/watch?v=HCm3gXCJ7Ng;Jesse Chappus
Scientist Reveals NEW DATA on Fat, Metabolism & WEIGHT LOSS | Dr. William Li;https://www.youtube.com/watch?v=C84ioVuOsRg;Jesse Chappus
Diabetes Expert: If You DO THIS Your Insulin Resistance Will Be NORMAL AGAIN! | Dr. Ahmet Ergin;https://www.youtube.com/watch?v=hfTxySbxS90;Jesse Chappus
Cancer Breakthrough: Unconventional but Effective Therapy for Cancer Treatment | Dr. Thomas Seyfried;https://www.youtube.com/watch?v=g4EY9WWuSR8;Jesse Chappus
The TOP FOODS You Need to Eat to BURN FAT and Heal the Body | Dr. William Li;https://www.youtube.com/watch?v=NtENbQ8Asj8;Jesse Chappus
The Fasting Doctor: Use These FASTING SECRETS to Lose Weight and PREVENT CANCER | Dr. Jason Fung;https://www.youtube.com/watch?v=PTmrAREDtjo;Jesse Chappus
The WORST FOODS You Will Never Eat Again After WATCHING THIS! | Dave Asprey;https://www.youtube.com/watch?v=I9eLO6zL3FE;Jesse Chappus
The TOP FOODS You Need to STOP EATING to Heal the Brain! (Fix Your Mental Health) | Dr. Chris Palmer;https://www.youtube.com/watch?v=2Eyio0jutjc;Jesse Chappus
Hack Your GENETICS to Fight Disease & Look 10 Years YOUNGER! (Reverse Aging) | Kashif Kahn;https://www.youtube.com/watch?v=xqXnewXbgp4;Jesse Chappus
Biohacking Expert: DO THIS to Reduce Inflammation & LIVE LONGER | Dr. Molly Maloof;https://www.youtube.com/watch?v=g9NXi8lz0wY;Jesse Chappus
NEW SCIENCE to Help Your Dog Live Longer & PREVENT DISEASE | Dr. Karen Becker;https://www.youtube.com/watch?v=I-OeLIZ43xU;Jesse Chappus
Mastering Genes Expert: DO THIS to Reduce Your Biological Age & LIVE LONGER! | Dr. Kara Fitzgerald;https://www.youtube.com/watch?v=BI86FzKVsjM;Jesse Chappus
The TRUE Cause of Weight Gain & How to Actually BURN FAT! | Dr. David Ludwig;https://www.youtube.com/watch?v=FrmIDIGJ6UE;Jesse Chappus
Neuroscientist REVEALS How to Get the BEST SLEEP of Your Life (Start Tonight!) | Russell Foster;https://www.youtube.com/watch?v=PNxYrUvrglU;Jesse Chappus
Start Doing This to LOSE FAT & Build Muscle at the SAME TIME | Dr. Gabrielle Lyon;https://www.youtube.com/watch?v=NWs2YMiMbQU;Jesse Chappus
The TOP FOODS to Build Muscle, Burn Body Fat & PREVENT DISEASE | Stan Efferding;https://www.youtube.com/watch?v=SJ3Mfyuig_I;Jesse Chappus
Fasting for Women: How to DO IT CORRECTLY to Lose Weight & PREVENT DISEASE | Dr. Mindy Pelz;https://www.youtube.com/watch?v=Zahd_3N72hk;Jesse Chappus
The Worlds SIMPLEST Weight-Loss Program (6 EASY STEPS) | Liz Josefsberg;https://www.youtube.com/watch?v=2uI2_EdiUSo;Jesse Chappus
The MAIN CAUSES of Cancer & What You Can Do to PREVENT IT (New Paradigm) | Dr. Jason Fung;https://www.youtube.com/watch?v=EldOKG5206c;Jesse Chappus
DO THIS to Heal the Body & Mind WITHOUT MEDICATION | Dr. Nicole LePera;https://www.youtube.com/watch?v=C_kKBi57bPA;Jesse Chappus
Let Food Be Thy Medicine: The New Science of Eating Well | Tim Spector;https://www.youtube.com/watch?v=aLjWR_8N9rA;Jesse Chappus
Use These PSYCHOLOGICAL TRICKS to Immediately Be More Charismatic & CONFIDENT! | Vanessa Van Edwards;https://www.youtube.com/watch?v=gpYEkTgc0nY;Jesse Chappus
The TOP FOODS You Absolutely SHOULD AVOID! (Do Not Eat These Foods) | Dr. William Li;https://www.youtube.com/watch?v=tTp6e49D-wQ;Jesse Chappus
How Fred Evrard Went From Stage 3 Colon Cancer to NO CANCER Detected in 4 Months;https://www.youtube.com/watch?v=guVaMaubbWU;Jesse Chappus
Neurologist Reveals the ROOT CAUSES of Cognitive Decline and How to Prevent & REVERSE IT;https://www.youtube.com/watch?v=ErtIggpx6rk;Jesse Chappus
Why Youre NOT HEALTHY in Life & How to FIX IT! Shawn Stevenson;https://www.youtube.com/watch?v=u3X4x78yPvQ;Jesse Chappus
The 5 SUPERFOODS You Need to Eat for LONGEVITY! | Max Lugavere;https://www.youtube.com/watch?v=qypYES-heVw;Jesse Chappus
Trauma Expert: How You Can Start Healing From Trauma Today | Dr. Paul Conti;https://www.youtube.com/watch?v=jpTom5t7GW0;Jesse Chappus
Start Doing THIS to Melt the Fat Away & BUILD MUSCLE | Sal Di Stefano;https://www.youtube.com/watch?v=j5nU8P-0Dzs;Jesse Chappus
BOUNDARIES: You Need to Start Setting Them in Every RELATIONSHIP! | Melissa Urban;https://www.youtube.com/watch?v=fVKyIjZhkNk;Jesse Chappus
Use These Proven HEALTH HACKS to Reduce Inflammation & PREVENT DISEASE | Dr. Roger Seheult;https://www.youtube.com/watch?v=qIGesQ_YwWg;Jesse Chappus
DO THIS to Harness Your Brains 4 Characters & Live With DEEP INNER PEACE | Dr. Jill Bolte Taylor;https://www.youtube.com/watch?v=dXBZ4Ta2xR0;Jesse Chappus
Get Rid of Diabetes Once and for All | Dr. Jason Fung;https://www.youtube.com/watch?v=_LF1Bue56eA;Jesse Chappus
LIVE LONGER: What to Eat & When to Eat for LONGEVITY | Dave Asprey;https://www.youtube.com/watch?v=GjqmHlBcJd4;Jesse Chappus
How to Use DOPAMINE as a SUPERPOWER in the Age of Addiction | Dr. Anna Lembke;https://www.youtube.com/watch?v=s1uvFKTrto8;Jesse Chappus
Former Monk: DO THIS to Manifest What You REALLY WANT in Life | Dandapani;https://www.youtube.com/watch?v=UBTicBGmgyI;Jesse Chappus
The DAILY HACKS to Lose Weight & Prevent Disease | Mike Mutzel;https://www.youtube.com/watch?v=LqVVJqaT6zk;Jesse Chappus
Psychologist Reveals the BEST WAYS to Stop Overthinking and REDUCE STRESS | Dr. Julie Smith;https://www.youtube.com/watch?v=PHU3bEtyDkg;Jesse Chappus
How to Get FIBER FUELED to Heal the Gut & Activate INSANE BENEFITS | Dr. Will Bulsiewicz;https://www.youtube.com/watch?v=41Q9lan3iEI;Jesse Chappus
Unlock Your Brains FULL POTENTIAL and Achieve ANY GOAL in Life | John Assaraf;https://www.youtube.com/watch?v=cZVMJVf-m_I;Jesse Chappus
DO THIS to Turn Your Bodys Fat Storage Switch off & STOP Gaining Weight | Dr. Richard Johnson;https://www.youtube.com/watch?v=QiIi2kId5MM;Jesse Chappus
DO THIS to Find Your PURPOSE in Life! | Jenna Kutcher;https://www.youtube.com/watch?v=bXQKr8gdWeg;Jesse Chappus
Retired Navy SEAL: How to Develop VALUABLE SKILLS That Will Make You SELF-RELIANT | Clint Emerson;https://www.youtube.com/watch?v=oYBPBFwbr7E;Jesse Chappus
Feeling LOST, LAZY & UNMOTIVATED in Life? You Need to WATCH THIS! | Chervin Jafarieh;https://www.youtube.com/watch?v=kv29UgDcnmc;Jesse Chappus
The 4 Things You NEED to Know for Optimal GUT HEALTH (Its So Simple!) | Tim Spector;https://www.youtube.com/watch?v=3iNNeFTEAp0;Jesse Chappus
The Surprising Solution to CLIMATE CHANGE (Do This Today!) | Seth Godin;https://www.youtube.com/watch?v=S1seirfuXck;Jesse Chappus
Doctor REVEALS the Diet & Lifestyle She Used to REVERSE Her Multiple Sclerosis | Dr. Terry Wahls;https://www.youtube.com/watch?v=8Uge7yEVXIQ;Jesse Chappus
Eat This SUPERFOOD to Lose Weight & PREVENT DISEASE! | Dr Jeffrey Bland;https://www.youtube.com/watch?v=Y4JO4X7Ruv4;Jesse Chappus
The SHOCKING TRUTH About Sadness & Creativity NOBODY TALKS ABOUT! | Susan Cain;https://www.youtube.com/watch?v=roepQIu9VkA;Jesse Chappus
Fix Your Diet & Lifestyle to Optimize Metabolic Health: Reverse Insulin Resistance & Prevent Disease;https://www.youtube.com/watch?v=PgUvvpovPVk;Jesse Chappus
The DAILY HACKS to Heal the Body & Mind WITHOUT MEDICATION | Dr. Andrew Weil;https://www.youtube.com/watch?v=Me-l-q7_VvI;Jesse Chappus
Alanis Morissette on Living Healthy to Enhance Mind, Body & Life;https://www.youtube.com/watch?v=jy6R4d-4ZQc;Jesse Chappus
Use These FOOD HACKS to Reduce Inflammation & LOSE WEIGHT | Jessie Inchauspé;https://www.youtube.com/watch?v=pu3ooHLZJM8;Jesse Chappus
This DIET & LIFESTYLE Helps Torrey DeVitto Manage Her MENTAL HEALTH;https://www.youtube.com/watch?v=842ENogX1OI;Jesse Chappus
The BITTER TRUTH About Sugar & How It POISONS YOU! | Dr. Robert Lustig;https://www.youtube.com/watch?v=XH6Rg9I858E;Jesse Chappus
DO THESE 3 Things Every Morning to COMPLETELY CHANGE Your Life! | Dr. Rangan Chatterjee;https://www.youtube.com/watch?v=6QamOMFObDc;Jesse Chappus
Use These SIMPLE TECHNIQUES to Control Your Mind & ELIMINATE NEGATIVE THOUGHTS | Dr. Ethan Kross;https://www.youtube.com/watch?v=OVXS2fs9cWI;Jesse Chappus
Holistic Psychiatrist REVEALS How to Calm Your Anxiety & RELEASE STRESS | Dr. Ellen Vora;https://www.youtube.com/watch?v=fCmiJq5WpbA;Jesse Chappus
How to EAT CLEAN While Keeping Things Fun & FLEXIBLE | Daphne Oz;https://www.youtube.com/watch?v=6U8t5w9OV1k;Jesse Chappus
Let Food Be Thy Medicine: Eat These Foods to STARVE CANCER & Heal the Body | Dr. William Li;https://www.youtube.com/watch?v=AKroMKDq2zg;Jesse Chappus
Psychotherapist REVEALS How to Set Healthy Boundaries & Stop Getting PUSHED AROUND | Terri Cole;https://www.youtube.com/watch?v=e4Xlmj_ZFi8;Jesse Chappus
EVERYTHING Youve Been Told About Weight Loss Is WRONG! | Dr. Jason Fung;https://www.youtube.com/watch?v=r__S72nt6sg;Jesse Chappus
Psychologist REVEALS How to Reprogram Your SUBCONSCIOUS MIND | Dr. Nicole LePera;https://www.youtube.com/watch?v=wjYn6V49eqI;Jesse Chappus
Intermittent Fasting for WOMEN: You Need to KNOW THIS! | Cynthia Thurlow;https://www.youtube.com/watch?v=tBGYsKoFXik;Jesse Chappus
THESE Are the Top Foods & Supplements for Getting Rid of LEAKY GUT | Dr. Josh Axe;https://www.youtube.com/watch?v=RIWX_6eJDBk;Jesse Chappus
Nobel Prize Winner: The MIRACLE MOLECULE for Health You Have NEVER HEARD OF | Dr. Louis Ignarro;https://www.youtube.com/watch?v=S-eIVzG_DU8;Jesse Chappus
THIS Is How Josh Peck Lost 127 Pounds & BEAT ADDICTION;https://www.youtube.com/watch?v=JChcspmm3E4;Jesse Chappus
New Science REVEALS What You Know About the KETO DIET Is All WRONG! | Dr. Steven Gundry;https://www.youtube.com/watch?v=ipF9WPxHlSI;Jesse Chappus
SURPRISING SOLUTIONS for a Better Nights SLEEP! | Diane Macedo;https://www.youtube.com/watch?v=0SEq0gAcy6U;Jesse Chappus
How to REFRAME REGRET & Use It to Your ADVANTAGE | Daniel Pink;https://www.youtube.com/watch?v=iXUnTjWGAXc;Jesse Chappus
THESE Could Be Signs You Have UNHEALED TRAUMA & How to Begin to Heal Today | Gabby Bernstein;https://www.youtube.com/watch?v=4zxIqw9hF-8;Jesse Chappus
Uric Acid: A KEY Cause of Weight Gain & INSULIN RESISTANCE (Lower It Today!) | Dr. David Perlmutter;https://www.youtube.com/watch?v=CigUTP_K634;Jesse Chappus
FEELING STUCK in Life? This Is How to RESPOND! | Kute Blackson;https://www.youtube.com/watch?v=XUr-iFGZkBY;Jesse Chappus
Gut Health Expert REVEALS the Microbiome Strategies for AGE-REVERSAL | Dr. William Davis;https://www.youtube.com/watch?v=wMWy2Rg6Ul4;Jesse Chappus
How to Harness the HEALING POWER OF MUSIC to Transform Your MIND & LIFE | RIOPY;https://www.youtube.com/watch?v=AT54_mLpW2o;Jesse Chappus
DO THIS to Optimize Female Hormone Health for WEIGHT LOSS & Vitality | Dr. Sara Gottfried;https://www.youtube.com/watch?v=QasokDURLmk;Jesse Chappus
CUTTING-EDGE SCIENCE on How to End Your ANXIETY | Dr. Robin Berzin;https://www.youtube.com/watch?v=e0XrRUvQJRE;Jesse Chappus
THIS Is the Secret to Fixing Your GUT HEALTH! | Tina Anderson;https://www.youtube.com/watch?v=B0OT4JOY7R8;Jesse Chappus
The BITTER TRUTH About Sugar & How It Causes INFLAMMATION | Julie Daniluk;https://www.youtube.com/watch?v=6n_7Kq9DGb4;Jesse Chappus
Neuroscientist: How to Make Anxiety Your SUPERPOWER | Dr. Wendy Suzuki;https://www.youtube.com/watch?v=bWfpm6djJ7k;Jesse Chappus
If You DO THIS Your Insulin Resistance Will Be Normal FAST! | Dr. Ben Bikman;https://www.youtube.com/watch?v=PCKs0dy-32Q;Jesse Chappus
DO THIS to Transform Your Brain and YOUR LIFE! | Vishen Lakhiani;https://www.youtube.com/watch?v=2Luqicni59o;Jesse Chappus
AGE IN REVERSE: What to Eat & When to Eat for LONGEVITY (Live Beyond 100 Years Old) | Dan Buettner;https://www.youtube.com/watch?v=lWJDicrBBqc;Jesse Chappus
Psychologist REVEALS the Secrets to Reaching Your FULL POTENTIAL | Scott Barry Kaufman;https://www.youtube.com/watch?v=4Z-ppRan6_I;Jesse Chappus
Use These SIMPLE TRICKS to Develop Psychological Flexibility & END YOUR SUFFERING | Dr. Steven Hayes;https://www.youtube.com/watch?v=yZxJ20opO4E;Jesse Chappus
Use the CLEAN PROGRAM to Detox Your MIND & BODY! | Dr. Alejandro Junger;https://www.youtube.com/watch?v=MV-E9qcsd_Q;Jesse Chappus
If You Want to INCREASE YOUR LIFESPAN & Reverse Your Age, WATCH THIS! | Dr. Valter Longo;https://www.youtube.com/watch?v=ySvFDv1RPQE;Jesse Chappus
DO THIS to Reclaim Your Wild, Happy, HEALTHY SELF | Michael Easter;https://www.youtube.com/watch?v=hR62AYc9T4s;Jesse Chappus
DO THIS to Develop the Mindset of a Winner & SUCCEED IN LIFE! | Tony Horton;https://www.youtube.com/watch?v=NljHT7ruWV8;Jesse Chappus
EAT THIS WAY to Reduce Inflammation & Improve Your HEALTH! | Jessica Murnane;https://www.youtube.com/watch?v=W6Piescqews;Jesse Chappus
Breathing Expert: Start Breathing THROUGH YOUR NOSE to Change Your Life | Patrick McKeown;https://www.youtube.com/watch?v=r0nKZnW9ye4;Jesse Chappus
EAT THESE FOODS to Heal the Body & RELIEVE ANXIETY | Liana Werner-Gray;https://www.youtube.com/watch?v=EdyaT_BlFoc;Jesse Chappus
WARNING: This Wont Make You Happy & How to Find TRUE HAPPINESS in Life | Moby;https://www.youtube.com/watch?v=9j_QH7886q8;Jesse Chappus
Holistic Vet: NEW SCIENCE on the Best & Worst DOG FOODS | Dr. Karen Becker;https://www.youtube.com/watch?v=ahIfFQbqHmE;Jesse Chappus
How to Use WATER FASTING to Lose Weight & REVERSE YOUR AGE | Dr. Alan Goldhamer;https://www.youtube.com/watch?v=jPTMtOjZrH8;Jesse Chappus
Holocaust Survivor: How to Overcome Any Obstacle in Life | Dr. Edith Eger;https://www.youtube.com/watch?v=GkxCCcXmILQ;Jesse Chappus
Start Each Morning by DOING THIS to End Procrastination & NEVER BE LAZY AGAIN! | Mel Robbins;https://www.youtube.com/watch?v=5Nm97O8Mc84;Jesse Chappus
DO THIS to Boost Your Energy, Beat Burnout & Take Back YOUR HEALTH! | Dr. Amy Shah;https://www.youtube.com/watch?v=j9PfFVqBxhU;Jesse Chappus
Dr. Andrew Weil on Finding His Unique Approach to Medicine;https://www.youtube.com/watch?v=a4Wj_fs051o;Jesse Chappus
DO THIS to Stop Others From Manipulating You & FIND PEACE | Nedra Glover Tawwab;https://www.youtube.com/watch?v=IN53nGhlQZE;Jesse Chappus
Harvard Professor: REVEALING the Truth About EXERCISE | Daniel Lieberman;https://www.youtube.com/watch?v=_F5AZDRwMI8;Jesse Chappus
PANDAS, PANS or Lyme Disease Impacting Your Kid? Take Back Their STOLEN CHILDHOOD | Dr. Kenneth Bock;https://www.youtube.com/watch?v=SnaQCqDQ8-4;Jesse Chappus
The Secret to WINNING on & off the RACE TRACK | Danica Patrick;https://www.youtube.com/watch?v=GTb6Y6KsmAU;Jesse Chappus
THIS Is the SECRET to a Long & HEALTHY LIFE | Jon Levy;https://www.youtube.com/watch?v=P5AgJI-nMwY;Jesse Chappus
WHAT TO EAT to Beat Depression & ANXIETY | Dr. Drew Ramsey;https://www.youtube.com/watch?v=n9XTRC1Elmc;Jesse Chappus
DO THIS to Move On, Let Go & LEAVE YOUR PAST IN THE PAST With Leading Psychotherapist Julia Samuel;https://www.youtube.com/watch?v=S6QZBIs6LdY;Jesse Chappus
Use DIET & LIFESTYLE to Reverse Autoimmune DISEASE! | Laurel Gallucci aka Sweet Laurel;https://www.youtube.com/watch?v=l752ZTIBapk;Jesse Chappus
How to REINVENT YOURSELF & Achieve What You Truly Want in LIFE | Alyson Stoner;https://www.youtube.com/watch?v=luAd9nFBKHQ;Jesse Chappus
THIS Will Make You a PRODUCTIVITY MASTER | Greg McKeown;https://www.youtube.com/watch?v=CUPthkMsXkA;Jesse Chappus
How to Use Byron Katies 4 QUESTIONS to Get Out of a NEGATIVE HEADSPACE (Start Now!);https://www.youtube.com/watch?v=yit4lkU0r7c;Jesse Chappus
DO THIS to Transform Your HEALTH & HAPPINESS | Fearne Cotton;https://www.youtube.com/watch?v=ZrAWA5RXCV0;Jesse Chappus
When LIFE IS HARD & Youre Feeling Lost, WATCH THIS! | Anne Lamott;https://www.youtube.com/watch?v=GgoInuOOZSc;Jesse Chappus
What to Eat & When to Eat - How to Burn Fat & Achieve Metabolic Flexibility | Mark Sisson;https://www.youtube.com/watch?v=71_yLF4Behw;Jesse Chappus
No. 1 Fitness Expert: How Jillian Michaels Climbed to the Top of the Health & Wellness Space;https://www.youtube.com/watch?v=btzSJilzgLQ;Jesse Chappus
How to Find the Right DIET & EXERCISE Routine to Enhance Your BODY & MIND | Wade Lightheart;https://www.youtube.com/watch?v=_I5LVQW-qpA;Jesse Chappus
Breath Expert: Use This SIMPLE BREATHING TECHNIQUE to Transform Your BODY & MIND! | James Nestor;https://www.youtube.com/watch?v=tgX4cL7Eeuk;Jesse Chappus
What Is CONSCIOUSNESS? Everything You Know Is FALSE | Annaka Harris;https://www.youtube.com/watch?v=opO2832_gTY;Jesse Chappus
THE IODINE MYTH: Is It Destroying Your THYROID? | Dr. Alan Christianson;https://www.youtube.com/watch?v=DoGaoRYNM9U;Jesse Chappus
If You STRUGGLE With a Mental Health Challenge, WATCH THIS! | Mayim Bialik;https://www.youtube.com/watch?v=5YX0VPDRw-0;Jesse Chappus
Psychology Professor REVEALS How to Be TRULY HAPPY | Tal Ben-Shahar;https://www.youtube.com/watch?v=_m7HgTFCtUQ;Jesse Chappus
EVERYTHING Youve Been Told About Skincare Is WRONG! | Andy Hnilo;https://www.youtube.com/watch?v=yNlJ9i0G8ys;Jesse Chappus
THIS Is Destroying Your HAPPINESS & How to FIX IT | Melissa Ambrosini;https://www.youtube.com/watch?v=0wTKhzOPGMg;Jesse Chappus
How to Use FOOD AS MEDICINE to Heal Your BODY! | Laura Prepon;https://www.youtube.com/watch?v=PEySsg2Zg9E;Jesse Chappus
Use MEDITATION to Enhance Your MIND, BODY & LIFE | Henry Shukman;https://www.youtube.com/watch?v=SbsPmJQEhSo;Jesse Chappus
"DON'T EAT These ""Healthy"" Foods, Theyre Killing Your ENERGY! | Dr. Steven Gundry";https://www.youtube.com/watch?v=nmjvdKJ5MDE;Jesse Chappus
Doctor REVEALS the Steps to Completely Restore Your GUT HEALTH | Dr. Tom OBryan;https://www.youtube.com/watch?v=tdnxl7FFeeA;Jesse Chappus
DO THIS to Completely Heal Your BODY & MIND! | Dr. Caroline Leaf;https://www.youtube.com/watch?v=M6D8bSqokGI;Jesse Chappus
USE THESE MINI-HABITS to Truly THRIVE in All Parts of Your Life! | Arianna Huffington;https://www.youtube.com/watch?v=z6KNXM5we1o;Jesse Chappus
This Is the SECRET to Getting What You WANT IN LIFE | Matthew McConaughey;https://www.youtube.com/watch?v=yPe62R1RLiQ;Jesse Chappus
How to Heal Your Mind & OVERCOME ANXIETY | Dr. Jud Brewer;https://www.youtube.com/watch?v=1B9f9CuQYY0;Jesse Chappus
USE THESE Proven Email Strategies to Boost Productivity & FOCUS | Cal Newport;https://www.youtube.com/watch?v=032dGEewtyA;Jesse Chappus
Rachel Hollis Shares Her SECRETS for Staying Strong During the TOUGHEST YEARS of Your Life;https://www.youtube.com/watch?v=HAcdNA-M8oY;Jesse Chappus
FAST THIS WAY to Lose Weight and REDUCE Inflammation | Dr. Will Cole;https://www.youtube.com/watch?v=tRn9L8SYdBk;Jesse Chappus
Are you Suffering? WATCH THIS! | Tana Amen;https://www.youtube.com/watch?v=eO9KtvWxtNY;Jesse Chappus
Money Expert: How to Build Wealth & Never Go Broke | Rachel Cruze;https://www.youtube.com/watch?v=Mj5nwemPzyk;Jesse Chappus
Doctor REVEALS How to Heal Your BODY & MIND | Dr. Josh Axe;https://www.youtube.com/watch?v=JJKTFk4DFak;Jesse Chappus
How to Fast THE RIGHT WAY to Lose Weight & AGE IN REVERSE | Dave Asprey;https://www.youtube.com/watch?v=beVWdxqJSGM;Jesse Chappus
Enter FLOW STATE to Do the IMPOSSIBLE | Steven Kotler;https://www.youtube.com/watch?v=mzg5yD5Xuxs;Jesse Chappus
Use a PLANT-BASED DIET to Heal Your BODY & MIND | Andrea Hannemann (Earthy Andy);https://www.youtube.com/watch?v=mhEW6sIwruo;Jesse Chappus
How to THRIVE When Life Becomes CHAOTIC & UNCERTAIN | Sarah Wilson;https://www.youtube.com/watch?v=rSqwIr8roCU;Jesse Chappus
Alicia Silverstone on How to Live Clean and Sustainably With a Vegan Diet & Lifestyle;https://www.youtube.com/watch?v=vz1I51KJvO8;Jesse Chappus
Its Impossible to Eat Like Our Ancestors | Dr. Bill Schindler;https://www.youtube.com/watch?v=w4ZUO7WLevg;Jesse Chappus
The Correct Way to Supplement With Collagen | Dr. James DiNicolantonio;https://www.youtube.com/watch?v=ejWEL9sB3p0;Jesse Chappus
If You Eat Meat You Need to Know This | Dr. James DiNicolantonio;https://www.youtube.com/watch?v=ZsGGLeEK8zI;Jesse Chappus
The SURPRISING TRUTH About High Blood Pressure and SALT! | Dr. James DiNicolantonio;https://www.youtube.com/watch?v=hTLlTSpWUmE;Jesse Chappus
Does Drinking Coffee Actually Break a Fast? | Ben Azadi;https://www.youtube.com/watch?v=IRbKnaQp91M;Jesse Chappus
Archaeologist Explains How Humans Evolved With Alcohol (Drunken Money Hypothesis) | Dr. Schindler;https://www.youtube.com/watch?v=dDVSvqU753U;Jesse Chappus
Carbs AREN'T Causing Insulin Resistance, Its Actually THIS... | Dr. Tommy Wood;https://www.youtube.com/watch?v=vX3eUxOOgNg;Jesse Chappus
Archaeologist: What Did Our Ancestors Actually Eat? | Dr. Bill Schindler;https://www.youtube.com/watch?v=9urCi1wDKhQ;Jesse Chappus
Everything You NEED to Know about Salt | Dr. Bill Schindler;https://www.youtube.com/watch?v=ADD16qkqhCs;Jesse Chappus
Youve Been LIED TO About What They Eat in the BLUE ZONES | Dr. Bill Schindler;https://www.youtube.com/watch?v=c-LNVo8n0kA;Jesse Chappus
Why the Carnivore Diet Didnt Work for Kayla Barnes (+ What She Eats Now);https://www.youtube.com/watch?v=O6ea5K1qeQw;Jesse Chappus
Youll NEVER Lose the Stubborn Belly Fat Until You FIX THIS! | Ben Azadi;https://www.youtube.com/watch?v=3zYlwJZSlVU;Jesse Chappus
The REAL Role of ATP (Its NOT What You Think) | Dr. Stephen Hussey;https://www.youtube.com/watch?v=MydBDtw5okk;Jesse Chappus
What Happens to Your Brain When You Sleep? (+ How to Optimize It) | Dr. Tommy Wood;https://www.youtube.com/watch?v=qru-J4KPt7s;Jesse Chappus
Neuroscientist Explains What Caffeine ACTUALLY Does to Your Brain | Dr. Tommy Wood;https://www.youtube.com/watch?v=Zfmfs27i8Xk;Jesse Chappus
The Surprising Benefit of DHA That Nobody Talks About | Dr. Stephen Hussey;https://www.youtube.com/watch?v=3wOWi1RWI0w;Jesse Chappus
Neuroscientist Reveals the TRUTH About Methylene Blue | Dr. Tommy Wood;https://www.youtube.com/watch?v=ufaAuD5xhpI;Jesse Chappus
Neuroscientist Reveals Everything You NEED to Know About Creatine | Dr. Tommy Wood;https://www.youtube.com/watch?v=pVdiOAipnDI;Jesse Chappus
You Might Want to STOP Supplementing With Vitamin D After WATCHING THIS! | Dr. Stephen Hussey;https://www.youtube.com/watch?v=lH3S47_-Tdw;Jesse Chappus
Eating Plants Will RUIN Your Health, UNLESS... | Dr. Stephen Hussey;https://www.youtube.com/watch?v=GVtllG5u8Lw;Jesse Chappus
DO THIS Every Morning to SLEEP BETTER at Night (Simple & Free) | Dr. Stephen Hussey;https://www.youtube.com/watch?v=uZkaScAlUDA;Jesse Chappus
What Fascia REALLY Does in Your Body | Dr. Stephen Hussey;https://www.youtube.com/watch?v=01OHnFxnRx0;Jesse Chappus
The INSANE BENEFITS of Ketosis for Your Body & Brain! | Ben Azadi;https://www.youtube.com/watch?v=bToVsOqRawQ;Jesse Chappus
Kayla Barnes-Lentzs Longevity Routine (Diet, Supplements, Exercise and HBOT);https://www.youtube.com/watch?v=3k2dpQ8SI8M;Jesse Chappus
Private video;https://www.youtube.com/watch?v=nOneeH-44bs;Jesse Chappus
Easy at Home Quiz for Insulin Resistance (6 Questions) | Ben Azadi;https://www.youtube.com/watch?v=Cmh64uqSOeA;Jesse Chappus
Methylene Blue, Ginkgo Biloba and Other Top Brain Boosters | Ben Azadi;https://www.youtube.com/watch?v=FdnThReLRs4;Jesse Chappus
The Worlds Easiest Fat Loss Hacks You Can Start Today | Ben Azadi;https://www.youtube.com/watch?v=O0HTVc1lo88;Jesse Chappus
Doctors Won't Tell You This! - What Happens if You ONLY Drink WATER for 100 Hours? | Ben Azadi;https://www.youtube.com/watch?v=8KS4J1qvh18;Jesse Chappus
Biological Dentist REVEALS the Perfect Diet to FIX YOUR MOUTH & Overall Health | Dr. Dome;https://www.youtube.com/watch?v=QuEvLVPT31o;Jesse Chappus
Most Probiotics Are KILLED by the Gut but NOT THESE ONES... | Kiran Krishnan;https://www.youtube.com/watch?v=xCfxT4dMRB0;Jesse Chappus
If You Have METAL in Your Mouth, You Need to WATCH THIS! | Dr. Dominik Nischwitz;https://www.youtube.com/watch?v=XiIy5QCBjJc;Jesse Chappus
This Is Slowly Destroying Your Microbiome | Kiran Krishnan;https://www.youtube.com/watch?v=hO9c-Y9rrus;Jesse Chappus
Biological Dentist: Danger of Root Canals & What to Do Instead | Dr. Dominik Nischwitz;https://www.youtube.com/watch?v=9WVyaCxNGwE;Jesse Chappus
If Youve Had Your Wisdom Teeth Removed, You Need to Watch This! | Dr. Dominik Nischwitz;https://www.youtube.com/watch?v=v9tTTPCl9xs;Jesse Chappus
Fermented Foods Dont Work the Way You Think They Do | Kiran Krishnan;https://www.youtube.com/watch?v=WlRNOmo4N7M;Jesse Chappus
A Microbiologists Guide to Fixing the Root Cause of SIBO | Kiran Krishnan;https://www.youtube.com/watch?v=XhI6CGekrcc;Jesse Chappus
Is an All Meat Diet Good or Bad for Your Microbiome? | Kiran Krishnan;https://www.youtube.com/watch?v=-YRTCTS-uaA;Jesse Chappus
This Toxic Chemical Is Being Used to Wash Produce (Likely Organic Too) | Kiran Krishnan;https://www.youtube.com/watch?v=K6RQOjGMYbY;Jesse Chappus
You Will Never Look at Probiotics the Same Way Again | Kiran Krishnan;https://www.youtube.com/watch?v=lVUkfMXi0hY;Jesse Chappus
14 Minutes to Save You 14+ Years of Trying to Optimize Your Microbiome | Kiran Krishnan;https://www.youtube.com/watch?v=GbR2Z0JC0Uw;Jesse Chappus
The Shocking Truth About LA's Toxic Air Quality Post Fires | Kayla Barnes;https://www.youtube.com/watch?v=4ZjLuPCB8SA;Jesse Chappus
Top Biohacks to Transform Your Body & Mind | Kayla Barnes;https://www.youtube.com/watch?v=X7ry2ztByqw;Jesse Chappus
What Blue Light Actually Does to Your Body | Dr. Joseph Allen;https://www.youtube.com/watch?v=GYBDmkZfQZc;Jesse Chappus
How to Transform Your Mental Health With Diet & Lifestyle | Dr. Chris Palmer;https://www.youtube.com/watch?v=DPohEtP84GM;Jesse Chappus
This Scary Toxin Could Be Lurking in Your Home Causing Disease | Dr. Anthony Gustin;https://www.youtube.com/watch?v=bfj1lm3B8dY;Jesse Chappus
You Will Never Consume THIS Again After WATCHING THIS! | Dr. Anthony Gustin;https://www.youtube.com/watch?v=xq3PiHVDXjI;Jesse Chappus
